term_id,term,term_url,de,en,fr,ja,pl,pt,zh
511-01-01,device,https://www.electropedia.org/iev/iev.nsf/display?openform&ievref=511-01-01,"Einrichtung, fGerät, nBauelement, n",device,"dispositif, m",デバイス,"przyrząd, murządzenie, n",dispositivo,器件装置
511-01-02,molecular electronics,https://www.electropedia.org/iev/iev.nsf/display?openform&ievref=511-01-02,"molekulare Elektronik, f",molecular electronics,"électronique moléculaire, f",分子エレクトロニクス,"elektronika molekularna, f",eletrónica molecular,分子电子学
511-01-03,nanoscale,https://www.electropedia.org/iev/iev.nsf/display?openform&ievref=511-01-03,"Nanomaßstab, m",nanoscale,"échelle nanométrique, f",ナノスケール,"nanoskala, f",escala nanométricananoescala,纳米尺度
511-01-04,nanomaterial,https://www.electropedia.org/iev/iev.nsf/display?openform&ievref=511-01-04,"Nanomaterial, n",nanomaterial,"nanomatériau, m",ナノ材料,"nanomateriał, m",nanomaterial,纳米材料
511-01-05,engineered nanomaterial,https://www.electropedia.org/iev/iev.nsf/display?openform&ievref=511-01-05,"technisches Nanomaterial, n",engineered nanomaterial,"nanomatériau d’ingénierie, m",工学ナノ材料工業ナノ材料,"nanomateriał inżynierski, mnanomateriał zaprojektowany, m",nanomaterial de engenharia,工程化纳米材料
511-01-06,manufactured nanomaterial,https://www.electropedia.org/iev/iev.nsf/display?openform&ievref=511-01-06,"industriell hergestelltes Nanomaterial, n",manufactured nanomaterial,"nanomatériau manufacturé, m",工業ナノ材料製造ナノ材料,"nanomateriał wytworzony, mnanomateriał produkowany, m",nanomaterial manufaturado,人造纳米材料
511-01-07,nano-object,https://www.electropedia.org/iev/iev.nsf/display?openform&ievref=511-01-07,"Nanoobjekt, n",nano-object,"nano-objet, m",ナノ物体,"nanoobiekt, mnanoprzedmiot, m",nano-objeto,纳米物体
511-01-08,nanostructure,https://www.electropedia.org/iev/iev.nsf/display?openform&ievref=511-01-08,"Nanostruktur, f",nanostructure,"nanostructure, f",ナノ構造,"nanostruktura, f",nanoestrutura,纳米结构
511-01-09,nanostructured material,https://www.electropedia.org/iev/iev.nsf/display?openform&ievref=511-01-09,"nanostrukturiertes Material, n",nanostructured material,"matériau nanostructuré, m",ナノ構造化材料ナノ構造材料,"materiał nanostrukturalny, m",material nanoestruturado,纳米结构材料
511-01-10,nanofibre,https://www.electropedia.org/iev/iev.nsf/display?openform&ievref=511-01-10,"Nanofaser, f",nanofibre,"nanofibre, f",ナノファイバナノファイバー,"nanowłókno, n",nanofibra,纳米纤维
511-01-11,nanoplate,https://www.electropedia.org/iev/iev.nsf/display?openform&ievref=511-01-11,"Nanoplättchen, n",nanoplate,"nanoplaque, f",ナノプレート,"nanopłytka, fnanopłyta, f",nanoplaca,纳米片
511-01-12,nanoparticle,https://www.electropedia.org/iev/iev.nsf/display?openform&ievref=511-01-12,"Nanopartikel, n",nanoparticle,"nanoparticule, f",ナノ粒子,"nanocząstka, f",nanopartícula,纳米颗粒
511-01-13,nano-electromechanical system,https://www.electropedia.org/iev/iev.nsf/display?openform&ievref=511-01-13,"nano-elektromechanisches System, nNEMS",nano-electromechanical systemNEMS,"système nanoélectromécanique, mNEMS, m",ナノ電気機械システムNEMS,"układ nanoelektromechaniczny, mNEMS",sistema nanoeletromecânicoNEMS,纳米机电系统
511-01-14,nanoelectronics,https://www.electropedia.org/iev/iev.nsf/display?openform&ievref=511-01-14,"Nanoelektronik, f",nanoelectronics,"nanoélectronique, f",ナノエレクトロニクス,"nanoelektronika, f",nanoeletrónica,纳米电子学
511-01-15,"nano-enabled, adj",https://www.electropedia.org/iev/iev.nsf/display?openform&ievref=511-01-15,"nanobasiert, Adjektiv","nano-enabled, adj","nanotechnologique, adj",ナノ発現性,"nanotechnologiczny, m","nanotecnológico, adj",纳米赋能的
511-01-16,nano-enabled device,https://www.electropedia.org/iev/iev.nsf/display?openform&ievref=511-01-16,"nanobasiertes Bauelement, n",nano-enabled device,"dispositif nanotechnologique, m",ナノデバイス,"urządzenie nanotechnologiczne, n",dispositivo nanotecnológico,纳米赋能设备
511-01-17,nano-ink,https://www.electropedia.org/iev/iev.nsf/display?openform&ievref=511-01-17,"Nanotinte, f",nano-ink,"nano-encre, f",ナノインク,"nanoatrament, m",nanotinta,纳米墨水
511-01-18,nanomanipulator,https://www.electropedia.org/iev/iev.nsf/display?openform&ievref=511-01-18,"Nanomanipulator, m",nanomanipulator,"nanomanipulateur, m",ナノマニピュレーター,"nanomanipulator, m",nanomanipulador,纳米操纵器
511-01-19,nanoscale electric contact,https://www.electropedia.org/iev/iev.nsf/display?openform&ievref=511-01-19,"nanoskaliger elektrischer Kontakt, mnanoskaliger Kontakt, m",nanoscale electric contactnanoscale contact,"contact électrique nanométrique, mcontact nanométrique, m",ナノスケール電気接合,"elektryczne złącze nanoskalowe, nelektryczne złącze wykonane w nanoskali, n",contacto elétrico nanométricocontacto nanométrico,纳米电接触纳米接触
511-01-20,nanoscale contact resistance,https://www.electropedia.org/iev/iev.nsf/display?openform&ievref=511-01-20,"nanoskaliger Kontaktwiderstand, m",nanoscale contact resistance,"résistance de contact nanométrique, f",ナノスケール接触抵抗,"rezystancja złącza nanoskalowego, frezystancja złącza wykonanego w nanoskali, f",resistência de contacto nanométrico,纳米接触电阻
511-01-21,nanoscale device,https://www.electropedia.org/iev/iev.nsf/display?openform&ievref=511-01-21,"nanoskaliges Bauelement, n",nanoscale device,"nanodispositif, m",ナノスケールデバイス,"urządzenie nanoskalowe, nnanourządzenie, n",nanodispositivodispositivo nanométrico,纳米器件
511-01-22,nanoscale electric interconnect,https://www.electropedia.org/iev/iev.nsf/display?openform&ievref=511-01-22,"nanoskalige elektrische Verbindung, fnanoskalige Verbindung, f",nanoscale electric interconnectnanoscale interconnect,"interconnexion électrique à l'échelle nanométrique, finterconnexion nanométrique, f",ナノスケール電気接続,"nanopołączenie elektryczne, nnanopołączenie, npołączenie za pomocą złączy wykonanych w nanoskali, n",interconexão elétrica de escala nanométricainterconexão nanométrica,纳米电连接纳米级连接
511-01-23,nano-subassembly,https://www.electropedia.org/iev/iev.nsf/display?openform&ievref=511-01-23,"Nanobaugruppe, f",nano-subassembly,"sous-ensemble nanométrique, m",ナノ部品,"podzespół nanoskalowy, m",subconjunto nanométrico,纳米级组件
511-01-24,nanowire,https://www.electropedia.org/iev/iev.nsf/display?openform&ievref=511-01-24,"Nanodraht, m",nanowire,"nanofil, m",ナノワイヤ,"nanodrut, mnanoprzewód, m",nanofio,纳米线
511-01-25,single-electron transistor,https://www.electropedia.org/iev/iev.nsf/display?openform&ievref=511-01-25,"Einzelelektronentransistor, m",single-electron transistor,"transistor à un électron, m",単電子トランジスタ,"tranzystor jednoelektronowy, m",transístor a eletrão único,单电子晶体管
511-02-01,dye-sensitized photovoltaic cell,https://www.electropedia.org/iev/iev.nsf/display?openform&ievref=511-02-01,"Farbstoffphotovoltaikzelle, fDSSC",dye-sensitized photovoltaic cellDSSC,"cellule photovoltaïque à colorant, fDSSC, f",色素増感太陽電池DSSCDSC,"ogniwo fotowoltaiczne barwnikowe, nDSSC",célula fotovoltaica a coranteDSSC,染料敏化光伏电池
511-02-02,nanowire photovoltaic cell,https://www.electropedia.org/iev/iev.nsf/display?openform&ievref=511-02-02,"Nanodraht-Photovoltaikzelle, f",nanowire photovoltaic cell,"cellule photovoltaïque à nanofils, f",ナノワイヤ太陽電池,"ogniwo fotowoltaiczne z nanodrutów, n",célula fotovoltaica a nanofios,纳米线光伏电池
511-02-03,organic electronics,https://www.electropedia.org/iev/iev.nsf/display?openform&ievref=511-02-03,"organische Elektronik, fOEPolymerelektronik, fPlastikelektronik, f",organic electronicsOEpolymer electronicsplastics electronics,"électronique organique, fEO, félectronique des polymères, félectronique des plastiques, f",有機エレクトロニクス,"elektronika organiczna, fOEelektronika polimerów, felektronika tworzyw sztucznych",eletrónica orgânicaEOeletrónica dos polímeroseletrónica dos plásticos,有机电子学聚合物电子学塑胶电子学
511-02-04,organic and large area electronics,https://www.electropedia.org/iev/iev.nsf/display?openform&ievref=511-02-04,"organische und großflächige Elektronik, fOLAE",organic and large area electronicsOLAE,"électronique organique pour grandes surfaces, f",大面積有機エレクトロニクス,"elektronika organiczna dużych powierzchni, fOLAE",eletrónica orgânica para grandes superfíciesOLAE,有机和大面积电子学
511-02-05,organic light emitting diode,https://www.electropedia.org/iev/iev.nsf/display?openform&ievref=511-02-05,"organische lichtemittierende Diode, fOLED",organic light emitting diodeOLED,"diode électroluminescente organique, fOLED, f",有機発光ダイオードOLED,"dioda elektroluminescencyjna organiczna, fOLED",díodo emissor de luz orgânicoOLED,有机发光二极管
511-02-06,organic photovoltaic device,https://www.electropedia.org/iev/iev.nsf/display?openform&ievref=511-02-06,"organisches Photovoltaik-Bauelement, nOPV",organic photovoltaic deviceOPV,"dispositif photovoltaïque organique, mOPV, m",有機太陽電池素子OPV,"urządzenie fotowoltaiczne organiczne, nOPV",dispositivo fotovoltaico orgânicoOPV,有机光伏器件
511-02-07,plasmonic photovoltaic cell,https://www.electropedia.org/iev/iev.nsf/display?openform&ievref=511-02-07,"plasmonische Photovoltaikzelle, f",plasmonic photovoltaic cell,"cellule photovoltaïque plasmonique, f",プラズモニック太陽電池,"ogniwo fotowoltaiczne plazmoniczne, nogniwo fotowoltaiczne wykorzystujące plazmony, n",célula fotovoltaica plasmónica,电浆光伏电池
511-02-08,quantum well photovoltaic cell,https://www.electropedia.org/iev/iev.nsf/display?openform&ievref=511-02-08,"Quantentopf-Photovoltaikzelle, fQuantentrog-Photovoltaikzelle, f",quantum well photovoltaic cell,"cellule photovoltaïque à puits quantique, f",量子井戸太陽電池,"ogniwo fotowoltaiczne oparte na studni kwantowej, n",célula fotovoltaica a poço quântico,量子阱光伏电池
511-02-09,quantum well,https://www.electropedia.org/iev/iev.nsf/display?openform&ievref=511-02-09,"Quantentopf, mQuantentrog, m",quantum well,"puits quantique, m",量子井戸,"studnia kwantowa, f",poço quântico,量子阱
511-03-01,quantum dot,https://www.electropedia.org/iev/iev.nsf/display?openform&ievref=511-03-01,"Quantenpunkt, m",quantum dot,"boîte quantique, f",量子ドット,"kropka kwantowa, f",ponto quântico,量子点
511-03-02,luminescent nanomaterial,https://www.electropedia.org/iev/iev.nsf/display?openform&ievref=511-03-02,"lumineszierendes Nanomaterial, n",luminescent nanomaterial,"nanomatériau luminescent, m",蛍光性ナノ材料,"nanomateriał luminescencyjny, m",nanomaterial luminescente,发光纳米材料
