term_id,term,term_url,ar,de,en,es,fr,it,ja,ko,pl,pt,sv,zh
723-06-32,contrast range (of a picture signal source),https://www.electropedia.org/iev/iev.nsf/display?openform&ievref=723-06-32,مدى التباين (في مصدر إشارة الصورة),"Kontrastumfang, <eines Bildsignalgebers> m",contrast range (of a picture signal source),contraste maximal (de una fuente de señales de imagen),contraste maximal (d'une source de signaux d'image) m,campo del contrasto (dell'immagine),"コントラスト範囲, <画像信号源>","명암대비 범위, <영상 신호원>",zakres kontrastu (źródła sygnału obrazu),contraste máximo (de uma fonte de sinais de imagem),maximalkontrast hos bildgivare,
723-06-33,contrast range (of a display),https://www.electropedia.org/iev/iev.nsf/display?openform&ievref=723-06-33,مدى التباين (في العرض),"Kontrastumfang, <einer Bildwiedergabeeinrichtung> m",contrast range (of a display),contraste maximal (de un dispositivo sintetizador),"contraste maximal d'un dispositif synthétiseur, m",campo del contrasto (dello schermo),"コントラスト範囲, <ディスプレイ>","명암대비 범위, <표시 장치>",zakres kontrastu (urządzenia syntezującego),contraste máximo de um dispositivo sintetizador,maximalkontrast hos bildåtergivare,
723-06-34,(system) gamma (in television),https://www.electropedia.org/iev/iev.nsf/display?openform&ievref=723-06-34,(نظام) جاما (في التلفاز),"Über-alles-Gamma, <im Fernsehen> n",(system) gamma (in television),gamma global (en televisión),gamma global (en télévision) m,(valore del) gamma (del sistema),"ガンマ, <テレビジョン>","감마, <텔레비전>",współczynnik gamma (w telewizji),sistema gama (em televisão),systemgamma,
723-06-35,video signal source gamma,https://www.electropedia.org/iev/iev.nsf/display?openform&ievref=723-06-35,مصدر اشعة جاما للإشارة المرئية,"Gamma des Bildsignalgebers, n",video signal source gamma,gamma en el análisis,"gamma à l'analyse, m",(valore del) gamma della sorgente del segnale video,画像信号のガンマ,영상 신호원 감마,współczynnik gamma źródła sygnału wizyjnego,gama na análise,bildsignalgamma,
723-06-36,display gamma,https://www.electropedia.org/iev/iev.nsf/display?openform&ievref=723-06-36,عرض جاما,"Gamma der Bildwiedergabeeinrichtung, n",display gamma,gamma en la síntesis,"gamma à la synthèse, m",(valore del) gamma dello schermo (visualizzatore),ディスプレイのガンマ,표시 감마디스플레이 감마,współczynnik gamma syntezy obrazu,gama na síntese,bildgivargamma,
723-06-37,gamma correction,https://www.electropedia.org/iev/iev.nsf/display?openform&ievref=723-06-37,تصحيح جاما,"Gammakorrektur, f",gamma correctioncontrast ratio correction,corrección de contrastecorrección de gamma,"correction de gamma, fcorrection de contraste, f",correzione del gamma,ガンマ補正,감마 정정,korekcja współczynnika kontrastu korekcja gamma,correcção de contrastecorrecção de gama,gammakorrektion,
723-06-38,grey scale distortion,https://www.electropedia.org/iev/iev.nsf/display?openform&ievref=723-06-38,تشوه التدرج الرمادي,"Grauwertfehler, m",grey scale distortion,distorsión de la escala de gris,"distorsion (de l'échelle) des gris, fdistorsion de demi-teinte, f",distorsione della scala dei grigi,グレースケールのひずみ,무채색 색표 왜곡,zniekształcenie skali szarości,distorção (da escala) dos cinzentos,gråskaledistorsion,
723-06-39,black-level shift,https://www.electropedia.org/iev/iev.nsf/display?openform&ievref=723-06-39,إزاحة مستوى السواد,"Schwarzwertfehler, mKlemmfehler, m",black-level shiftclamp fault,defecto de mantenimiento (del nivel de negro)desplazamiento del nivel de negro,"défaut d'alignement (du niveau du noir), mdéfaut de clampage, m",spostamento del livello del nero,黒レベルの移動,흑 레벨 편차고정 결함,przesunięcie poziomu czerni,distorção de alinhamento (do nível do preto),svartnivåfel,
723-06-40,white crushing (of a television picture),https://www.electropedia.org/iev/iev.nsf/display?openform&ievref=723-06-40,تحطيم البياض ( لصورة التلفاز),"Weißstauchung, <im Fernsehbild> f",white crushing (of a television picture),aglomeración de blancos,"écrasement des blancs, m",schiacciamento del bianco,白づまり,"백색 분쇄, <텔레비전 영상>",obcinanie bieli (w obrazie telewizyjnym),esmagamento dos brancos,vittryckning,
723-06-41,black crushing (of a television picture),https://www.electropedia.org/iev/iev.nsf/display?openform&ievref=723-06-41,تحطيم السواد ( لصورة التلفاز),"Schwarzstauchung, <im Fernsehbild> f",black crushing (of a television picture),aglomeración de negros,"écrasement des noirs, m",schiacciamento del nero,黒づまり,"흑색 분쇄, <텔레비전 영상>",obcinanie czerni (w obrazie telewizyjnym),esmagamento dos pretos,svarttryckning,
723-06-42,line-time luminance distortion,https://www.electropedia.org/iev/iev.nsf/display?openform&ievref=723-06-42,تشوة نصوع الخط-الزمن,"horizontaler Luminanzfehler, m",line-time luminance distortion,distorsión de luminancia horizontal,"distorsion de luminance horizontale, fdistorsion de luminosité horizontale, f",distorsione della luminanza durante la riga,水平方向輝度ひずみ,선 시간 휘도 왜곡,zniekształcenie luminancji w kierunku poziomym,distorção de luminância horizontal,horisontellt luminansfel,
723-06-43,field-time luminance distortion,https://www.electropedia.org/iev/iev.nsf/display?openform&ievref=723-06-43,تشوة  نصوع المجال-الزمن,"vertikaler Luminanzfehler, m",field-time luminance distortion,distorsión de luminancia vertical,"distorsion de luminance verticale, fdistorsion de luminosité verticale, f",distorsione della luminanza durante il quadro,垂直方向輝度ひずみ,필드 시간 휘도 왜곡,zniekształcenie luminancji w kierunku pionowym,distorção de luminância vertical,vertikalt luminansfel,
723-06-44,edge flare,https://www.electropedia.org/iev/iev.nsf/display?openform&ievref=723-06-44,توهج الحافة,"Kantenüberstrahlung, f",edge flare,sobreluminancia de bordes,"surluminance de bord, f",sovraluminanza ai bordi,エッジフレア,가장자리 플레어,zniekształcenie luminancji brzegów obrazuzniekształcenie luminancji brzegów,sobreluminância de bordo,kantöverlysning,
723-06-45,background,https://www.electropedia.org/iev/iev.nsf/display?openform&ievref=723-06-45,الخلفية,"Grundhelligkeit, f",background,luminancia de fondo,"luminance de fond, f",sfondo,背景,배경,luminancja tła,luminância de fundo,bakgrundsluminans,
723-06-46,blooming,https://www.electropedia.org/iev/iev.nsf/display?openform&ievref=723-06-46,تفتح,"Überbelichtungseffekt, m",blooming,ecIosión,éclat (en télévision) m,sovraluminanza,ブルーミング,초점 번짐,ultrabiel,reflexo (em televisão),övermättning,
723-06-47,shading,https://www.electropedia.org/iev/iev.nsf/display?openform&ievref=723-06-47,تظليل,"Abschattierung, f",shading,desuniformidad,non-uniformité (d'une image) ftache (d'une image) (déconseillé dans ce sens) f,disuniformità,シェージング,음영셰이딩농담,rozmycie obrazu,não uniformidade (de uma imagem),skuggning,
723-06-48,rectification effect,https://www.electropedia.org/iev/iev.nsf/display?openform&ievref=723-06-48,تأثير التقويم,"Gleichrichteffekt, m",rectification effect,efecto de rectificación,"effet de redressement, m",effetto di aumento (della luminosità media),整流効果,정류 효과,efekt prostowania,efeito de rectificação,liktriktningsfel,
723-06-49,blemish,https://www.electropedia.org/iev/iev.nsf/display?openform&ievref=723-06-49,عيب - شائبة,"Fehlstelle, f",blemish,mancha,tache (de tube analyseur ou de tube image) f,macchia,"欠陥, <センサ面，ディスプレイ画面>",오점,plamy,mancha (da válvula analisadora ou da válvula de imagem),blemma,
723-06-50,banding,https://www.electropedia.org/iev/iev.nsf/display?openform&ievref=723-06-50,تحزيم,"Bändereffekt, m",bandingheadbanding,efecto de persiana,"effet de persienne, m",effetto persiana,バンディング,밴딩헤드밴딩띠변색,efekt żaluzjowy,efeito de persiana,persienneffekt,
723-06-51,convergence (in a display),https://www.electropedia.org/iev/iev.nsf/display?openform&ievref=723-06-51,تقارب (في  العرض),"Konvergenz, <bei einer Bildwiedergabeeinrichtung> f",convergence (in a display),convergencia (en un dispositivo sintetizador),convergence (dans un dispositif synthétiseur) f,convergenza,"集中, <ディスプレイ>","수렴, <표시 장치>집중, <표시 장치>",współbieżność (w odtwarzaniu),convergência (num dispositivo sintetizador),konvergens,
723-06-52,static convergence,https://www.electropedia.org/iev/iev.nsf/display?openform&ievref=723-06-52,تقارب ساكن,"statische Konvergenz, f",static convergence,convergencia estética,"convergence statique, f",convergenza statica,静集中,정적 수렴정적 집중,współbieżność statyczna,convergência estática,statisk konvergens,
723-06-53,dynamic convergence,https://www.electropedia.org/iev/iev.nsf/display?openform&ievref=723-06-53,تقارب حركي,"dynamische Konvergenz, f",dynamic convergence,convergencia dinámica,"convergence dynamique, f",convergenza dinamica,動集中,동적 수렴동적 집중,współbieżność dynamiczna,convergência dinâmica,dynamisk konvergens,
723-06-54,faulty convergence,https://www.electropedia.org/iev/iev.nsf/display?openform&ievref=723-06-54,تقارب معيب,"Konvergenzfehler, m",faulty convergence,convergencia defectuosadefecto de convergencia,"défaut de convergence, m",difetto di convergenza,集中の欠除,결함 수렴,współbieżność wadliwa,defeito de convergência,konvergensfel,
723-06-55,registration,https://www.electropedia.org/iev/iev.nsf/display?openform&ievref=723-06-55,التسجيل,"Farbdeckung, f",registration,superposición,superposition (des primaires) (à l'analyse) f,registrazione (della convergenza),重ね合せレジストレーション,등록,regulacja zbieżności,sobreposição (dos primários) (na análise),färgpassningfärgtäckning,
723-06-56,dynamic misregistration,https://www.electropedia.org/iev/iev.nsf/display?openform&ievref=723-06-56,تسجيل خاطئ حركي,"dynamischer Farbdeckungsfehler, mdynamischer Deckungsfehler, m",dynamic misregistration,error de superposición dinámica,"erreur de superposition dynamique, f",errore di convergenza dinamica,動的重ね合わせのずれ動的レジストレーションずれ,동적 오기,rozregulowanie zbieżności dynamicznej,erro de sobreposição dinâmica,dynamiskt färgpassningsfel,
723-06-57,colorimetric distortion,https://www.electropedia.org/iev/iev.nsf/display?openform&ievref=723-06-57,تشوة قياس الالوان,"Farbfehler, m",colorimetric distortion,distorsión calorimétrica,"distorsion colorimétrique, f",distorsione colorimetrica,色ひずみ,비색 왜곡,zniekształcenia kolorymetryczne,distorção colorimétrica,kromacitetsfel,
723-06-58,grey scale tracking,https://www.electropedia.org/iev/iev.nsf/display?openform&ievref=723-06-58,تتبع التدريج الرمادي,"Grauwertabgleich, m",grey scale tracking,reglaje del gris,"réglage des gris, m",regolazione della scala dei grigi,グレースケール調整,무채색 추적,regulacja szarości,regulação dos cinzentos,gråbalansering,
723-06-59,side locking (of the sub-carrier),https://www.electropedia.org/iev/iev.nsf/display?openform&ievref=723-06-59,قَفل جانيي ( في الحامل الثانوي ),"Fehleinrastung, <des Farbträgers> f",side locking (of the sub-carrier),bloqueo lateral (de la subportadora),calage à côté (de la sous-porteuse) m,sincronizzazione (su banda) laterale,色副搬送波ロッキングのずれ,"측면 로킹, <부반송파>측면 잠금, <부반송파>",przemieszczenie boczne (podnośnej),bloqueio lateral (da subportadora),sidbandslåsning,
723-06-60,purity (in a colour television display),https://www.electropedia.org/iev/iev.nsf/display?openform&ievref=723-06-60,نقـاوة (في عرض التلفاز الملون),"Farbreinheit, <einer Farbfernseh-Bildwiedergabeeinrichtung> f",purity (in a colour television display),pureza (de un color) primario,pureté (d'une couleur primaire) (en télévision) f,purezza,純度,"순도, <컬러 텔레비전 표시장치>",czystość koloru (w telewizji),pureza (de uma cor primária) (em televisão),färgrenhet,
723-06-61,chrominance-luminance delay inequality,https://www.electropedia.org/iev/iev.nsf/display?openform&ievref=723-06-61,تباين تأخير الضوء واللون,"Chrominanz-Luminanz-Versatz, m",chrominance-luminance delay inequality,retardo entre crominancia y luminancia,"retard chrominance-luminance, m",diseguaglianza di ritardo fra luminanza e crominanza,色度・輝度信号の遅延不一致,색차-휘도 지연 불균등,nierówność opóźnienia chrominancji i luminancji.,atraso crominância-luminância,krominans-Iuminansförskjutning,
723-06-62,image retention,https://www.electropedia.org/iev/iev.nsf/display?openform&ievref=723-06-62,إحتفاظ الصورة,"Nachwirkeffekt, m",image retention,retención de imagen,"(défaut de) rémanence, f",permanenza dell'immagine,残留画像,영상 정체,zatrzymywanie obrazu,(defeito de) remanescência,bildavtryck,
723-06-63,comet tail,https://www.electropedia.org/iev/iev.nsf/display?openform&ievref=723-06-63,ذيل مذنبِ,"Kometschweif, m",comet tail,efecto de cola de cometa,"traînage dynamique, meffet de queue de comète, m",effetto a coda di cometa,コメットテイル,혜성꼬리코멧 테일,efekt ogona komety,arrasto dinâmico,kometsvans,
723-06-64,noise (on a television picture),https://www.electropedia.org/iev/iev.nsf/display?openform&ievref=723-06-64,شوشرة (على صورة التلفاز),"Rauschen, <im Fernsehbild> n",noise (on a television picture),ruido (sobre una imagen de televisión),bruit (sur une image) msouffle (sur une image) (terme désuet) m,rumore,"雑音, <テレビジョン画像の>","잡음, <텔레비전 영상>",szum (na obrazie telewizyjnym),ruído (sobre uma imagem),brus,
723-06-65,hum bars (on a picture),https://www.electropedia.org/iev/iev.nsf/display?openform&ievref=723-06-65,قضبان طنين  (على صورة ),"Brummstreifen, <im Fernsehbild> m pl",hum bars (on a picture),bandas de zumbido (sobre una imagen),ronflement (sur une image) m,barre di ronzio,ハムバー,"험 바, <영상>험 띠, <영상>",zakłócenia sieciowe (na obrazie),ronco (sobre uma imagem),brumränder,
723-06-66,crosscolour noise,https://www.electropedia.org/iev/iev.nsf/display?openform&ievref=723-06-66,شوشرة تقاطع الألوان,"Farbübersprechrauschen, n",crosscolour noise,ruido de cruce de colores,"bruit de diaphotie, m",rumore di diafotia luminanza-crominanza,クロスカラー雑音,교차 색상 잡음,szum prześwitu,ruído de cruzamento de cores,,
723-06-67,subcarrier dot pattern,https://www.electropedia.org/iev/iev.nsf/display?openform&ievref=723-06-67,نمط النقطة لناقل فرعى,"Farbträgerstruktur, f",subcarrier dot pattern,visibilidad de la portadora,"visibilité de la sous-porteuse, f",visibilità della sottoportante,副搬送波ドットパタン,부반송파 점 유형,widzialność podnośnej,visibilidade (da subportadora),prickmönster,
723-06-68,moiré (in television),https://www.electropedia.org/iev/iev.nsf/display?openform&ievref=723-06-68,التموج ( في التلفاز) ),"Moiré, <im Fernsehen> m",moiré (in television),baño (en televisión),moirure (en télévision) fmoirage (en télévision) (terme déconseillé) m,moirè,モアレ,"물결 무늬 현상, <텔레비전>무아레, <텔레비전>",mora (w telewizji),muaré (em televisão),moaré,
723-06-69,crosstalk (in television),https://www.electropedia.org/iev/iev.nsf/display?openform&ievref=723-06-69,تقاطع الكلام (في التلفاز),"Übersprechen, <im Fernsehen> n",crosstalk (in television)crossview,superposición de imágenes,"diaphotie, f",diafonia,漏話,"누화, <텔레비전>교차시야, <텔레비전>",prześwit (w telewizji),sobreposição de imagens,överhörning,
723-06-70,crosscolour,https://www.electropedia.org/iev/iev.nsf/display?openform&ievref=723-06-70,تقاطع لون,"Farbübersprechen, n",crosscolourcolour crosstalk,superposición de luminancia sobre crominancia,"diaphotie luminance-chrominance, f",diafotia luminanza-crominanza,クロスカラー,교차 색상색상 혼입,prześwit koloru,sobreposição de luminância sobre crominância,luminans-krominansöverhöming,
723-06-71,crossluminance,https://www.electropedia.org/iev/iev.nsf/display?openform&ievref=723-06-71,تقاطع النصوع,"Luminanzübersprechen, n",crossluminance,superposición de crominancia sobre luminancia,"diaphotie chrominance-luminance, f",diafotia crominanza-luminanza,クロスルーミナンス,휘도 혼입,prześwit chrominancji,sobreposição de crominância sobre luminância,krominans-Iuminansöverhöming,
723-06-72,quadrature crosstalk,https://www.electropedia.org/iev/iev.nsf/display?openform&ievref=723-06-72,حديث تربيع متبادل,"Quadraturübersprechen, n",quadrature crosstalk,superposición por cuadratura,"diaphotie de quadrature, f",diafotia di quadrartura,直角漏話,직교 누화,prześwit kwadraturowy,sobreposição por quadratura,,
723-06-73,flare,https://www.electropedia.org/iev/iev.nsf/display?openform&ievref=723-06-73,يتوهج,"Überstrahlung, f",flare,(distorsión por) luminosidad parásita,"(distorsion de) lumière parasite, f",sovraluminanza,フレア,플레어난반사,składowe niepożądane (w obrazie),(distorção por) luz parasita,ströljus,
723-06-74,ghost,https://www.electropedia.org/iev/iev.nsf/display?openform&ievref=723-06-74,شبح,"Geisterbild, nEcho, <im Fernsehen> n",ghostecho (in television),eco (en televisión)imagen fantasma,"écho (en télévision) mimage fantôme, f",immagine dovuta ad eco,ゴースト,허상반향,zjawy (w telewizji),eco (em televisão)imagem fantasma,spökbild,
723-06-75,multiple image,https://www.electropedia.org/iev/iev.nsf/display?openform&ievref=723-06-75,صورة متعددة,"Mehrfachecho, <im Fernsehen> n",multiple image,eco múltiple,écho multiple (en télévision) m,immagine multipla,多重像,다중상복상,wielokrotność obrazu,eco múltiplo (em televisão),"spökbildståg ,",
723-06-76,sound on vision,https://www.electropedia.org/iev/iev.nsf/display?openform&ievref=723-06-76,ظهور صوت على الصورة,"Ton-im-Bild, m",sound on vision,sonido en la imagen,"son dans l'image, m",(interferenza del) suono sull'immagine,"画像の音声による妨害, <テレビジョン受信機>",영상 음향,dźwięk na wizji,som na imagem,ljudstörning i bild,
723-06-77,picture-sound lag,https://www.electropedia.org/iev/iev.nsf/display?openform&ievref=723-06-77,تأخر الصوت عن الصورة,"Bild-Ton-Versatz, m",picture-sound lagpicture-sound desynchronization,desincronización imagen sonido,"décalage image-son, mdésynchronisation image-son, f",ritardo fra suono ed immagine,画像と音のずれ,영상-음향 지연영상-음향 비동기화,desynchronizacja obrazu i dźwięku,decalagem imagem-som,bild-ljudeftersläpning,
723-06-78,television test pattern,https://www.electropedia.org/iev/iev.nsf/display?openform&ievref=723-06-78,نمط اختبار التلفاز,"Fernsehtestbild, n",television test patterntelevision test card,imagen patrón (de televisión),"mire (de télévision), f",immagine televisiva di prova,テストパターン,텔레비전 시험 유형텔레비전 시험 카드,obraz telewizyjny kontrolny,mira (de televisão),testbild,
723-06-79,resolution test chart,https://www.electropedia.org/iev/iev.nsf/display?openform&ievref=723-06-79,مخطط اختبار درجة الوضوح,"Auflösungstestbild, n",resolution test chart,patrón de definición,"mire de définition, f",immagine di prova della risoluzione,解像度テストチャート,해상도 시험 도표화질 시험 도표,obraz kontrolny rozdzielczości,mira de definição,skärpetestbild,
723-06-80,NBS test chart,https://www.electropedia.org/iev/iev.nsf/display?openform&ievref=723-06-80,"مخطّط ""فوكولت""","NBS-Testbild, n",NBS test chart,patrón de definición por barras,"mire de Foucault, f",immagine di prova NBS,NBSテストチャート,엔비에스 시험 도표미국 규격 표준국 시험 도표,karta kontrolna NBS,mira de Foucault,NBS-testbild,
723-06-81,geometry test chart,https://www.electropedia.org/iev/iev.nsf/display?openform&ievref=723-06-81,مخطّط إختباري هندسي,"Geometrietestbild, n",geometry test chart,patrón geométrico,"mire de géométrie, f",immagine di prova della geometria,図形ひずみテストチャート,기하학 시험 도표,karta kontrolna geometrii (obrazu),mira de geometria,geometritestbild,
723-06-82,streak test pattern,https://www.electropedia.org/iev/iev.nsf/display?openform&ievref=723-06-82,نموذج اختبار وجود أثر,"Fahnentestbild, n",streak test pattern,patrón de arrastre,"mire de traînage, f",immagine di prova del trascinamento,ストリーキング用テストパターン,자국 시험 유형,obraz kontrolny smużenia,mira de arrasto,svansdistorsionsmönster,
723-06-83,colour bars,https://www.electropedia.org/iev/iev.nsf/display?openform&ievref=723-06-83,قضبان   الألوان,"Farbbalkensignal, nFarbbalken, m",colour bars,patrón de barras,mire de barres (de couleur) f,barre di colore,カラーバー,색 막대색 바,obraz kontrolny pasów kolorowych,mira de barras (de cor),färgbalksignal,
723-06-84,grey scale,https://www.electropedia.org/iev/iev.nsf/display?openform&ievref=723-06-84,تدريج الرمادي,"Grauwerttestbild, n",grey scale,escala de gris,"échelle des gris, fmire de demi-teinte (terme désuet) féchelle des demi-teintes (terme désuet) f",scala dei grigi,グレースケール,무채색 색표,skala szarości,escala dos cinzentos,gråskala,
723-06-85,registration chart,https://www.electropedia.org/iev/iev.nsf/display?openform&ievref=723-06-85,مخطّط إختبار التقارب,"Konvergenztestbild, n",registration chart,patrón de convergencia,"mire de convergence, f",immagine per la regolazione (della convergenza),レジストレーションチャート,레지스트레이션 도표등록 도표,karta współbieżności,mira de convergência,färgpassningsmönster,
723-06-86,Kell factor,https://www.electropedia.org/iev/iev.nsf/display?openform&ievref=723-06-86,عامل كال,"Kellfaktor, m",Kell factor,factor de Kell,"facteur de Kell, m",fattore di Kell,ケルファクタ,켈 계수,współczynnik Kella,factor de Kell,Kell-faktor,
723-06-87,K-rating factor,https://www.electropedia.org/iev/iev.nsf/display?openform&ievref=723-06-87,عامل تقنين K,"K-Faktor, m",K-rating factor,factor K,"facteur К, m",fattore K,KファクタK評価因子,케이 평가 인수,współczynnik K,factor K,K-faktor,
723-06-88,quality scale,https://www.electropedia.org/iev/iev.nsf/display?openform&ievref=723-06-88,مقياس الجودة,"Qualitätsskala, f",quality scale,escala de calidad,"échelle de qualité, f",scala di qualità,品質尺度,품질 척도,skala jakości,escala de qualidade,kvalitetsskala,
723-06-89,impairment scale,https://www.electropedia.org/iev/iev.nsf/display?openform&ievref=723-06-89,مِقياس ضعفِ,"Beeinträchtigungsskala, f",impairment scale,escala de degradación,"échelle de dégradation, f",scala di degradazione,劣化尺度,손상 척도,skala degradacji obrazuskala degradacji,escala de degradação,försämringsskala,
723-06-90,comparison scale,https://www.electropedia.org/iev/iev.nsf/display?openform&ievref=723-06-90,مِقياس مقارنةِ,"Vergleichsskala, f",comparison scale,escala de comparación,"échelle de comparaison, f",scala di comparazione,比較尺度,대비 척도비교 척도,skala porównawcza,escala de comparação,jämföreIseskala,
723-06-91,imp (abbreviation),https://www.electropedia.org/iev/iev.nsf/display?openform&ievref=723-06-91,وحدة الضعف,"IMP-Einheit, f",imp (abbreviation)impairment unit,unidades de degradaciónunidades imp (abreviatura),"unité i.m.p., f",unità di degradazione (imp),劣化単位,아이엠피손상 단위,jednostka degradacji obrazujednostka degradacji,unidade de apariamentounidades imp (abreviatura),försämringsenhetlMP,
723-06-92,aliasing (spatial),https://www.electropedia.org/iev/iev.nsf/display?openform&ievref=723-06-92,نقص في وضوح  الصورة,"Alias-Störung, <räumlich> f",aliasing (spatial),desenlace (espacial),crénelage (d'une image) m,effetto disturbante (aliasing),エイリアシング折り返し,"에일리어싱, <공간적>스펙트럼 겹침, <공간적>",osłabianie (obrazu),ameiamento (de uma imagem),vikning,
723-06-93,anti-aliasing,https://www.electropedia.org/iev/iev.nsf/display?openform&ievref=723-06-93,تصحيح لنقص في وضوح  الصورة,"Alias-Korrektur, f",anti-aliasing,antidesenlace (espacial),"lissage (d'une image) mcorrection anticrénelage, f",correzione dell'effetto disturbante (anti-aliasing),逆エイリアシング折り返しの補償,반 에일리어싱,korekcja osłabiania (obrazu),alisamento (de uma imagem),vikningskorrektion,
723-06-94,countouring,https://www.electropedia.org/iev/iev.nsf/display?openform&ievref=723-06-94,قيلس كميّة جزئيّة,…..,countouringposterisation,(efecto de) subcuantificación,"(effet de) sous-quantification, f",effetto di sottocampionamento,偽輪郭,윤곽형성포스터 효과등고도화,efekt konturowy,(efeito de) subquantização,kontureffekt,
