term_id,term,term_url,ar,de,en,es,fi,fr,it,ja,ko,pl,pt,ru,sr,sv,zh
311-01-01,(result of a) measurement,https://www.electropedia.org/iev/iev.nsf/display?openform&ievref=311-01-01,نسبة الفقد (الإضعاف),"Messergebnis, n",(result of a) measurement,medida,mittaustulos,"(résultat de) mesure, f",fattore di smorzamentofattore di perdita,測定結果測定,측정 결과,wynik pomiaru,medidaresultado de uma medição,результат измерения,"резултат мерења, м јд",mätresultat,测量结果
311-01-02,uncertainty (of measurement),https://www.electropedia.org/iev/iev.nsf/display?openform&ievref=311-01-02,نتيجة قياس,"Messunsicherheit, f",uncertainty (of measurement),incertidumbre (de medida),mittausepävarmuus,"incertitude (de mesure), f",incertezza (di misura),測定の不確かさ不確かさ,측정 불확정도,niepewność pomiaruniepewność,incerteza (de uma medição),неопределенность (измерения),"мерна несигурност, ж јдмерна неизвесност, ж јдмерна неодређеност, ж јд",mätosäkerhet,测量不确定度不确定度
311-01-03,measurand,https://www.electropedia.org/iev/iev.nsf/display?openform&ievref=311-01-03,إرتياب (لقياس),"Messgröße, f",measurand,mesurando,mittaussuure,"mesurande, m",misurando,測定量,측정량,wielkość mierzona,mesuranda,измеряемая величина,"мерена величина, ж јд",mätstorhet,被测量
311-01-04,true value (of a quantity),https://www.electropedia.org/iev/iev.nsf/display?openform&ievref=311-01-04,قيمه مقاسة,"wahrer Wert einer Größe, mwahrer Wert, m",true value (of a quantity),valor verdadero (de una magnitud),suureen oikea arvooikea arvo,"valeur vraie (d'une grandeur), f",valore vero (di una grandezza),量の真の値真の値,량의 참값,wartość prawdziwa wielkościwartość prawdziwa,valor verdadeiro (de uma grandeza),истинное значение,"права вредност, <величине> ж јдистинита вредност , <величине> ж јд",sant (storhets)värde,量的真值真值
311-01-05,absolute error,https://www.electropedia.org/iev/iev.nsf/display?openform&ievref=311-01-05,قيمة حقيقية ( لكمية),"absolute Messabweichung, f",absolute error,error absoluto,absoluuttinen virhe,"erreur absolue, f",errore assoluto,絶対誤差,절대오차,błąd bezwzględny,erro absoluto,абсолютная погрешность,"апсолутна грешка, ж јд",absolut mätfel,绝对误差
311-01-06,conventional true value (of a quantity),https://www.electropedia.org/iev/iev.nsf/display?openform&ievref=311-01-06,خطأ مطلق,"richtiger Wert, m",conventional true value (of a quantity),valor convencionalmente verdadero,suureen oikeaksi sovittu arvooikeaksi sovittu arvo,"valeur conventionnellement vraie (d'une grandeur), f",valore convenzionalmente vero  (di una grandezza),取り決めによる真の値,량의 약정참값,wartość umownie prawdziwa wielkościwartość umownie prawdziwa,valor convencionalmente verdadeiro (de uma grandeza),действительное значение,"договорена права вредност , <величине> ж јдконвенционална истинита вредност, <величине> ж јд",konventionellt sant värde,量的约定真值约定真值
311-01-07,indication,https://www.electropedia.org/iev/iev.nsf/display?openform&ievref=311-01-07,قيمة حقيقية إصطلاحية (لكمية),"Anzeige, f",indication,indicación,näyttämä,"indication, f",indicazione,指示,지시도수,wskazanie,indicação,показания (индикация),"показивање, с јд",visning,标示值
311-01-08,indicated value,https://www.electropedia.org/iev/iev.nsf/display?openform&ievref=311-01-08,بيان,"angezeigter Wert, m",indicated value,valor indicado,näytettävä arvo,"valeur indiquée, f",valore indicato,指示値,지시값표시값,wartość wskazana,valor indicado,показанное значение,"показана вредност, ж јд",visat värde,校准示值
311-01-09,calibration,https://www.electropedia.org/iev/iev.nsf/display?openform&ievref=311-01-09,قيمة مبينة,"Kalibrierung, f",calibration,calibración,kalibrointi,"étalonnage, m",taratura,校正,교정,wzorcowanie,calibração,калибровка,"еталонирање, с јдкалибрација, ж јд",kalibrering,校准
311-01-10,calibration diagram,https://www.electropedia.org/iev/iev.nsf/display?openform&ievref=311-01-10,معايرة,"Kalibrierdiagramm, n",calibration diagram,diagrama de calibración,kalibrointidiagrammi,"diagramme d’étalonnage, m",diagramma di taratura,校正図,교정 도표교정 다이어그램,wykres wzorcowania,diagrama de calibração,калибровочная диаграмма,"дијаграм еталонирања, м јдкалибрациони дијаграм, м јд",kalibreringsdiagram,校准图
311-01-11,calibration curve,https://www.electropedia.org/iev/iev.nsf/display?openform&ievref=311-01-11,مخطط المعايرة,"Kalibrierkurve, f",calibration curve,curva de calibración,kalibrointikäyrä,"courbe d’étalonnage, f",curva di taratura,校正曲線,교정 곡선,krzywa wzorcowania,curva de calibração,калибровочная кривая,"крива еталонирања, ж јдкалибрациона крива, ж јд",kalibreringskurva,校准曲线
311-01-12,constant of a measuring instrument,https://www.electropedia.org/iev/iev.nsf/display?openform&ievref=311-01-12,منحني المعايرة,"Gerätekonstante, f",constant of a measuring instrument,constante de un aparato de medida,näyttämäkerroin,"constante d'un appareil de mesure, f",costante di uno strumento di misura,計器定数,측정기 상수계측기 상수,stała przyrządu pomiarowego,constante de um instrumento de medição,постоянная измерительного прибора,"константа мерног инструмента, ж јдконстанта мерила, ж јд",instrumentkonstant,测量仪表常数
311-01-13,verification (of calibration),https://www.electropedia.org/iev/iev.nsf/display?openform&ievref=311-01-13,ثابت (لجهاز قياس),"Verifizierung der Kalibrierung, fVerifizierung, f",verification (of calibration),verificación (de calibración),(kalibroinnint) verifiointi,"vérification (d’étalonnage), f",verifica (di taratura),検定,검정,sprawdzenie wzorcowania,verificação (de calibração),поверка (калибровки),"верификација , <еталонирања> ж јдверификација , <калибрације> ж јд",verifiering,校准的检定检定
311-01-14,(measurement) compatibility,https://www.electropedia.org/iev/iev.nsf/display?openform&ievref=311-01-14,تحقق (من المعايرة),"Verträglichkeit einer Messung, fVerträglichkeit, f",(measurement) compatibility,compatibilidad de medida,(mittauksen) yhteensopivuus(mittauksen) yhdenmukaisuus,"compatibilité (de mesure), f",compatibilità (della misura),適合性,측정 적합성,zgodność pomiaruzgodność,compatibilidade (de medição),совместимость (измерения),"компатибилност , <мерења> ж јд",mätöverensstämmelse,测量兼容性兼容性
311-01-15,traceability,https://www.electropedia.org/iev/iev.nsf/display?openform&ievref=311-01-15,توافق ((لقياس),"Rückverfolgbarkeit, f",traceability,trazabilidad,jäljitettävyys,"traçabilité, f",riferibilità,トレーサビリテイ,추적가능성,spójność pomiarowaspójność,rastreabilidade,прослеживаемость (доступность прослеживанию),"следљивост, ж јд",spårbarhet,溯源性
311-01-16,fiducial value,https://www.electropedia.org/iev/iev.nsf/display?openform&ievref=311-01-16,قابلية الاقتفاء,"Bezugswert, m",fiducial value,valor convencional,tarkkuuden viitearvo,"valeur conventionnelle, f",valore fiduciario,基底値,기준값기저값,wartość umowna,valor convencional,базовое значение,"договорена вредност, ж јд",referensvärde,引用值
311-01-17,relative error,https://www.electropedia.org/iev/iev.nsf/display?openform&ievref=311-01-17,قيمة إسنادية,"relative Messabweichung, f",relative error,error relativo,suhteellinen virhe,"erreur relative, f",errore relativo,相対誤差,상대 오차,błąd względny,erro relativo,относительная погрешность,"релативна грешка, ж јд",relativt fel,相对误差
311-01-18,fiducial error,https://www.electropedia.org/iev/iev.nsf/display?openform&ievref=311-01-18,خطأ نسبي,"bezogene Messabweichung, f",fiducial error,error reducido convencional,viitearvon suhteellinen virhe,"erreur réduite conventionnelle, f",errore in forma ridotta,基底相対誤差,기준상대 오차기저상대 오차기저오차,błąd zredukowany,erro reduzido convencional,приведенная погрешность,"сведена грешка, ж јд",relaterat fel,引用误差
311-01-19,relative uncertainty,https://www.electropedia.org/iev/iev.nsf/display?openform&ievref=311-01-19,خطأ إسنادي,"relative Messunsicherheit, f",relative uncertainty,incertidumbre relativa,suhteellinen mittausepävarmuus,"incertitude relative, f",incertezza relativa,相対不確かさ,상대 불확실성,niepewność względna,incerteza relativa,относительная неопределенность,"релативна несигурност, ж јдрелативна неизвесност, ж јдрелативна неодређеност, ж јд",relativ mätosäkerhet,相对不确定度
311-01-20,fiducial uncertainty,https://www.electropedia.org/iev/iev.nsf/display?openform&ievref=311-01-20,ارتياب نسبي,"bezogene Messunsicherheit, f",fiducial uncertainty,incertidumbre convencional,suhteutettu mittausepävarmuus,"incertitude conventionnelle, f",incertezza convenzionale,基底相対不確かさ,기저상대 불확실성기준상대 불확실성기저 불확실성,niepewność umowna,incerteza convencional,приведенная неопределенность,"сведена несигурност, ж јдсведена неизвесност, ж јдсведена неодређеност, ж јд",relaterad mätosäkerhet,引用不确定度
311-01-21,deviation (for the verification of calibration),https://www.electropedia.org/iev/iev.nsf/display?openform&ievref=311-01-21,ارتياب إسنادي,"Abweichung (der Verifizierung der Kalibrierung), f",deviation (for the verification of calibration),desviación,poikkeama,écart (pour la vérification d’étalonnage) m,deviazionescarto,偏差,"편차, 교정검증편이, 교정검증",odchyłka (w przypadku sprawdzania wzorcowania),desvio,отклонение (при поверке калибровки),"одступање, <за верификацију еталонирања> с јдодступање, <за верификацију калибрације> с јд",avvikelse,"偏差, <关于校准的检定>"
311-02-01,direct (method of) measurement,https://www.electropedia.org/iev/iev.nsf/display?openform&ievref=311-02-01,انحراف ( لأجل التحقق من المعايرة),"direkte Messung, fdirektes Messverfahren",direct (method of) measurement,(método de) medida directa,suora mittausmenetelmä,"(méthode de) mesure directe, f",(metodo di) misura diretta,直接測定法直接測定,직접측정법직접측정,metoda pomiarowa bezpośredniametoda bezpośrednia,(método de) medição directa,метод непосредственных измерений,"директна метода мерења, ж јддиректно мерење, с јд",direkt mätmetod,直接测量法直接测量
311-02-02,indirect (method of) measurement,https://www.electropedia.org/iev/iev.nsf/display?openform&ievref=311-02-02,القياس (بطريقة) مباشرة,"indirekte Messung, findirektes Messverfahren",indirect (method of) measurement,(método de) medida indirecta,epäsuora mittausmenetelmä,"(méthode de) mesure indirecte, f",(metodo di) misura indiretta,間接測定法間接測定,간접측정법간접측정,metoda pomiarowa pośredniametoda pośrednia,(método de) medição indirecta,метод косвенных измерений,"индиректна метода мерења, ж јдиндиректно мерење, с јд",indirekt mätmetod,间接测量法间接测量
311-02-03,comparison (method of) measurement,https://www.electropedia.org/iev/iev.nsf/display?openform&ievref=311-02-03,القيا س (بطريقة) غير مباشرة,"vergleichende Messung, fVergleichsmessverfahren, nVergleichsverfahren, n",comparison (method of) measurement,(método de) medida por comparación,vertausmittausmenetelmä,"(méthode de) mesure par comparaison, f",(metodo di) misura per confronto,比較測定法比較測定,비교측정법비교측정,metoda pomiarowa porównawczametoda porównawcza,(método de) medição de comparação,метод измерений сличениемметод сравнения с мерой,"метода мерења поређењем, ж јдмерење поређењем, с јд",komparationsmätmetod,比较测量法比较测量
311-02-04,substitution (method of) measurement,https://www.electropedia.org/iev/iev.nsf/display?openform&ievref=311-02-04,القياس (بطريقة) المقارنة,"substituierende Messung, fSubstitutionsmessverfahren, nSubstitutionsverfahren, n",substitution (method of) measurement,(método de) medida por sustitución,sijaismittausmenetelmä,"(méthode de) mesure par substitution, f",(metodo di) misura per sostituzione,置換測定法置換測定,치환측정법,metoda pomiarowa podstawieniametoda podstawienia,(método de) medição de substituição,метод измерений замещением,"метода мерења заменом, ж јдмерење заменом, с јд",substitutionsmätmetod,替代测量法替代测量
311-02-05,complementary (method of) measurement,https://www.electropedia.org/iev/iev.nsf/display?openform&ievref=311-02-05,القياس (بطريقة)التعويض,"komplementäre Messung, fKomplementärmessverfahren, nKomplementärverfahren, n",complementary (method of) measurement,(método de) medida por complemento,täydennysmittausmenetelmä,"(méthode de) mesure par complément, f",(metodo di) misura complementare,付加測定法付加測定,부가측정법,metoda pomiarowa dopełnieniowametoda dopełnieniowa,(método de) medição de complemento,метод измерений дополнением,"метода мерења допуњавањем, ж јдмерење допуњавањем, с јд",komplementmätmetod,互补测量法互补测量
311-02-06,differential (method of) measurement,https://www.electropedia.org/iev/iev.nsf/display?openform&ievref=311-02-06,القياس (بطريقة) التكامل,"Differenzmessung, fDifferenzmessverfahren, nDifferenzverfahren, n",differential (method of) measurement,(método de) medida diferencial,eronmittausmenetelmä,"(méthode de) mesure différentielle, f",(metodo di) misura differenziale,差動測定法差動測定,차동측정법,metoda pomiarowa różnicowametoda różnicowa,(método de) medição diferencial,дифференциальный метод измерений,"диференцијална метода мерења, ж јддиференцијално мерење, с јд",differensmätmetod,差值测量法差值测量
311-02-07,null (method of) measurement,https://www.electropedia.org/iev/iev.nsf/display?openform&ievref=311-02-07,القياس (بطريقة) تفاضلية,"Nullabgleich, mMessverfahren mit Nullabgleich, n",null (method of) measurement,(método de) medida por cero,nollausmittausmenetelmä,"(méthode de) mesure par zéro, f",(metodo di) misura (differenziale) a zero,零位測定法零位測定,영위측정법,metoda pomiarowa zerowametoda zerowa,(método de) medição de anulamento,нулевой метод измерений,"нулта метода мерења, ж јднулто мерење, с јд",nollmätmetod,零值测量法零值测量
311-02-08,beat (method of) measurement,https://www.electropedia.org/iev/iev.nsf/display?openform&ievref=311-02-08,القياس (بطريقة)صفرية,"Schwebungsmessverfahren, n",beat (method of) measurement,(método de) medida por batido,huojuntamittausmenetelmä,"(méthode de) mesure par battement, f",(metodo di) misura (differenziale) per battimento,うなり測定法うなり測定,비트 측정법맥놀이측정법,metoda pomiarowa dudnieniowametoda dudnieniowa,(método de) medição de batimento,метод измерений с использованием биения,"метода мерења избијањем, ж јдмерење избијањем, с јд",svävningsmätmetod,差拍测量法差拍测量
311-02-09,resonance (method of) measurement,https://www.electropedia.org/iev/iev.nsf/display?openform&ievref=311-02-09,القياس (بطريقة) النقر,"Resonanzmessverfahren, n",resonance (method of) measurement,(método de) medida por resonancia,resonanssimittausmenetelmä,"(méthode de) mesure par résonance, f",(metodo di) misura per risonanza,共振測定法共振測定,공진측정법,metoda pomiarowa rezonansowametoda rezonansowa,(método de) medição de ressonância,резонансный метод измерений,"метода мерења резонанцијом, ж јдмерење резонанцијом, с јд",resonansmätmetod,谐振测量法谐振测量
311-03-01,measuring instrument,https://www.electropedia.org/iev/iev.nsf/display?openform&ievref=311-03-01,القياس (بطريقة) الرنين,"Messgerät, n",measuring instrument,instrumento de medida,mittauslaite,"appareil de mesure, minstrument de mesure, m",strumento di misura,測定器,측정기계측기,przyrząd pomiarowy,instrumento de mediçãoinstrumento de medida (desaconselhado),измерительный прибор,"мерни инструмент, м јдмерило, с јд",mätinstrument,测量仪器仪表
311-03-02,indicating (measuring) instrument,https://www.electropedia.org/iev/iev.nsf/display?openform&ievref=311-03-02,جهاز قياس,"anzeigendes Messgerät, n",indicating (measuring) instrumentdisplaying (measuring) instrument,instrumento (de medida) visualizadorinstrumento (de medida) indicador,näyttävä mittauslaite,"appareil (de mesure) afficheur, mappareil (de mesure) indicateur, m",strumento (di misura) indicatore,指示測定器,지시측정기,miernikprzyrząd pomiarowy wskazującyprzyrząd wskazujący,instrumento de medição indicadorinstrumento de medição visualizador,показывающий (измерительный) приборприбор для снятия показаний,"показни мерни инструмент, м јдмерни инструмент са приказивачем, м јдмерни инструмент са дисплејом, м јд",visande instrument,显示测量仪器仪表显示仪器仪表指示测量仪器仪表指示仪器仪表
311-03-03,material measure,https://www.electropedia.org/iev/iev.nsf/display?openform&ievref=311-03-03,جهاز (قياس) بمؤشر,"Maßverkörperung, f",material measure,medida materializada,kiintomitta,"mesure matérialisée, f",campione materiale,実量器,실량기,miara materialnawzorzec miary,medida materializada,мера физической величины,"материјализована мера, ж јд",materialiserat mått,实物量具
311-03-04,electric measuring instrument,https://www.electropedia.org/iev/iev.nsf/display?openform&ievref=311-03-04,جهاز قياس نوعي,"elektrisches Messgerät, n",electric measuring instrument,instrumento eléctrico de medida,sähköinen mittauslaite,"appareil électrique de mesure, m",strumento elettrico di misura,電気測定器,전기 측정기전기 계측기,przyrząd pomiarowy elektryczny,instrumento eléctrico de medição,электрический измерительный прибор,"електрични мерни инструмент, м јд",elektriskt mätinstrument,电测量仪器仪表
311-03-05,measuring equipment,https://www.electropedia.org/iev/iev.nsf/display?openform&ievref=311-03-05,جهاز قياس كهربائي,"Messeinrichtung, fMessmittel, n",measuring equipment,equipo de medida,mittauslaitteisto,"équipement de mesure, m",apparecchio di misuraapparato di misura,計測器,계측기,sprzęt pomiarowyurządzenie pomiarowe,equipamento de medição,измерительная аппаратура,"мерна опрема, ж јд",mätutrustning,测量设备
311-03-06,measuring system,https://www.electropedia.org/iev/iev.nsf/display?openform&ievref=311-03-06,معدة قياس,"Messsystem, n",measuring system,sistema de medida,mittausjärjestelmä,"système de mesure, m",sistema di misura,計測システム,측정 시스템,układ pomiarowy,sistema de medição,измерительная система,"мерни систем, м јд",mätsystem,测量系统
311-03-07,measuring chain,https://www.electropedia.org/iev/iev.nsf/display?openform&ievref=311-03-07,نظام قياس,"Messkette, f",measuring chain,cadena de medida,mittausketju,"chaîne de mesure, f",catena di misura,測定の連鎖,측정 체인측정 사슬,łańcuch pomiarowy,cadeia de medição,измерительная цепь,"мерни ланац, м јд",mätkedja,测量链
311-03-08,intrinsic error,https://www.electropedia.org/iev/iev.nsf/display?openform&ievref=311-03-08,سلسلة القياس,"Eigenabweichung (eines Messgeräts), f",intrinsic error,error intrínseco,perusvirhe,"erreur intrinsèque, f",errore intrinseco,固有誤差,고유오차,błąd podstawowy,erro intrínseco,основная погрешность,"основна грешка, ж јдсопствена грешка, ж јдсвојствена грешка, ж јд",egenfel,固有误差基本误差
311-03-09,intrinsic uncertainty,https://www.electropedia.org/iev/iev.nsf/display?openform&ievref=311-03-09,خطأ أصيل,"Eigenunsicherheit (eines Messgeräts), f",intrinsic uncertainty,incertidumbre intrínseca,(mittauslaitteen) perusmittausepävarmuus,"incertitude intrinsèque, f",incertezza intrinseca,固有不確かさ,고유 불확실성,niepewność podstawowa,incerteza intrínseca,основная неопределенность,"основна несигурност, ж јдсопствена несигурност, ж јдсвојствена несигурност, ж јд",egen mätosäkerhet,固有不确定度基本不确定度
311-03-10,resolution,https://www.electropedia.org/iev/iev.nsf/display?openform&ievref=311-03-10,ارتياب أصيل,"Auflösung, f",resolution,resolución,erottelukyky,"résolution, f",risoluzione,分解能,해상도분해능,rozdzielczość,resolução,разрешение,"резолуција, ж јдразлагање, с јд",upplösning,分辨力
311-03-11,sensitivity (of a measuring instrument),https://www.electropedia.org/iev/iev.nsf/display?openform&ievref=311-03-11,دقة التبين,"Empfindlichkeit, f",sensitivity (of a measuring instrument),sensibilidad (de un instrumento de medida),mittauslaitteen herkkyys,sensibilité (d’un appareil de mesure) f,sensibilità,"感度, <測定器の>","감도, 계측민감도, 계측기",czułość,sensibilidade (de um instrumento de medição),чувствительность (измерительного прибора),"осетљивост , <мерног инструмента> ж јд",känslighet,"灵敏度, <关于测量仪器仪表>"
311-03-12,measuring range,https://www.electropedia.org/iev/iev.nsf/display?openform&ievref=311-03-12,حساسية (لجهاز قياس),"Messbereich, m",measuring range,campo de medida,mittausalue,"étendue de mesure, f",campo di misura,測定レンジ測定範囲,측정범위,zakres pomiarowy,gama de medição,диапазон измерений,"мерни опсег, м јдопсег мерења, м јд",mätområde,测量范围量限
311-03-13,span,https://www.electropedia.org/iev/iev.nsf/display?openform&ievref=311-03-13,مدى القياس,"Messspanne, f",span,intervalo de medida,mittausalueen leveys,"intervalle (de mesure), m",ampiezza del campo di misura,スパン,범위,przedział wskazań,intervalo (de medição),пределы измерений,"распон, м јд",spann,量程
311-03-14,(nominal) range,https://www.electropedia.org/iev/iev.nsf/display?openform&ievref=311-03-14,تباعد (في قياس ما),"Nennbereich, m",(nominal) range,campo (nominal),nimellisalue,"calibre (nominal), mgamme (nominale), f",campo (nominale),公称範囲,공칭범위,zakres wskazań nominalnyzakres nominalny,gama (nominal),(номинальный) диапазон,"називни опсег , м јд",nominellt område,标称范围范围
311-03-15,fine control range,https://www.electropedia.org/iev/iev.nsf/display?openform&ievref=311-03-15,مدى (اسمي),"Feinbereich, m",fine control range,campo de regulación fina,hienosäätöalue,"gamme de réglage fin, fplage de réglage fin, f",campo di regolazione fineintervallo di regolazione fine,細密調整範囲,정교 제어 범위정밀 제어 범위,zakres regulacji dokładnej,gama de regulação fina,диапазон тонкой (точной) регулировки,"опсег фине регулације, м јд",skalutbredningsområde,细调范围
