term_id,term,term_url,ar,de,en,es,fr,it,ja,ko,pl,pt,sv,zh
221-03-26,residual loss,https://www.electropedia.org/iev/iev.nsf/display?openform&ievref=221-03-26,فقد التخلف المغناطيسي الدوار,"anomale Zusatzverluste, m, pl",residual loss,pérdidas residuales,"pertes résiduelles, f pl",perdite residue,残留損,잔류 손실,straty pozostałe,perdas residuais,restförlust,剩余损耗
221-03-27,gyromagnetic resonance loss,https://www.electropedia.org/iev/iev.nsf/display?openform&ievref=221-03-27,فقد متبقي,"Verluste durch gyromagnetische Resonanz, m, pl",gyromagnetic resonance loss,pérdidas por resonancia giromagnética,"pertes par résonance gyromagnétique, f pl",perdite per risonanza giromagnetica,ジャイロ磁気共鳴損失,자이로자기 공명철손,straty przy rezonansie giromagnetycznym,perdas por ressonância giromagnética,gyromagnetisk resonansförlust,旋磁共振损耗
221-03-28,(magnetic) loss angle,https://www.electropedia.org/iev/iev.nsf/display?openform&ievref=221-03-28,فقد الرنين الجيرومغناطيسى,"magnetischer Verlustwinkel, mVerlustwinkel, m",(magnetic) loss angle,ángulo de pérdidas (magnéticas),"angle de pertes (magnétiques), m",angolo di perdite (magnetiche),磁気損失角,자기 손실각,kąt strat magnetycznychkąt strat,ângulo de perdas (magnéticas),förlustvinkel,磁损耗角
221-03-29,(magnetic) quality factor,https://www.electropedia.org/iev/iev.nsf/display?openform&ievref=221-03-29,زاوية فقد (مغناطيسية),"magnetischer Gütefaktor, mGütefaktor, m",(magnetic) quality factor,factor (magnético) de calidad,"facteur de qualité (magnétique), m",fattore (magnetico) di qualità,磁気品質係数損失係数,자기 품질계수,dobroć magnetycznadobroć,factor de qualidade (magnética),(magnetiskt) godhetstal,磁品质因数
221-03-30,magnetic loss resistance,https://www.electropedia.org/iev/iev.nsf/display?openform&ievref=221-03-30,عامل جودة (مغناطيسى),"magnetischer Verlustwiderstand, m",magnetic loss resistance,resistencia de pérdidas magnéticas,"résistance de pertes magnétiques, f",resistenza di perdite magnetiche,磁心損失抵抗,자기 손실 저항,rezystancja strat magnetycznych,resistência de perdas magnéticas,magnetisk förlustresistans,磁损耗电阻
221-03-31,(magnetic) loss factor,https://www.electropedia.org/iev/iev.nsf/display?openform&ievref=221-03-31,مقاومة الفقد المغناطيسي,"magnetischer Verlustfaktor, mVerlustfaktor, m",(magnetic) loss factor,factor de pérdidas magnéticas,"facteur de pertes magnétiques, m",coefficiente di perdite magnetiche,磁気損失係数,자기 손실 계수,współczynnik strat magnetycznych zredukowanywspółczynnik strat zredukowany,factor de perdas (magnético),förlusttal,磁损耗因数
221-03-32,Rayleigh region,https://www.electropedia.org/iev/iev.nsf/display?openform&ievref=221-03-32,عامل الفقد (مغناطيسي),"Rayleighgebiet, n",Rayleigh region,campo de Rayleighdominio de Rayleighregión de Rayleigh,"domaine de Rayleigh, m",campo de Rayleigh,レイリー領域,레일리 영역,zakres Rayleigha,domínio de Rayleigh,Rayleigh-område,瑞利区
221-03-33,hysteresis material constant,https://www.electropedia.org/iev/iev.nsf/display?openform&ievref=221-03-33,منطقة رايليه,"Hysterese-Materialkonstante, f",hysteresis material constant,constante histerética (de un material),constante hystérétique (d'un matériau) f,costante di isteresi (di un materiale),材料履歴定数材料ヒステリシス定数,재료 히스테리시스 상수재료 이력 상수,stała histerezowa materiału,constante histerética (de um material),materialhystereskoefficient,材料磁滞常数
221-03-34,hysteresis core constant,https://www.electropedia.org/iev/iev.nsf/display?openform&ievref=221-03-34,ثابت التخلفية لمادة,"Hysterese-Kernkonstante, f",hysteresis core constant,constante histerética (de un núcleo),constante hystérétique (d'un noyau) f,costante d’isteresi (di un nucleo),磁心履歴係数磁心ヒステリシス係数,자심 이력 상수자심 히스테리시스 상수,stała histerezowa magnetowodu,constante histerética (de um núcleo),kärnhystereskonstant,磁心磁滞常数
221-03-35,Jordan diagram,https://www.electropedia.org/iev/iev.nsf/display?openform&ievref=221-03-35,ثابت التخلفية لقلب,"Jordan-Diagramm, n",Jordan diagram,diagram de Jordan,"diagramme de Jordan, m",dlagramma di Jordan,ジョルダンダイアグラム,요르단 도표,wykres Jordana,diagrama de Jordan,Jordan-diagram,约旦图
221-03-36,apparent power (mass) density,https://www.electropedia.org/iev/iev.nsf/display?openform&ievref=221-03-36,مخطط جوردان,"spezifische Scheinleistung, f",apparent power (mass) density specific apparent power,potencia aparente específica (desaconsejado)potencia aparente por unidad de masa,"puissance apparente massique, fpuissance apparente spécifique (terme déconseillé) f",potenza apparente massica,皮相電力,겉보기 전력 질량 밀도피상 전력 질량 밀도,gęstość masowa mocy pozornejmoc pozorna na jednostkę masy (termin niezalecany),potência aparente por unidade de massa,massrelaterad magnetiseringseffekt,表观功率质量密度比表观功率
221-03-37,apparent power (volume) density,https://www.electropedia.org/iev/iev.nsf/display?openform&ievref=221-03-37,كثافة (كتلة) القدرة الظاهرية,"Scheinleistungsdichte, f",apparent power (volume) density,potencia aparente por unidad de volumen,"puissance apparente volumique, f",potenza apparente volumica,皮相電力体積密度,겉보기 전력 체적 밀도피상 전력 질량 밀도,gęstość objętościowa mocy pozornejmoc pozorna na jednostkę objętości (termin niezalecany),potência aparente por unidade de volume,volymrelaterad magnetiseringseffekt,表观功率体积密度
221-03-38,loss anisotropy factor,https://www.electropedia.org/iev/iev.nsf/display?openform&ievref=221-03-38,كثافة (حجم ) القدرة الظاهرية,"Verlust-Anisotropiefaktor, m",loss anisotropy factor,factor anisotrópico de pérdidas,"facteur d'anisotropie des pertes, m",fattore d’anisotropia delle perdite,損失異方性係数,손실 이방성 계수,współczynnik anizotropii strat,factor de anisotropia das perdas,förlustanisotropifaktor,损耗各向异性因数
221-03-39,loss anisotropy factor (at a given angle),https://www.electropedia.org/iev/iev.nsf/display?openform&ievref=221-03-39,عامل تباين خواص الفقد,"Verlust-Anisotropiefaktor (bei einem gegebenen Winkel), m",loss anisotropy factor (at a given angle),factor anisotrópico de pérdidas (bajo un ángulo dado),facteur d'anisotropie des pertes (sous un angle donné) m,fattore d’anisotropia delle perdite (per un angolo dato),指定方向の損失異方性係数,"손실 이방성 계수, <지정방향>",współczynnik anizotropii strat (przy danym kącie),factor de anisotropia das perdas (para dado ângulo),riktningsbestämd förlustanisotropifaktor,规定角损耗各向异性因数
221-03-40,magnetic field strength anisotropy factor,https://www.electropedia.org/iev/iev.nsf/display?openform&ievref=221-03-40,عامل تباين خواص الفقد (لزاوية معيّنة),"Anisotropiefaktor der magnetischen Feldstärke, m",magnetic field strength anisotropy factor,factor anisotrópico de campo magnético,"facteur d'anisotropie du champ magnétique, m",fattore d’anisotropia del campo magnetico,磁界強度異方性係数,자기장 강도 이방성 계수자계강도 이방성 계수,współczynnik anizotropii pola magnetycznego,factor de anisotropia do campo magnético,magnetiska fältstyrkans anisotropifaktor,磁场强度各向异性因数
221-03-41,rotational power loss,https://www.electropedia.org/iev/iev.nsf/display?openform&ievref=221-03-41,,"Rotationsverluste, m pl",rotational power loss,pérdidas rotacionales,"pertes en rotation, f pl",perdite in rotazione,回転鉄損,회전 철손,straty rotacyjne,perdas em rotação,rotationseffektförlust,旋转功率损耗
221-03-42,(magnetic) total harmonic distortion,https://www.electropedia.org/iev/iev.nsf/display?openform&ievref=221-03-42,التشتت الكلي للتوافقيات(المغناطيسي),"magnetische Gesamt-Oberschwingungsverzerrung, f",(magnetic) total harmonic distortion,distorsión armónica total magnética,"distorsion harmonique totale (magnétique), f",distorsione armonica totale (magnetica),磁性総高調波ひずみ磁性総合高調波ひずみ,자기 총고조파 왜형자기 전고조파 왜형,zniekształcenie harmoniczne całkowite (magnetyczne),distorção (magnética) harmónica total,magnetisk distorsion,磁总谐波失真总谐波失真
221-03-43,(magnetic) total harmonic distortion factor,https://www.electropedia.org/iev/iev.nsf/display?openform&ievref=221-03-43,عامل التشوه التوافقي الكلى المغناطيسي,"magnetischer Gesamt-Oberschwingungsverzerrungsgehalt, m",(magnetic) total harmonic distortion factor,factor de distorsión armónica total (magnética),"facteur de distorsion harmonique totale (magnétique), m",fattore di distorsione armonica totale (magnetica),磁性総高調波ひずみ係数磁性総合高調波ひずみ係数,자기 총고조파 왜형율자기 전고조파 왜형율,współczynnik zniekształcenia harmonicznego całkowitego (magnetycznego),factor de distorção (magnética) harmónica total,,磁总谐波失真因数总谐波失真因数
221-04-01,"magnetize, verb",https://www.electropedia.org/iev/iev.nsf/display?openform&ievref=221-04-01,عامل التشوه التوافقي المغناطيسي الكلي,"magnetisieren, Verb","magnetize, verb",imanarimantarmagnetizar,"aimanter, verbe",magnetizzare,磁化する,"자화시키다, 동사",magnesować,magnetizar,magnetisera,磁化
221-04-02,"demagnetize, verb",https://www.electropedia.org/iev/iev.nsf/display?openform&ievref=221-04-02,ليمغنط,"abmagnetisieren, Verb","demagnetize, verb",desmagnetizar,"désaimanter, verbe",smagnetizzare,減磁する,"소자하다, 동사탈자하다, 동사",odmagnesowywać,desmagnetizar,avmagnetisera,退磁
221-04-03,"neutralize, verb",https://www.electropedia.org/iev/iev.nsf/display?openform&ievref=221-04-03,ليزيل المغنطة,"neutralisieren, Verbabmagnetisieren, Verb, (abgelehnt)","neutralize, verbdemagnetize (deprecated in this sense) verb",desmagnetizar (desaconsejado en este sentido)neutralizar,"neutraliser, verbedésaimanter (terme déconseillé dans ce sens) verbe",neutralizzare,消磁する,"소자시키다, 동사탈자시키다, 동사",neutralizować,neutralizar,neutralisera,中性化
221-04-04,demagnetization factor,https://www.electropedia.org/iev/iev.nsf/display?openform&ievref=221-04-04,ليعادل,"Entmagnetisierungsfaktor, m",demagnetization factor,factor de desmagnetización,"facteur de désaimantation , m",fattore di smagnetizzazione,減磁界係数,자기소거 계수소자율,współczynnik odmagnesowania,factor de desmagnetização,avmagnetiseringsfaktor,退磁因数
221-04-05,BH product,https://www.electropedia.org/iev/iev.nsf/display?openform&ievref=221-04-05,عامل إزالة التمغنط,"BH-Produkt, n",BH product,producto BH,"produit BH, m",prodotto  BH,BH積,BH 곱,iloczyn BH,produto BH,BH-produkt,BH能积
221-04-06,fullness factor (related to the flux density),https://www.electropedia.org/iev/iev.nsf/display?openform&ievref=221-04-06,BH ناتج,"Füllfaktor (bezogen auf die Flussdichte), m",fullness factor (related to the flux density),factor de plenitud (relativo a la inducción),facteur de plénitude (relatif à l'induction) m,fattore di pienezza (relativo all’induzione),磁束密度に関する充満係数充満係数,"충만계수, <자속밀도>",współczynnik wypełnienia dla indukcjiwspółczynnik wypełnienia,factor de plenitude (relativo à indução),B(H)-utbuktningsfaktor,"凸出因数, <磁通密度相关的>"
221-04-07,fullness factor related to the polarization,https://www.electropedia.org/iev/iev.nsf/display?openform&ievref=221-04-07,عامل إمتلاءِ (متعلق بكثافة الفيض),"polarisationsbezogener Füllfaktor, m",fullness factor related to the polarization,factor de plenitud relativo a la polarización,"facteur de plénitude relatif à la polarisation, m",fattore di pienezza relativo alla polarizzazione,磁気分極に対する充満係数,자기분극 관련 충만지수,współczynnik wypełnienia dla polaryzacji,factor de plenitude relativo à polarização,J(H)-utbuktningsfaktor,磁极化强度相关的凸出因数
221-04-08,recoil state,https://www.electropedia.org/iev/iev.nsf/display?openform&ievref=221-04-08,عامل إمتلاء  متعلق بالإستقطاب,"Zustand der rückläufigen Schleife, m",recoil state,estado de retroceso,"état de recul, m",stato di ritorno,リコイル状態,리코일 상태,stan po powrocie,estado de retrocesso,återgångstillstånd,回复状态
221-04-09,recoil line,https://www.electropedia.org/iev/iev.nsf/display?openform&ievref=221-04-09,حالة إرتدادِ,"Linie der rückläufigen Schleife, fLinie der rückläufigen Schleife, frückläufige Schleife, f",recoil linerecoil curverecoil loop,ciclo de retrocesocurva de retrocesolínea de retroceso,"ligne de recul, fcourbe de recul, fcycle de recul, m",linea di ritornocurva di ritorno,リコイル線,리코일 선,linia powrotu,linha de retrocessocurva de retrocessociclo de retrocesso,återgångskurva,回复线回复曲线回复回线
221-04-10,working point,https://www.electropedia.org/iev/iev.nsf/display?openform&ievref=221-04-10,خَطّ إرتدادِ,"Arbeitspunkt, m",working point,punto de funcionamiento,"point de fonctionnement, m",punto di funzionamento,動作点,동작 점,punkt pracy magnesu,ponto de funcionamento,arbetspunkt,工作点
221-04-11,load line,https://www.electropedia.org/iev/iev.nsf/display?openform&ievref=221-04-11,نقطة العمل,"Arbeitsgerade, f",load line,línea de carga,"ligne de charge, f",linea di carico,負荷線負荷曲線,부하 선부하 곡선,linia obciążenia,linha de carga,belastningslinje,负载线
221-04-12,magnetic leakage factor,https://www.electropedia.org/iev/iev.nsf/display?openform&ievref=221-04-12,خط الحمل,"magnetischer Streufaktor, m",magnetic leakage factor,factor de fuga magnética,"facteur de fuite magnétique, m",fattore di fuga magnetico,磁気漏れ係数,자기 누설 계수,współczynnik rozproszenia magnetycznego,factor de fuga magnético,magnetisk läckfaktor,漏磁因数
221-04-13,(air) gap,https://www.electropedia.org/iev/iev.nsf/display?openform&ievref=221-04-13,معامل التسرب المغناطيسي,"Luftspalt, mSpalt, m",(air) gap,entrehierro,"entrefer, m",traferro,空隙、エアギャップ,공극,szczelina powietrznaszczelina niemagnetyczna,entreferro,(luft)gap,空气隙
221-04-14,magnetic axis,https://www.electropedia.org/iev/iev.nsf/display?openform&ievref=221-04-14,فجوة (هوائية),"magnetische Achse, f",magnetic axis,eje magnético,"axe magnétique, m",asse magnetico,磁軸,자축,oś magnetyczna,eixo magnético,magnetisk axel,磁轴
221-04-15,pole face,https://www.electropedia.org/iev/iev.nsf/display?openform&ievref=221-04-15,محور مغناطيسي,"Polfläche, f",pole face,cara polar,"face polaire, f",faccia polare,磁極面,자극면,powierzchnia bieguna magnesupowierzchnia bieguna,face polar,polyta,极面
221-04-16,north pole (of a magnet),https://www.electropedia.org/iev/iev.nsf/display?openform&ievref=221-04-16,وجه القطب,"Nordpol (eines Magneten), m",north pole (of a magnet),polo morte (de un imán),pôle nord (d'un aimant) m,polo nord (di un magnete),"N極, <磁石の>","북극, <자석>",biegun magnesu północnybiegun północny,pólo norte (de um íman),nordpol,"北极, <磁体的>"
221-04-17,north pole face,https://www.electropedia.org/iev/iev.nsf/display?openform&ievref=221-04-17,قطب شمالي (لمغناطيس),"Nordpolfläche, f",north pole face,cara polar norte (de un imán),"face polaire nord, f",faccia polare nord (di un magnete),N磁極面,북극면,powierzchnia bieguna północnego,face polar norte,nordpolyta,北极面
221-04-18,south pole (of a magnet),https://www.electropedia.org/iev/iev.nsf/display?openform&ievref=221-04-18,وجه القطب الشمالي,"Südpol (eines Magneten), m",south pole (of a magnet),polo sur (de un imán),pôle sud (d'un aimant) m,polo sud (di un magnete),"S極, <磁石の>","남극, <자석>",biegun magnesu południowybiegun południowy,pólo sul (de um íman),sydpol,"南极, <磁体的>"
221-04-19,south pole face,https://www.electropedia.org/iev/iev.nsf/display?openform&ievref=221-04-19,قطب جنوبي (لمغناطيس),"Südpolfläche, f",south pole face,cara polar sur (de un imán),"face polaire sud, f",faccia polare sud (di un magnete),S磁極面,남극자극면,powierzchnia bieguna południowego,face polar sul,sydpolyta,南极面
221-04-20,polarity,https://www.electropedia.org/iev/iev.nsf/display?openform&ievref=221-04-20,وجه القطب الجنوبي,"Polarität, f",polarity,polaridad,"polarité, f",polarità,極性,극성,biegunowość magnesu,polaridade,polaritet,极性
221-04-21,neutral line,https://www.electropedia.org/iev/iev.nsf/display?openform&ievref=221-04-21,قطبية,"Neutrallinie, f",neutral line,línea neutra,"ligne neutre, f",linea neutra,中性線,중성선,linia neutralna magnesu,linha neutra,neutrallinje,中性线
221-04-22,magnetic pull,https://www.electropedia.org/iev/iev.nsf/display?openform&ievref=221-04-22,خَطّ محايد,"magnetischer Zug, m",magnetic pull,fuerza portante magnético,"force portante magnétique, f",forza portante magnetica,磁気吸引力,자기흡인력,przyciąganie magnetyczne,força portante magnética,magnetisk dragkraft,磁引力
221-04-23,pole piece,https://www.electropedia.org/iev/iev.nsf/display?openform&ievref=221-04-23,سحب مغناطيسي,"Polstück, n",pole piece,pieza polar (de un imán),"pièce polaire, f",pezzo polare (di un magnete),磁極片,자극편,nabiegunnik,peça polar,polsko,极片
221-04-24,(magnetic) core,https://www.electropedia.org/iev/iev.nsf/display?openform&ievref=221-04-24,قطعة قطبِ,"magnetischer Kern, mKern, m",(magnetic) core,núcleo (magnético),"noyau (magnétique), m",nucleo (magnetico),磁心,자심,magnetowódrdzeń magnetyczny,núcleo (magnético),(magnetisk) kärna,磁铁心
221-04-25,laminated (magnetic) core,https://www.electropedia.org/iev/iev.nsf/display?openform&ievref=221-04-25,قلب (مغناطيسى),"magnetischer Schichtkern, mSchichtkern, m",laminated (magnetic) core,núcleo (magnético) laminado,"noyau (magnétique) feuilleté, m",nucleo (magnetico) laminato,積層磁心,적층자심,magnetowód blachowanyrdzeń blachowany,núcleo (magnético) laminado,laminerad kärna,叠片磁铁心
221-04-26,magnetic powder core,https://www.electropedia.org/iev/iev.nsf/display?openform&ievref=221-04-26,قلب (مغناطيسي) رقائقي,"magnetischer Pulverkern, m",magnetic powder core,núcleo (magnético) de partículas de polvo,"noyau (magnétique) en poudre, m",nucleo (magnetico) in polvere,圧粉磁心,자분자심,magnetowód proszkowyrdzeń proszkowy,núcleo (magnético) em pó,(magnetisk) pulverkärna,磁铁粉心
221-04-27,strip-wound (magnetic) core,https://www.electropedia.org/iev/iev.nsf/display?openform&ievref=221-04-27,قلب مسحوق مغناطيسي,"magnetischer Bandkern, mBandkern, m",strip-wound (magnetic) core,núcleo (magnético) en banda enrollada,"noyau (magnétique) enroulé, m",nucleo tmagnetico) awo'to,巻鉄心,권 철심,magnetowód taśmowyrdzeń taśmowy,núcleo (magnético) enrolado,bandkärna,带绕磁铁心
221-04-28,lamination factor (of a laminated or strip-wound core),https://www.electropedia.org/iev/iev.nsf/display?openform&ievref=221-04-28,قلب (مغناطيسي) ملفوف شريطيا,"Laminierungsfaktor, mStapelfaktor (eines Schichtkerns oder Bandkerns), m",lamination factor (of a laminated or strip-wound core)stacking factor (of a laminated or strip-wound core),factor de apilamiento (de un núcleo laminado o enrollado),facteur de foisonnement (d'un noyau feuilleté ou enroulé) m,fattore di riempimento,"占積率, <積層磁心または巻鉄心の>","적층률, <적층자심 또는 권철심>",współczynnik wypełnienia magnetowodu,factor de empilhamento (de um núcleo laminado ou enrolado),fyllfaktor; stapelfaktor,"填充因数, <叠片磁心或带绕磁心的>"
221-04-29,core factor C1,https://www.electropedia.org/iev/iev.nsf/display?openform&ievref=221-04-29,عامل الترقيق (لقلب رقائقي أو ملفوف شريطيا),"Kernfaktor C1, mKern-Induktivätsparameter, m",core factor C1core inductance parameter,coeficiente de núcleo C1parámetro de inductancia (de un núcleo),"coefficient de noyau C1, mparamètre d'inductance (d'un noyau) m",coefficiente di nucleo C1parametro di induttanza (di un nucleo),磁心係数 C1,자심계수 C1,stała magnetowodu C1,coeficiente de núcleo C1parâmetro de indutância (de um núcleo) C1,kärnfaktor C1kärninduktansparameter,磁心因数C1磁心电感参数
221-04-30,core factor C2,https://www.electropedia.org/iev/iev.nsf/display?openform&ievref=221-04-30,عامل القلب C1,"Kernfaktor C2, mKern-Hystereseparameter, m",core factor C2core hysteresis parameter,coeficiente de núcleo C2parámetro histerético (de un núcleo),"coefficient de noyau C2, mparamètre hystérétique (d'un noyau) m",coefficiente di nucleo C2;parametro di isteresi (di un nucleo),磁心係数 C2,자심계수 C2,stała magnetowodu C2,coeficiente de núcleo C2parâmetro histerético (de um núcleo) C2,kärnfaktor C2kärnhysteresparameter,磁心因数C2磁心磁滞参数
221-04-31,effective dimensions (of a magnetic circuit) pl,https://www.electropedia.org/iev/iev.nsf/display?openform&ievref=221-04-31,عامل القلب C2,"effektive Abmessungen (eines magnetischen Kreises), f, pl",effective dimensions (of a magnetic circuit) pl,dimensiones efectivas (de un circuito magnético)dimensiones equivalentes (de un circuito magnético),dimensions équivalentes (d'un circuit magnétique) f pldimensions effectives (d'un circuit magnétique) f pl,dimensioni equivalenti (di un circuito magnetico)dimensioni effettive (di un circuito magnetico),"実効（断面積，磁路長，体積）, <磁気回路の>","실효 치수, <자기 회로>, 복수유효 치수, <자기 회로>, 복수",wymiary równoważne obwodu magnetycznego,dimensões equivalentes (de um circuito magnético),effektiva dimensioner hos magnetisk krets,"有效尺寸, <磁路的>"
221-04-32,yoke,https://www.electropedia.org/iev/iev.nsf/display?openform&ievref=221-04-32,أبعاد فعّالة (لدائرة مغناطيسية),"Joch, n",yoke,culata,"culasse, f",giogo,ヨーク継鉄,요크계철,jarzmo,culatra,(magnetiskt) ok,磁轭
221-04-33,active mass,https://www.electropedia.org/iev/iev.nsf/display?openform&ievref=221-04-33,مقرن (نير),"aktive Masse, feffektive Masse",active masseffective mass,masa activamasa efectiva,"masse active, fmasse effective, f",massa attivamassa effettiva,実効質量,실효 질량,masa efektywna,massa activa,effektiv massa,有功质量有效质量
221-04-34,active mass factor,https://www.electropedia.org/iev/iev.nsf/display?openform&ievref=221-04-34,كتلة نشيطة (فعّالة),"spezifische aktive Masse, fspezifische effektive Masse, f",active mass factoreffective mass factor,factor de masafactor de masa efectiva,"facteur de masse active, mfacteur de masse effective, m",fattore di massa attivafattore di massa effettiva,実効質量係数,실효 질량 계수,współczynnik masy efektywnej,factor de massa activa,effektiv massfaktor,有功质量因数有效质量因数
221-04-35,double-lapped joint,https://www.electropedia.org/iev/iev.nsf/display?openform&ievref=221-04-35,عامل الكتلة النشيطة (الفعّالة),"doppeltüberlappende Verbindung, f",double-lapped joint,junta de doble recubrimiento,"joint à double recouvrement, m",giunto a incastro,ダブルラップ接合,이중 겹이음 결합,łączenie na podwójną zakładkę,junta com duplo recobrimento,överlappsfog,双搭接
221-04-36,Epstein square,https://www.electropedia.org/iev/iev.nsf/display?openform&ievref=221-04-36,مفصل ثنائي متراكب,"Epsteinrahmen, m",Epstein squareEpstein test frame,cuadro de Epstein,"cadre d'Epstein, m",circuito magnetico di Epstein,エプスタイン測定枠,엡스타인 측정테,ramka Epsteinajarzmo Epsteina  (termin niezalecany),quadro de Epstein,epsteinram,艾普斯坦方圈艾普斯坦测试框架
221-04-37,permeameter,https://www.electropedia.org/iev/iev.nsf/display?openform&ievref=221-04-37,مربع إبستن,"Permeameter, n",permeameter,permeámetro,"perméamètre, m",permeametro,透磁率計,투자율계,permeametr,permeâmetro,permeameter,磁导计
221-04-38,search coil,https://www.electropedia.org/iev/iev.nsf/display?openform&ievref=221-04-38,مقياس النفاذية,"Suchspule, f",search coil,bobina de exploración,"bobine d'exploration, f",bobina di esplorazione,探りコイルサーチコイル,검색 코일,cewka probiercza,bobine de exploração,mätspole,测试线圈
