term_id,term,term_url,ar,de,en,es,fr,it,ja,ko,pl,pt,sr,sv,zh
841-28-12,dielectric dryer,https://www.electropedia.org/iev/iev.nsf/display?openform&ievref=841-28-12,مجفف العزل الكهربائي,"Trockner mit dielektrischer Erwärmung, m",dielectric dryer,secador dieléctrico,"séchoir diélectrique, m",essiccatore dielettrico,高周波誘電乾燥機,유전 건조기,suszarka pojemnościowa,secador dieléctrico,"диелектрички сушач, м јд",dielektrisk tork,介质干燥器
841-28-13,dielectric plastic welder,https://www.electropedia.org/iev/iev.nsf/display?openform&ievref=841-28-13,جهاز لحام اللدائن ذو العزل الكهربائي,"Gerät zum dielektrischen Kunststoffschweißen, n",dielectric plastic welder,soldador dieléctrico de plásticos,"soudeur diélectrique des plastiques, m",dielectric plastic welder,高周波誘電溶着機,유전 플라스틱 용접기유전 융착기,zgrzewarka pojemnościowa,soldador dieléctrico de plásticos,"диелектрички заваривач пластике, м јд",dielektrisk plastsvets,塑料介质热合机
841-28-14,dielectric preheater,https://www.electropedia.org/iev/iev.nsf/display?openform&ievref=841-28-14,جهاز تسخين مسبق للعزل الكهربائي,"dielektrische Vorwärmeeinrichtung, f",dielectric preheater,precalentador dieléctrico,"préchauffeur diélectrique, m",preriscaldatore dielettrico,高周波誘電予熱機,유전 예열기,podgrzewarka pojemnościowa,pré-aquecedor dieléctrico,"диелектрички предгрејач, м јд",dielektrisk förvärmare,介质预热器
841-28-15,dielectric heating generator,https://www.electropedia.org/iev/iev.nsf/display?openform&ievref=841-28-15,مولد العزل الكهربائي الحراري,"dielektrischer Heizgenerator, m",dielectric heating generator,generador para calentamiento dieléctrico,"générateur pour chauffage diélectrique, m",generatore di riscaldamento dielettrico,高周波誘電加熱用発振機,유전 가열 발진기,generator pojemnościowy,gerador de aquecimento dieléctrico,"генератор за диелектричко загревање, м јд",generator för dielektrisk värmare,介质加热发生器
841-28-16,dielectric gluing press,https://www.electropedia.org/iev/iev.nsf/display?openform&ievref=841-28-16,مكبس  تلصيق بالعزل الكهربائي,"dielektrische Klebepresse, f",dielectric gluing press,prensa de encolado dieléctrico,"presse de collage diélectrique, f",pressa di incollatura dielettrica,高周波誘電接着プレス,유전 접착 프레스,prasa pojemnościowa do klejenia,prensa de colagem dieléctrica,"преса за диелектричко лепљење, ж јд",dielektrisk limpress,介质粘压机
841-28-17,cavity resonator with additional capacitance,https://www.electropedia.org/iev/iev.nsf/display?openform&ievref=841-28-17,رنان تجويفي بمكثف إضافي,"Hohlraumresonator mit Zusatzkapazität, m",cavity resonator with additional capacitance,cavidad resonante con capacidad adicional,"cavité résonante à capacité additionnelle, f",risonatore della cavità con capacità supplementare,容量短縮形空洞共振器,커패시턴스단축형 공동공진기,rezonator wnękowy ze zwiększoną pojemnością,cavidade ressonante de capacitância adicional,"резонаторска шупљина са додатном капацитивношћу, ж јд",hålrumsresonator med tilläggskapacitans,附加电容空腔谐振器
841-28-18,heating capacitor,https://www.electropedia.org/iev/iev.nsf/display?openform&ievref=841-28-18,مكثف التسخين,"Erwärmungskondensator, m",heating capacitor,condensador de calentamiento,"condensateur de chauffage, m",condensatore per il riscaldamento (termocondutto,加熱負荷容量,가열 커패시터,kondensator grzejny,condensador de aquecimento,"загревни кондензатор, м јд",värmningskondensator,加热电容器
841-28-19,air gap heating capacitor,https://www.electropedia.org/iev/iev.nsf/display?openform&ievref=841-28-19,مكثف التسخين ذو الثغرة الهوائية,"Luftspalt-Erwärmungskondensator, m",air gap heating capacitor,condensador de calentamiento con entrehierro,"condensateur de chauffage à intervalle, m",condensatore di riscaldamento con intervallo d'aria,空隙付き加熱負荷容量,공극부 가열 커패시터,kondensator grzejny ze szczeliną powietrzną,condensador de aquecimento com hiato de ar,"ваздушни процеп загревног кондензатора, м јд",värmningskondensator med luftgap,气隙加热电容器
841-28-20,work electrode (of a dielectric heater),https://www.electropedia.org/iev/iev.nsf/display?openform&ievref=841-28-20,قطب التشغيل الكهربائي (لسخان العزل الكهربائي),"Arbeitselektrode (einer dielektrischen Erwärmungseinrichtung), f",work electrode (of a dielectric heater),electrodo de trabajo (de un calentador dieléctrico),électrode de travail (d'un poste de chauffage diélectrique) f,elettrodo di lavoro,"加熱電極, <高周波誘電加熱機の>","가열 전극, 유전 가열기",elektroda robocza (nagrzewnicy pojemnościowej),eléctrodo de trabalho (de um aquecedor dieléctrico),радна електрода (диелектричког електротермичког уређаја) ж јд,arbetselektrod,"工作电极, <介质加热器的>"
841-28-21,plate electrodes,https://www.electropedia.org/iev/iev.nsf/display?openform&ievref=841-28-21,أقطاب كهربائية على شكل ألواح,"Plattenelektroden, f, pl",plate electrodes,electrodos de placas,"électrodes en forme de plaque, f pl",elettrodi a piastra,平板状電極,평판 전극,elektrody płytowe,eléctrodos de placas,"равне електроде, ж мн",plattelektrod,板电极
841-28-22,rod electrode,https://www.electropedia.org/iev/iev.nsf/display?openform&ievref=841-28-22,قطب كهربائي على شكل قضيب,"Stabelektrode, f",rod electrode,electrodo de barilla,"électrode-baguette, f",elettrodo ad asta,棒状電極,봉 전극,elektrody prętowe,eléctrodo de varão,"штапна електрода, ж јд",stavelektrod,棒电极
841-28-23,rotating cylinder electrodes,https://www.electropedia.org/iev/iev.nsf/display?openform&ievref=841-28-23,أقطاب كهربائية إسطوانية الدوارة,"rotierende Zylinderelektroden, f, pl",rotating cylinder electrodes,electrodo de cilindros giratorios,"électrodes à cylindres tournants, f pl",elettrodi cilindrici rotanti,回転シリンダ形電極,회전 실린더형 전극,elektrody obrotowe,eléctrodos de cilindros rotativos,"котрљајуће цилиндричне електроде, ж мн",roterande cylinderelektroder,转柱电极
841-28-24,rotating disc electrode,https://www.electropedia.org/iev/iev.nsf/display?openform&ievref=841-28-24,قطب كهربائي ذو قرص دوار,"Rollenelektrode, f",rotating disc electrode,electrodo de disco giratorio,"électrode à molette, f",elettrodi a disco rotante,回転円盤形電極,회전원판형 전극,elektroda wirująca krążkowa,eléctrodo de disco rotativo,"котрљајућа електрода у облику диска, ж јд",roterande skivelektrod,转盘电极
841-28-25,dielectric welding electrode,https://www.electropedia.org/iev/iev.nsf/display?openform&ievref=841-28-25,قطب لحام  ذو عزل كهربائي,"Schweißelektrode, f",dielectric welding electrode,electrodo de soldadura dieléctrica,"électrode de soudage diélectrique, f",elettrodo di saldatura dielettrica,溶着電極,유전 용접 전극유전 용접봉,elektroda zgrzewająca,eléctrodo de soldadura dieléctrica,"диелектричка електрода за заваривње, ж јд",dielektrisk svetselektrod,介质热合电极
841-28-26,dielectric cutting edge welding electrode,https://www.electropedia.org/iev/iev.nsf/display?openform&ievref=841-28-26,قطب لحام  ذو عزل كهربائي وحافة قطع,"Schweißelektrode mit Schneidkante, f",dielectric cutting edge welding electrode,electrodo de corte dieléctrico,"électrode de coupage diélectrique, f",elettrodo di saldatura con estremità di taglio dielettrica,溶断刃,용단 용접봉,elektroda zgrzewająca z krawędzią tnącą,eléctrodo de corte dieléctrico,"диелектричка електрода за варење са оштрицом, ж јд",dielektrisk svets- och skärelektrod,刀状介质热合电极
841-28-27,waveguide filter (in a dielectric heating equipment),https://www.electropedia.org/iev/iev.nsf/display?openform&ievref=841-28-27,مرشح دليل الموجة ( في معدة التسخين بالعزل الكهربائي),"Hohlleiterfilter (in einer dielektrischen Erwärmungseinrichtung), n",waveguide filter (in a dielectric heating equipment),filtro de guías de ondas (en un equipo de calentamiento eléctrico),filtre à guides d'ondes (dans un équipement de chauffage diélectrique) m,filtro di una guida di onda,"導波管フィルター, <誘電加熱装置における>","도파관 필터, 유전 가열 설비",filtr falowodowy (w urządzeniu do nagrzewania pojemnościowego),filtro de guias de ondas (num equipamento de aquecimento dieléctrico),филтер за таласовод (опреме за диелектричко загревање) м јд,vågledarfilter,"波导滤波器, <介质加热设备内的>"
841-28-28,useful high-frequency power,https://www.electropedia.org/iev/iev.nsf/display?openform&ievref=841-28-28,قدرة التردد العالي المفيدة,"Hochfrequenznutzleistung, f",useful high-frequency power,potencia útil de alta frecuencia,"puissance utile à haute fréquence, f",potenza utile ad alta frequenza,有効高周波電力,유효 고주파 전력,moc użyteczna wielkiej częstotliwości,potência útil de alta frequência,"корисна високофреквентна снага, ж јд",högfrekvent nyttoeffekt,高频有用功率
841-28-29,rated useful output power,https://www.electropedia.org/iev/iev.nsf/display?openform&ievref=841-28-29,قدرة الخرج المفيدة المقننة  (النمطية),"Bemessungsausgangsnutzleistung, f",rated useful output power,potencia útil de salida asignada,"puissance utile de sortie assignée, f",potenza nominale utile,定格有効出力,정격 유효 출력,moc użyteczna wyjściowa znamionowa,potência útil de saída estipulada,"назначена корисна излазна снага, ж јд",märkuteffekt,额定有用输出功率
841-28-30,pulse power,https://www.electropedia.org/iev/iev.nsf/display?openform&ievref=841-28-30,قدرة النبضة,"Impulsleistung, f",pulse power,potencia potencia de pulso,"puissance de l'impulsion, f",potenza dell'impulso,パルス電力,펄스 전력,moc impulsowa,potência de impulso,"импулсна снага, ж јд",pulseffekt,脉冲功率
841-28-31,power losses,https://www.electropedia.org/iev/iev.nsf/display?openform&ievref=841-28-31,مفاقيد القدرة,"Verluste, m, pl",power losses,pérdidas totales,"pertes totales, f pl",perdita di potenza,電力損失,전력 손실,straty mocy,perdas totais,"губици снаге, м мн",effektförluster,功率损失
841-28-32,nominal value,https://www.electropedia.org/iev/iev.nsf/display?openform&ievref=841-28-32,قيمة إسمية,"Nennwert, m",nominal value,valor nominal,"valeur nominale, fvaleur de dénomination, f",valore nominale,公称値,공칭값,wartość nominalna,valor nominal,"називна вредност, ж јд",nominellt värde,标称值
841-28-33,nominal dielectric heating frequency,https://www.electropedia.org/iev/iev.nsf/display?openform&ievref=841-28-33,تردد إسمي للعزل الكهربائي,"Nennwert der dielektrischen Erwärmungsfrequenz, m",nominal dielectric heating frequency,frecuencia nominal de calentamiento dieléctrico,"fréquence nominale de chauffage diélectrique, f",frequenza nominale di riscaldamento dielettrico,公称誘電加熱周波数,공칭 유도 가열주파수,częstotliwość nominalna nagrzewania pojemnościowego,frequência nominal de aquecimento dieléctrico,"називна фреквенција диелектричког грејача, ж јд",nominell frekvens för dielektrisk värmning,介质加热标称频率
841-29-01,microwave heating,https://www.electropedia.org/iev/iev.nsf/display?openform&ievref=841-29-01,تسخين بالترددات العالية,"Mikrowellenerwärmung, f",microwave heating,calentamiento por microondas,"chauffage par hyperfréquences, mchauffage par micro-ondes, m",riscaldamento a microonde,マイクロ波加熱,마이크로파 가열,nagrzewanie mikrofalowe,aquecimento por hiperfrequênciasaquecimento por microondas,"микроталасно загревање, с јд",mikrovågsvärmning,微波加热
841-29-02,power penetration depth,https://www.electropedia.org/iev/iev.nsf/display?openform&ievref=841-29-02,عمق اختراق القدرة,"Leistungseindringtiefe, f",power penetration depth,profundidad de penetración de la potencia,"profondeur de pénétration de la puissance, f",profondità di penetrazione della potenza,パワー発生深さ,전력의 투과심도,głębokość wnikania mocy,profundidade de penetração da potência,"дубина продора снаге, ж јд",inträngningsdjup,功率穿透深度
841-29-03,power absorption depth,https://www.electropedia.org/iev/iev.nsf/display?openform&ievref=841-29-03,عمق امتصاص القدرة,"Leistungsabsorptionstiefe, f",power absorption depth,profundidad de absorción de la potencia,"profondeur d'absorption de puissance, f",profondità di assorbimento della potenza ???,パワー浸透深さ,전력의 침투깊이,głębokość absorpcji mocy,profundidade de absorção de potência,"дубина апсорбовања снаге, ж јд",absorptionsdjup,功率吸收深度
841-29-04,attenuation distance,https://www.electropedia.org/iev/iev.nsf/display?openform&ievref=841-29-04,مسافة التوهين (الاخماد),"Abklingabstand, m",attenuation distance,distancia de atenuación,"distance d'amortissement, f",distanza di attenuazione,減衰距離,감쇠거리,odległość tłumienia,distância de atenuação,"растојање слабљења, с јд",avklingningsavstånd,衰减距离
841-29-05,microwave drying,https://www.electropedia.org/iev/iev.nsf/display?openform&ievref=841-29-05,التجفيف بالترددات العالية,"Mikrowellentrocknung, f",microwave drying,secado por microondas,"séchage par hyperfréquences, m",essiccazione a microonde,マイクロ波乾燥,마이크로파 건조,suszenie mikrofalowe,secagem por hiperfrequências,"микроталасно сушење, с јд",mikrovågstorkning,微波干燥
841-29-06,microwave heating equipment,https://www.electropedia.org/iev/iev.nsf/display?openform&ievref=841-29-06,معدات التسخين بالترددات العالية,"Mikrowellen-Erwärmungseinrichtung, f",microwave heating equipment,equipo de calentamiento por microondas,"équipement de chauffage par hyperfréquences, méquipement de chauffage par micro-ondes, m",impianto di riscaldamento a microonde,マイクロ波加熱装置,마이크로파 가열 장비,urządzenie do nagrzewania mikrofalowego,equipamento de aquecimento por hiperfrequências,"постројење за микроталасно загревање, с јд",mikrovågsvärmare,微波加热设备
841-29-07,microwave dryer,https://www.electropedia.org/iev/iev.nsf/display?openform&ievref=841-29-07,مجفف الترددات العالية,"Trockner mit Mikrowellenerwärmung, m",microwave dryer,secador por microondas,"séchoir à hyperfréquences, m",essiccatore a microonde,マイクロ波乾燥機,마이크로파 건조기,suszarka mikrofalowa,secador por hiperfrequências,"микроталасни сушач, м јд",mikrovågstork,微波干燥机
841-29-08,microwave grinding,https://www.electropedia.org/iev/iev.nsf/display?openform&ievref=841-29-08,تجليخ بالترددات العالية,"Mikrowellenmahlen, n",microwave grinding,rectificación por microondas,"doucissage par hyperfréquences, m",frantumazione a microonde,マイクロ波研磨,마이크로파 연마,rozdrabnianie mikrofalowe,amaciamento por hiperfrequências,"микроталасно дробљење, с јд",mikrovågsslipning,微波破碎
841-29-09,microwave pasteurising,https://www.electropedia.org/iev/iev.nsf/display?openform&ievref=841-29-09,بسترة بالموجات المتناهية القصر,"Mikrowellenpasteurisieren, n",microwave pasteurising,pasteurización por microondas,"pasteurisation par hyperfréquences, f",pastorizzazione a microonde,マイクロ波低温殺薗,마이크로파 저온살균,pasteryzacja mikrofalowa,pasteurização por hiperfrequências,"микроталасна пастеризација, ж јд",mikrovågspastörisering,微波巴氏消毒
841-29-10,microwave sterilizing,https://www.electropedia.org/iev/iev.nsf/display?openform&ievref=841-29-10,تعقيم بالموجات المتناهية القصر,"Mirkowellensterilisieren, n",microwave sterilizing,esterilización por microondas,"stérilisation par hyperfréquences, f",sterilizzazione a microonde,マイクロ波殺薗,마이크로파 살균,sterylizacja mikrofalowa,esterilização por hiperfrequências,"микроталасна стерилизација, ж јд",mikrovågssterilisering,微波灭菌
841-29-11,microwave applicator,https://www.electropedia.org/iev/iev.nsf/display?openform&ievref=841-29-11,مطبق الموجات المتناهية القصر,"Anwendungseinrichtung für Mikrowellen, f",microwave applicator,aplicador de microondas,"applicateur d’hyperfréquences, mapplicateur de micro-ondes, m",applicatore di microonde,マイクロ波アプリケータ,마이크로파 응용기,aplikator mikrofalowy,aplicador de hiperfrequênciasaplicador de microondas,"микроталасни апликатор, м јд",mikrovågsapplikator,微波应用器
841-29-12,microwave load,https://www.electropedia.org/iev/iev.nsf/display?openform&ievref=841-29-12,حمل الموجات المتناهية القصر,"Mikrowellencharge, f",microwave load,carga de microondas,"charge micro-onde, f",carico per microonde,マイクロ波負荷,마이크로파 부하,obciążenie mikrofalowe,carga microonda,"микроталасно оптерећење, с јд",mikrovågslast,微波负载
841-29-13,microwave workload,https://www.electropedia.org/iev/iev.nsf/display?openform&ievref=841-29-13,حمل الشغل بالموجات المتناهية القصر,"Mikrowellenarbeitscharge, f",microwave workload,carga de trabajo de microondas,"charge de travail micro-onde, f",carico di lavoro per microonde,マイクロ波作業負荷,마이크로파 작업부하,obciążenie mikrofalowe robocze,carga de trabalho microonda,"микроталасно радно оптерећење, с јд",,微波工作负载
841-29-14,microwave transparency,https://www.electropedia.org/iev/iev.nsf/display?openform&ievref=841-29-14,شفافية الموجات العالية,"Mikrowellendurchlässigkeit, f",microwave transparency,transparencia a las microondas,"transparence aux hyperfréquences, ftransparence aux micro-ondes, f",trasparenza alle microonde,マイクロ波透過,마이크로파 투과,przezroczystość dla mikrofal,transparência às hiperfrequências,"микроталасна транспарентност, ж јд",mikrovågstransparens,微波透射性
841-29-15,microwave oven,https://www.electropedia.org/iev/iev.nsf/display?openform&ievref=841-29-15,فرن الترددات العالية,"Mikrowellenofen, m",microwave oven,horno de microondas,"four à chauffage hyperfréquence, mfour à micro-ondes, m",forno a microonde,マイクロ波オーブン,마이크로파 오븐전자레인지,piec mikrofalowy,forno de aquecimento por hiperfrequênciasforno de microondas,"микроталасна пећ, ж јд",mikrovågsugn,微波炉
841-29-16,microwave generator,https://www.electropedia.org/iev/iev.nsf/display?openform&ievref=841-29-16,مولد الترددات العالية,"Mikrowellengenerator, m",microwave generator,generador de microondas,"générateur d’hyperfréquences, mgénérateur de micro-ondes, m",generatore di microonde,マイクロ波発振器,마이크로파 발진기,generator mikrofalowy,gerador de hiperfrequências,"микроталасни генератор, м јд",mikrovågsgenerator,微波发生器
841-29-17,single mode cavity,https://www.electropedia.org/iev/iev.nsf/display?openform&ievref=841-29-17,تجويف النمط الأحادي,"Einmodenkammer, f",single mode cavity,cavidad monomodo,"cavité mono-mode, fcavité unimodale, f",cavità unica/di un solo tipo,単一モード空洞共振器,단일모드 공진기,rezonator z jednym rodzajem pola,cavidade monomodal,"мономодна шупљина, ж јд",enkelmodskavitet,单模谐振腔
841-29-18,multimode cavity,https://www.electropedia.org/iev/iev.nsf/display?openform&ievref=841-29-18,تجويف النمط المتعدد,"Mehrmodenkammer, f",multimode cavity,cavidad multimodo,"cavité multimode, f",cavità di più tipi,マルチモード空洞共振器,다중모드 공진기,rezonator o wielu rodzajach pola,cavidade multimodal,"вишемодна шупљина, ж јд",flermodskavitet,多模谐振腔
841-29-19,microwave cavity,https://www.electropedia.org/iev/iev.nsf/display?openform&ievref=841-29-19,تجويف الترددات العالية,"Mikrowellenkammer, f",microwave cavity,cavidad de microondas,"cavité à hyperfréquences, fcavité à micro-ondes, f",cavità a microonde,マイクロ波空洞共振器,마이크로파 공진기,wnęka mikrofalowa,cavidade de hiperfrequências,"микроталасна шупљина, ж јд",mikrovågskavitet,微波谐振腔
841-29-20,microwave enclosure,https://www.electropedia.org/iev/iev.nsf/display?openform&ievref=841-29-20,حاوية الترددات العالية,"Mikrowellengehäuse, n",microwave enclosure,envolvente de microondas,"enceinte hyperfréquence, fenceinte micro-onde, f",involucro/custodia per microonde,マイクロ波きょう（筐）体,마이크로파 외함,obudowa mikrofalowa,recinto de hiperfrequências,"микроталасно кућиште, с јд",mikrovågsinneslutning,微波外罩微波腔壁
841-29-21,access opening,https://www.electropedia.org/iev/iev.nsf/display?openform&ievref=841-29-21,فتحة المنفذ,"Zugangsöffnung, f",access opening,apertura de acceso,"ouverture d’accès, f",apertura di accesso,開口部,접근 개방,otwór dostępowy,abertura de acesso,"отворени приступ, м јд",åtkomstöppning,进出口
841-29-22,waveguide (of a microwave heater or oven),https://www.electropedia.org/iev/iev.nsf/display?openform&ievref=841-29-22,دليل الموجة (للسخان أو فرن الترددات العالية),"Wellenleiter (für eine Mikrowellenerwärmungseinrichtung oder einen Mikrowellenofen), m",waveguide (of a microwave heater or oven),guía de ondas (de un horno o dispositivo de calentamiento de microondas),guide d’ondes (d’un four ou dispositif de chauffage à hyperfréquences) m,guida d'onda,"導波管, <マイクロ波加熱機又はオーブンの>","도파관, 마이크로파 가열 또는 오븐",falowód (nagrzewnicy mikrofalowej lub pieca),guia de ondas (de um forno ou aquecedor por hiperfrequências),таласовод (микроталасног електротермичког уређаја или пећи) м јд,vågledare,"波导, <微波加热器或微波炉的>"
841-29-23,microwave stirrer,https://www.electropedia.org/iev/iev.nsf/display?openform&ievref=841-29-23,محرك الترددات العالية,"Mikrowellenrührwerk, n",microwave stirrer,agitador de microondas,"dispositif de brassage micro-onde, m",agitatore a microonde,マイクロ波撹拌器,마이크로파 교반기,mieszadło mikrofalowe,agitador de microondas,"микроталасна мешалица, ж јд",mikrovågsomrörare,微波搅拌器
841-29-24,reflector,https://www.electropedia.org/iev/iev.nsf/display?openform&ievref=841-29-24,عاكس,"Reflektor, m",reflector,reflector,"réflecteur, m",riflettore,反射器,반사체,reflektor,reflector,"рефлектор, м јд",mikrovågsreflektor,反射器
841-29-25,deflector,https://www.electropedia.org/iev/iev.nsf/display?openform&ievref=841-29-25,حارف,"Ablenkelement, n",deflector,deflector,"déflecteur, m",deflettore,偏向器,편향기디플렉터,deflektor,deflector,"усмеривач, м јд",mikrovågsspridare,偏转器
841-29-26,cavity door,https://www.electropedia.org/iev/iev.nsf/display?openform&ievref=841-29-26,باب التجويف,"Kammertür, f",cavity door,puerta de cavidad,"porte de cavité, f",porta della cavità,共振式扉,공진식 문,drzwi wnęki drzwi rezonatora,porta de cavidade,"врата шупљине, с мн",kavitetslucka,腔门
841-29-27,maintenance door,https://www.electropedia.org/iev/iev.nsf/display?openform&ievref=841-29-27,باب الصيانة,"Wartungstür, f",maintenance door,puerta de mantenimiento,"porte de maintenance, f",porta di mantenimento,保守用扉,유지용 문,drzwi konserwacyjne,porta de manutenção,"врата за одржавање, с мн",underhållslucka,维修门
841-30-01,electron beam,https://www.electropedia.org/iev/iev.nsf/display?openform&ievref=841-30-01,حزمة إلكترونية,"Elektronenstrahl, m",electron beam,haz electrónico,"faisceau électronique, m",fascio di elettroni,電子ビーム,전자빔,wiązka elektronowa,feixe de electrões,"електронски млаз, м јд",elektronstråle,电子束
