term_id,term,term_url,ar,de,en,es,fr,it,ja,ko,mn,pl,pt,sl,sr,sv,zh
436-03-10,metal foil capacitor,https://www.electropedia.org/iev/iev.nsf/display?openform&ievref=436-03-10,مكثف ذو رقائق معدنية,"Metallfolienkondensator, m",metal foil capacitor,condensador de hojas metálicas,"condensateur à feuilles métalliques, m",condensatore con elettrodi di nastro metallico,箔コンデンサ,금속 박 커패시터,металл хальсан конденсатор,kondensator o elektrodach z folii metalowej,condensador de folhas metálicas,kondenzator s kovinsko folijo,"кондензатор са електродама од металне фолије, м јд",metallfoliekondensator,金属箔电容器
436-03-11,metallized capacitor,https://www.electropedia.org/iev/iev.nsf/display?openform&ievref=436-03-11,مكثف ممعدن,"metallisierter Kondensator, m",metallized capacitor,condensador de dieléctrico metalizado,"condensateur à diélectrique métallisé, m",condensatore metallizzato,金属化コンデンサ,금속화 커페시터,металл бүрхүүлтэй конденсатор,kondensator metalizowany  kondensator z dielektrykiem metalizowanym,condensador de dieléctrico metalizado,kondenzator z metaliziranim dielektrikom,"кондензатор са метализираним диелектриком, м јд",kondensator med metalliserade belägg,金属化电容器
436-03-12,self-healing capacitor,https://www.electropedia.org/iev/iev.nsf/display?openform&ievref=436-03-12,مكثف معالج ذاتياً,"selbstheilender Kondensator, m",self-healing capacitor,condensador autorregenador,"condensateur autorégénérateur, m",condensatore autorigenerabile,自己回復コンデンサ,자체 복구 커패시터,өөрөө сэргээгддэг конденсатор,kondensator samoregenerujący się kondensator z dielektrykiem samoregenerującym się,condensador autorregenerador,samoozdravljivi kondenzator,"самообнављајући кондензатор, м јд",självlakande kondensator,自愈式电容器
436-03-13,impregnating,https://www.electropedia.org/iev/iev.nsf/display?openform&ievref=436-03-13,إشباع - غمر,"Imprägnieren, nTränken, n",impregnating,impregnación,"imprégnation, f",impregnazione,含浸,함침,нэвчүүлэх,impregnacja  nasycanie,impregnação,impregniranje,"импрегнација, ж јд",impregnering,浸渍
436-03-14,overvoltage protector of a capacitor,https://www.electropedia.org/iev/iev.nsf/display?openform&ievref=436-03-14,جهاز واق من  الجهد الزائد للمكثف,"Überspannungsschutzvorrichtung eines Kondensators, f",overvoltage protector of a capacitor,dispositivo de protección de un condensador contra las sobretensiones,"dispositif de protection d'un condensateur contre les surtensions, m",dispositivo di protezione contro le sovratensioni di un condensatore,コンデンサの過電圧保護装置,커패시터 과전압 보호기,конденсаторын хэт хүчдэлийн хамгаалагч,ochronnik przepięciowy kondensatora,dispositivo de protecção de um condensador contra sobretensões,prenapetostna zaščitna naprava kondenzatorja,"пренапонска заштита кондензатора, ж јд",överspänningsskydd,"过电压保护, <电容器的>"
436-03-15,discharge device of a capacitor,https://www.electropedia.org/iev/iev.nsf/display?openform&ievref=436-03-15,جهاز لتفريغ المكثف,"Entladevorrichtung eines Kondensators, f",discharge device of a capacitor,dispositivo de descarga de un condensador,"dispositif de décharge d'un condensateur, m",dispositivo di scarica di un condensatore,コンデンサの放電装置,커패시터 방전 장치,конденсаторын цэнэг шавхагч төхөөрөмж,urządzenie rozładowcze kondensatora,dispositivo de descarregamento de um condensadordispositivo de descarga de um condensador (desaconselhado),praznilna naprava kondenzatorja,"склоп за пражњење кондензатора, м јд",urladdningdon,"放电器件, <电容器的>"
436-03-16,internal fuse of a capacitor,https://www.electropedia.org/iev/iev.nsf/display?openform&ievref=436-03-16,مصهر داخلى للمكثف,"interne Sicherung eines Kondensators, f",internal fuse of a capacitor,cortocircuito interno de un condensador,"coupe-circuit interne d'un condensateur, m",fusibile interno di un condensatore,コンデンサの内部ヒューズ,커패시터 내부 퓨즈,конденсаторын дотоод хайламтгай гал хамгаалагч,bezpiecznik wewnętrzny kondensatora,cortacircuito interno de um condensador,notranja varovalka kondenzatorja,"унутрашњи осигурач кондензатора, м јд",inre kondensatorsäkring,"内部熔丝, <电容器的>"
436-03-17,overpressure disconnector for a capacitor,https://www.electropedia.org/iev/iev.nsf/display?openform&ievref=436-03-17,فاصل ارتفاع الضغط لمكثف,"Überdruckabschalter eines Kondensators, m",overpressure disconnector for a capacitor,desconectador de sobrepresión de un condensador,"déconnecteur à surpression d'un condensateur, m",interruttore a sovrapressione di un condensatore,コンデンサの過圧遮断器,커패시터 과 압력 단로기,конденсаторт зориулсан хэт даралтын салгуур,odłącznik nadciśnieniowy kondensatora,disconector de sobrepressão de um condensador,nadtlačni ločilnik kondenzatorja,"натпритисни растављач за кондензатор, м јд",övertrycksskydd,"过压隔离器, <电容器的>"
436-03-18,capacitor bank protection,https://www.electropedia.org/iev/iev.nsf/display?openform&ievref=436-03-18,حماية مجموعة المكثفات,"Kondensatorbatterieschutz, m",capacitor bank protection,protección de batería de condensadores,"protection de batterie de condensateurs, f",protezione di una batteria di un condensatore,コンデンサバンク保護,커패시터 뱅크 보호,конденсаторын батарейн хамгаалалт,ochrona baterii kondensatorów,protecção de bateria de condensadores,zaščita kondenzatorske baterije,"заштита батерије кондензатора, ж јд",skydd för kondensatorbatteri,电容器组保护
436-03-19,unbalance protection for a capacitor bank,https://www.electropedia.org/iev/iev.nsf/display?openform&ievref=436-03-19,حماية عدم التوازن لمجموعة المكثفات,"Unsymmetrieschutz einer Kondensatorbatterie, m",unbalance protection for a capacitor bank,protección de desequilibrio de batería de condensadores,"protection de déséquilibre de batterie de condensateurs, f",protezione a squilibrio di una batteria di condensatori,コンデンサバンクの不均衡保護,커패시터 뱅크 불평형 보호,конденсаторын батарейн ялгаврын хамгаалалт,ochrona przed asymetrią baterii kondensatorów,protecção de desequilíbrio de bateria de condensadores,zaščita kondenzatorske baterije pri nesimetriji,"заштита од неуравнотежености батерије кондензатора, ж јд",obalansskydd,"不平衡保护, <电容器组的>"
436-04-01,capacitance tolerance (of a capacitor),https://www.electropedia.org/iev/iev.nsf/display?openform&ievref=436-04-01,سماحية سعوية  للمكثف,"Kapazitätstoleranz (eines Kondensators), f",capacitance tolerance (of a capacitor),tolerancia de capacidad (de un condensador),"tolérance de capacité (d'un condensateur), f",tolleranza di capacità (di un condensatore),静電容量許容差（コンデンサの）コンデンサの静電容量許容差,"커패시턴스 허용오차, <커패시터>","багтаамжийн зөвшөөрөгдөх хазайлт, <конденсаторын>",tolerancja pojemności,tolerância de capacidade (de um condensador),toleranca kapacitivnosti (kondenzatorja),"толеранција капацитивности , <кондензатора> ж јд",kapacitanstolerans,"电容偏差, <电容器的>"
436-04-02,equivalent series resistance (of a capacitor),https://www.electropedia.org/iev/iev.nsf/display?openform&ievref=436-04-02,مقاومة التوالي المكافئة (لمكثف),"äquivalenter Serienwiderstand (eines Kondensators), m",equivalent series resistance (of a capacitor),resistencia serie equivalente (de un condensador),"résistance-série équivalente (d'un condensateur), f",resistenza serie equivalente (di un condensatore),等価直列抵抗（コンデンサの）コンデンサの等価直列抵抗,"등가 직렬 저항, <커패시터>","эквивалент цуваа эсэргүүцэл, <конденсаторын>",rezystancja szeregowa równoważna (kondensatora) rezystancja szeregowa zastępcza (kondensatora),resistência-série equivalente (de um condensador),ekvivalentna zaporedna rezistanca (kondenzatorja),"еквивалентна редна отпорност , <кондензатора> ж јд",ekvivalent serieresistans,"等效串联电阻, <电容器的>"
436-04-03,high frequency capacitance (of a capacitor),https://www.electropedia.org/iev/iev.nsf/display?openform&ievref=436-04-03,سعة مكثف عند الترددات العالية,"Hochfrequenzkapazität (eines Kondensators), f",high frequency capacitance (of a capacitor),capacidad en alta frecuencia (de un condensador),"capacité à haute fréquence (d'un condensateur), f",capacità in alta frequenza (di un condensatore),高周波静電容量（コンデンサの）コンデンサの高周波静電容量,"고주파수 커패시턴스, <커패시터>","өндөр давтамжийн багтаамж, <конденсаторын>",pojemność kondensatora przy wielkiej częstotliwości pojemność przy wielkiej częstotliwości,capacidade para alta frequência (de um condensador),visokofrekvenčna kapacitivnost (kondenzatorja),"капацитивност при високим фреквенцијама, <кондензатора> ж јд",högfrekvenskapacitans,"高频电容, <电容器的>"
436-04-04,open-circuit intermediate voltage (of a capacitor divider),https://www.electropedia.org/iev/iev.nsf/display?openform&ievref=436-04-04,الجهد المتوسط لدارة مفتوحة لمقسم جهد سعوي,"mittlere Leerlaufspannung (eines kapazitiven Spannungsteilers), f",open-circuit intermediate voltage (of a capacitor divider),tensión intermedia a circuito abierto (de un divisor capacitivo),tension intermédiaire à circuit ouvert (d'un diviseur capacitif) f,tensione intermedia a circuito aperto (di un divisore capacitivo),（コンデンサ分割器の）開路中間電圧コンデンサ分割器の開路中間電圧,"개방 회로 중압, <커패시터 분압기>","задгай хэлхээний завсрын хүчдэл, <багтаамжийн хуваагчийн>",napięcie pośrednie obwodu otwartego (dzielnika pojemnościowego) napięcie pośrednie jałowe (dzielnika pojemnościowego),tensão intermédia em circuito aberto (de um divisor capacitivo),vmesna napetost pri odprtem tokokrogu (kapacitivnega delilnika),"напон на разделном кондензатору у празном ходу, <капацитивног делитеља> м јд",tomgangsmellanspänning,"开路中间电压, <电容分压器的>"
436-04-05,(voltage) ratio of a capacitor divider,https://www.electropedia.org/iev/iev.nsf/display?openform&ievref=436-04-05,نسبة الجهد لمقسم جهد سعوي,"Übersetzungsverhältnis eines kapazitiven Spannungsteilers, n",(voltage) ratio of a capacitor divider,relación de tensión (de un divisor capacitivo),"rapport de tension (d'un diviseur capacitif), m",rapporto di tensione (di un divisore capacitivo),コンデンサ分割器の電圧比,커패시터 분압기의 전압비,багтаамжийн хуваагчийн хүчдэлийн харьцаабагтаамжийн хуваагчийн хүчдэлийн коэффициент,przekładnia napięciowa (dzielnika pojemnościowego),relação de tensão (de um divisor capacitivo),napetostno razmerje kapacitivnega delilnika,"преносни однос напона капацитивног делитеља, м јд",spänningsdelaromsättning,"分压比, <电容分压器的>电压比, <电容分压器的>"
436-04-06,limiting voltage of a capacitor,https://www.electropedia.org/iev/iev.nsf/display?openform&ievref=436-04-06,الجهد الحدي للمكثف,"Grenzspannung eines Kondensators, f",limiting voltage of a capacitor,tensión limite de un condensador,"tension limite d'un condensateur, f",tensione limite di un condensatore,コンデンサの制限電圧,커패시터 한계 전압,конденсаторын хязгаарын хүчдэл,napięcie graniczne kondensatora,tensão limite de um condensador,mejna napetost kondenzatorja,"гранични напон кондензатора, м јд",gränstoppspänning,"极限电压, <电容器的>"
436-04-07,maximum permissible AC voltage of a capacitor,https://www.electropedia.org/iev/iev.nsf/display?openform&ievref=436-04-07,الجهد المتردد الاقصى المسموح به لمكثف,"höchste zulässige Wechselspannung eines Kondensators, f",maximum permissible AC voltage of a capacitor,tensión alterna máxima admisible de un condensador,"tension alternative maximale admissible d'un condensateur, f",massima tensione alternata ammissibile di un condensatore,コンデンサの最大許容交流電圧,커패시터 최대 허용 교류 전압,конденсаторын зөвшөөрөгдөх хамгийн их хувьсах хүчдэл,napięcie przemienne maksymalne dopuszczalne kondensatora,tensão alterna máxima admissível de um condensador,najvišja dopustna izmenična napetost kondenzatorja,"највиши дозвољени наизменични напон кондензатора, м јд",högsta driftspänning,"最大允许交流电压, <电容器的>"
436-04-08,limiting current of a capacitor,https://www.electropedia.org/iev/iev.nsf/display?openform&ievref=436-04-08,التيار الحدي لمكثف,"Grenzstrom eines Kondensators, m",limiting current of a capacitor,corriente límite de un condensador,"courant limite d'un condensateur, m",corrente limite di un condensatore,コンデンサの制限電流,커패시터 한계 전류,конденсаторын хязгаарын гүйдэл,prąd graniczny kondensatora,corrente limite de um condensador,mejni tok kondenzatorja,"гранична струја кондензатора, ж јд",högsta korttidsström,"极限电流, <电容器的>"
436-04-09,maximum permissible AC current of a capacitor,https://www.electropedia.org/iev/iev.nsf/display?openform&ievref=436-04-09,أقصى تيار متردد مسموح به للمكثف,"höchster zulässiger Wechselstromwert eines Kondensators, m",maximum permissible AC current of a capacitor,corriente alterna máxima admisible de un condensador,"courant alternatif maximal admissible d'un condensateur, m",massima corrente alternata ammissibile di un condensatore,コンデンサの最大許容交流電流,커패시터 최대 허용 교류 전류,конденсаторын зөвшөөрөгдөх хамгийн их хувьсах гүйдэл,prąd przemienny maksymalny dopuszczalny kondensatora,corrente alterna máxima admissível de um condensador,največji dopustni izmenični tok kondenzatorja,"највећа дозвољена наизменична струја кондензатора, ж јд",högsta driftström,"最大允许交流电流, <电容器的>"
436-04-10,capacitor losses,https://www.electropedia.org/iev/iev.nsf/display?openform&ievref=436-04-10,مفاقيد مكثف,"Kondensatorverluste, m, pl",capacitor losses,pérdidas de un condensador,"pertes d'un condensateur, f pl",perdite del condensatore,コンデンサ損,커패시터 손실,конденсаторын алдагдлууд,straty w kondensatorze,perdas de um condensador,izgube v kondenzatorju,"губици кондензатора, м мн",kondensatorförluster,电容器的损耗
436-04-11,tangent of the loss angle (of a capacitor),https://www.electropedia.org/iev/iev.nsf/display?openform&ievref=436-04-11,ظل زاوية الفقد (لمكثف),"Tangens des Verlustwinkels (eines Kondensators), mtan δ, Abkürzung",tangent of the loss angle (of a capacitor)tan δ (abbreviation),tan d (de un condensador)tangente del ángulo de pérdidas (de un condensador),"tangente de l'angle de perte (d'un condensateur), ftan δ (abréviation) f",tangente dell'angolo di perdita (di un condensatore),（コンデンサの）損角の正接コンデンサの損角の正接,"손실각의 탄젠트, <커패시터>","алдагдлын өнцгийн тангенс, <конденсаторын>tan δ",tangens kąta strat (kondensatora)tg δ (kondensatora),tangente do ângulo de perdas (de um condensador),tangens izgubnega kota (kondenzatorja) tan d (kondenzatorja),"тангенс угла губитака , <кондензатора> м јдtan δ",förlustfaktor,"损耗角正切, <电容器的>"
