term_id,term,term_url,ar,de,en,es,fr,it,ja,ko,pl,pt,sv,zh
723-08-32,colour stimulus,https://www.electropedia.org/iev/iev.nsf/display?openform&ievref=723-08-32,محفّز لون,"Farbreiz, m",colour stimulus,estímulo (de color),"stimulus (de couleur), m",stimolo di colore,色刺激,색자극,bodziec kolorowy,estímulo (de cor),färgstimulus,
723-08-33,chromaticity,https://www.electropedia.org/iev/iev.nsf/display?openform&ievref=723-08-33,نوعية لون الضوء,"Farbart, f",chromaticity,cromaticidad,"chromaticité, f",cromaticità,色度,색도,chrominancja,cromaticidade,färgartkromaticitet,
723-08-34,(correlated) colour temperature,https://www.electropedia.org/iev/iev.nsf/display?openform&ievref=723-08-34,ارتباط درجة حرارة  اللون,"ähnlichste Farbtemperatur, fFarbtemperatur, f",(correlated) colour temperature,temperatura de color,température de couleur (proximale) (d'un stimulus) f,temperatura di colore (correlata),色温度,상관 색온도,temperatura barwy (źródła promieniowania),temperatura de cor (aproximada) (de um estímulo),färgtemperatur,
723-08-35,primary (colour),https://www.electropedia.org/iev/iev.nsf/display?openform&ievref=723-08-35,ا(لون)أولى,"Primärfarbe, f",primary (colour),(color) primario,"(couleur) primaire, m",(colore) primario,原色,원색,kolor podstawowy,(cor) primária,primärfårg,
723-08-36,matrixing (in colour television),https://www.electropedia.org/iev/iev.nsf/display?openform&ievref=723-08-36,تصفيف (في التلفاز الملون)عمل مصفوفة,"Matrizierung, <im Farbfernsehen> f",matrixing (in colour television),transformación lineal (en televisiones en color),matriçage (en télévison en couleur) m,matrice (trasformazione lineare),マトリックス,"행렬화, <컬러텔레비전>",matrycowanie (w telewizji kolorowej),matrizagem (em televisão a cores),matrisering,
723-08-37,display primaries,https://www.electropedia.org/iev/iev.nsf/display?openform&ievref=723-08-37,أوليات العرض,"Empfänger-Primärfarben, f, pl",display primaries,primarios de síntesis,"primaires de synthèse, m pl",primari di visualizzazione (sintesi),ディスプレイ用３原色,표시 원색,kolory podstawowe syntezy (obrazu),primárias de síntese,primärfärgstimuli,
723-08-38,transmission primaries,https://www.electropedia.org/iev/iev.nsf/display?openform&ievref=723-08-38,أوليات الإرسال,"Übertragungs-Primärfarben, f, pl",transmission primaries,primarios de transmisión,"primaires de transmission, m pl",primari di trasmissione,送信用３原色,전송 원색,transmisja kolorów podstawowych,primárias de transmissão,primärfårger för överföring,
723-08-39,reference white,https://www.electropedia.org/iev/iev.nsf/display?openform&ievref=723-08-39,لون البياض المرجعي,"Referenzweiß, nVergleichsweiß, n",reference white,blanco de referencia,"blanc de référence, m",bianco di riferimento,基準白色,기준 백색,biel odniesienia,branco de referência,referensvitt,
723-08-40,saturation (of a colour),https://www.electropedia.org/iev/iev.nsf/display?openform&ievref=723-08-40,تشبع  (للون),"Farbsättigung, fSättigung, f",saturation (of a colour),saturación (de un color),saturation (d'une couleur) f,saturazione,飽和度彩度,"채도, <컬러>",nasycenie koloru,saturação (de uma cor),färgmättnad,
723-08-41,colorimetric system (in television),https://www.electropedia.org/iev/iev.nsf/display?openform&ievref=723-08-41,نظام الالوان (التلفاز),"farbmetrisches System, <im Fernsehen> nFarbvalenzsystem, <im Fernsehen> n",colorimetric system (in television),sistema calorimétrico (en televisión),système colorimétrique (en télévision) m,sistema colorimetrico,"表色系, <テレビジョン>","표색계, <텔레비전>",system kolorymetryczny (w telewizji),sistema colorimétrico (em televisão),kolorimetrisystem,
723-08-42,colorimetric functions,https://www.electropedia.org/iev/iev.nsf/display?openform&ievref=723-08-42,وظائف الالوان,"Spektralwertkurven, f, pl",colorimetric functions,funciones colorimétricas,"fonctions colorimétriques, f pl",funzioni colorimetriche,測色関数,표색 함수,funkcje kolorymetryczne,funções colorimétricas,färgavstämningskurva,
723-08-43,luminance factors,https://www.electropedia.org/iev/iev.nsf/display?openform&ievref=723-08-43,معاملات النصوع,"Luminanzfaktoren, m, pl",luminance factorscoefficients of luminance (deprecated),coeficiente de luminanciafactor de luminancia (término desaconsejado),"facteurs de luminance, m plcoefficients de luminance (terme à proscrire) m pl",fattori di luminanza,輝度率,휘도율,współczynnik luminancji,factores de luminância,luminansfaktor,
723-08-44,luminance axis,https://www.electropedia.org/iev/iev.nsf/display?openform&ievref=723-08-44,محور النصوع,"Luminanzachse, f",luminance axis,eje de luminancia,"axe de luminance, m",assi di luminanza,輝度軸,휘도축,osie luminancji,eixo de luminância,luminansaxel,
723-08-45,chromaticity diagram,https://www.electropedia.org/iev/iev.nsf/display?openform&ievref=723-08-45,مخطط التلوين,"Farbtafel, f",chromaticity diagram,diagrama de cromaticidad,"diagramme de chromaticité, m",diagramma di cromaticità,色度図,색도도,wykres chrominancji,diagrama de cromaticidade,kromacitetsdiagram,
723-08-46,white zone (in a chromaticity diagram),https://www.electropedia.org/iev/iev.nsf/display?openform&ievref=723-08-46,منطقة البياض ( في مخطط اللونية),"Unbuntbereich, <in einer Farbtafel> m",white zone (in a chromaticity diagram),zona del blanco (en un diagrama de cromaticidad),zone du blanc (dans un diagramme de chromaticité) f,zona del bianco,白色領域,"백색 지역, <색도도>",strefa bieli (na wykresie chrominancji),zona do branco (num diagrama de cromaticidade),vitområde,
723-08-47,chrominance (vector),https://www.electropedia.org/iev/iev.nsf/display?openform&ievref=723-08-47,تلون (متجة),"Chrominanzvektor, mChrominanz, f",chrominance (vector),(vector) crominancia,"(vecteur) chrominance, f",(vettore) crominanza,クロミナンス,색차 벡터,wektor chrominancji,(vector) crominância,krominans,
723-08-48,chrominance components,https://www.electropedia.org/iev/iev.nsf/display?openform&ievref=723-08-48,مكونات التلوين,"Chrominanzkomponenten, f, plFarbartkomponenten, f, pl",chrominance components,componentes de la crominancia,"composantes de chrominance, f pl",componenti di crominanza,クロミナンス成分,색차 성분,składowe chrominancji,componentes de crominância,krominanskomposant,
723-08-49,chrominance axis,https://www.electropedia.org/iev/iev.nsf/display?openform&ievref=723-08-49,محور التلوين,"Farbartkoordinate, f",chrominance axis,eje de crominancia,"axe de chrominance, m",assi di crominanza,クロミナンス軸,색도축,osie chrominancji,eixo de crominância,krominanskoordinat,
723-08-50,illuminant,https://www.electropedia.org/iev/iev.nsf/display?openform&ievref=723-08-50,مضيء,"Lichtart, f",illuminant,iluminante,"illuminant, m",illuminante,光源,광원측색용 광,źródło promieniowania,iluminante,belysning,
723-09-01,cabled distribution system,https://www.electropedia.org/iev/iev.nsf/display?openform&ievref=723-09-01,نظام التوزيع بالكبل,"Breitbandkabel-Verteilnetz, n",cabled distribution system,sistema de distribución por cable,"réseau de télédistribution, mréseau de (distribution par) câbles, mréseau сâblé (terme à proscrire dans ce sens) m",sistemi di distribuzione via cavo,ケーブル分配方式,유선 분배 시스템,system rozprowadzania kablowego,rede de teledistribuiçãorede de (distribuição por) cabos,ledningsbundet distributionssystem,
723-09-02,MATV,https://www.electropedia.org/iev/iev.nsf/display?openform&ievref=723-09-02,هوائي رئيسي,"Gemeinschaftsantennenanlage, fGA, AbkürzungGroßgemeinschaftsantennenanlage, fGGA, Abkürzung",MATVmaster (broadcasting) antenna,antena colectiva de radiodifusión,antenne collective (de radiodiffusion) f,MATV (impianto d'antenna collettiva),共同受信アンテナMATV,엠에이티브이공시청 설비,antena radiodyfuzyjna głównaantena główna,antena colectiva (de radiodifusão),centralantenn,
723-09-03,CATV,https://www.electropedia.org/iev/iev.nsf/display?openform&ievref=723-09-03,هوائي مشترك,"kommunale Gemeinschaftsantennenanlage, f",CATVcommunal (broadcasting) antenna,antena comunitaria,antenne communautaire (de radiodiffusion) fantenne collective (de radiodiffusion) f,CATV (impianto d'antenna comunitario),共同受信アンテナCATV,시에이티브이공시청 설비케이블 텔레비전,antena radiodyfuzyjna zbiorowaantena zbiorowa,antena colectiva (de radiodifusão)antena comunitária (de radiodifusão),centralantenn,
723-09-04,optical fibre distribution system,https://www.electropedia.org/iev/iev.nsf/display?openform&ievref=723-09-04,نظام توزيع بالألياف  البصريّة,"Glasfaserverteilnetz, n",optical fibre distribution system,red de teledistribución por fibra óptica,"réseau de télédistribution par fibres optiques, m",sistema di distribuzione con fibra ottica,光ファイバ分配方式,광섬유 분배 시스템,system rozprowadzania światłowodowego,rede de teledistribuição por fibras ópticas,optofibersystem,
723-09-05,star system,https://www.electropedia.org/iev/iev.nsf/display?openform&ievref=723-09-05,نظام النجمة,"Sternnetz, n",star systemstar network,red (de teledistribución) en estrella,"réseau (de télédistribution) en étoile, m",sistema a stella,星形分配方式,성형시스템성형망,system gwiazdowy sieć gwiazdowa,rede (de teledistribuição) em estrela,stjärnnät,
723-09-06,tree and branch system,https://www.electropedia.org/iev/iev.nsf/display?openform&ievref=723-09-06,نظام الشجرة والفرع (التوزيع عن بعد),"Baumnetz, n",tree and branch system,red (de teledistribución) en árbol,"réseau (de télédistribution) en arbre, m",sistema ad albero,分枝形分配方式,나뭇가지 시스템,system rozgałęźny,rede (de teledistribuição) em árvore,kaskadnät,
723-09-07,multi-star system,https://www.electropedia.org/iev/iev.nsf/display?openform&ievref=723-09-07,نظام متعدد النجوم,"Mehrsternnetz, n",multi-star systemmulti-star network,red (de teledistribución) multiestrella,"réseau (de télédistribution) multiétoile, m",sistema (di distribuzione) multistella,多重星形分配方式,다중 성형 시스템다중 성형 망,system wielogwiazdowy sieć wielogwiazdowa,rede (de teledistribuição) multi-estrela,flerstjärnnät,
723-09-08,switched-star system,https://www.electropedia.org/iev/iev.nsf/display?openform&ievref=723-09-08,نظام تبديل النجوم (التوزيع عن بعد),"vermittlungsfähiges Sternnetz, ngeschaltetes Sternnetz, n",switched-star systemswitched-star network,red (de teledistribución) conmutada,"réseau (de télédistribution) commuté, m",sistema (di distribuzione) commutato a stella,星形切換方式,교환 성형 시스템교환 성형 망,system gwiazdowy abonencki sieć gwiazdowa abonencka,rede (de teledistribuição) comutada,kopplat stjärnnät,
723-09-09,(cabled distribution) sub-system,https://www.electropedia.org/iev/iev.nsf/display?openform&ievref=723-09-09,نظام فرعي  ( توزيع بالكبل ),"Breitbandkabel-Teilnetz, n",(cabled distribution) sub-system,subred (de teledistribución),"sous-réseau (de télédistribution), m",sottosistema (di distribuzione via cavo),サブシステム,유선 분배 부시스템,podsystem rozprowadzania kablowegopodsystem,sub-rede (de teledistribuição),lokalt distributionssystem,
723-09-10,block,https://www.electropedia.org/iev/iev.nsf/display?openform&ievref=723-09-10,مجموعة,"Häuserblock, mBlock, m",block,,flot (dans un réseau de télédistribution) m,blocco (di abitazioni),ブロック,블록,grupa domów,ilhota (numa rede de teledistribuição),block,
723-09-11,head-end (of a cabled distribution system),https://www.electropedia.org/iev/iev.nsf/display?openform&ievref=723-09-11,طرف الرأس (نظام التوزيع بالكبل),"Kopfstelle, <eines Breitbandkabel-Verteilnetzes> f",head-end (of a cabled distribution system),cabeza de la red (de una red de teledistribución),"tête de réseau (de télédistribution), fstation centrale (terme déconseillé dans ce sens) f",terminale di testa,ヘッドエンド,"헤드 엔드, <유선 분배 시스템>",stacja główna (systemu rozprowadzania kablowego),cabeça de rede (de teledistribuição),huvudcentral,
723-09-12,feeder (in a cabled distribution system),https://www.electropedia.org/iev/iev.nsf/display?openform&ievref=723-09-12,مغذي (في نظام توزيع الكبل),"Leitung, <in einem Breitbandkabel-Verteilnetz> f",feeder (in a cabled distribution system),línea (en una red de teledistribución),ligne (dans un réseau de télédistribution) f,cavo (linea),フィーダ,"급전선, <케이블 분배 시스템>",linia przesyłowa (w systemie rozprowadzania kablowego),linha (numa rede de teledistribuição),matarledning,
723-09-13,super trunk feeder,https://www.electropedia.org/iev/iev.nsf/display?openform&ievref=723-09-13,مغذي خط رئيسي فائق,"Hauptstammleitung, f",super trunk feeder,línea (primaria) de transferencia,"ligne (primaire) de transfert, f",cavo primario di trasferimento,超幹線フィーダ,초중계선 급전기,linia przesyłowa (między doprowadzeniami głównymi),linha (primária) de transferência,trunkledning,
723-09-14,trunk feeder,https://www.electropedia.org/iev/iev.nsf/display?openform&ievref=723-09-14,مغذي خط رئيسي,"Stammleitung, f",trunk feeder,línea primaria,"ligne primaire, f",cavo primario,幹線フィーダ,중계선 급전기,linia przesyłowa początkowa,linha primária,stamledning,
723-09-15,branch feeder,https://www.electropedia.org/iev/iev.nsf/display?openform&ievref=723-09-15,مغذي فرعي,"Zweigleitung, f",branch feeder,línea secundaria,"ligne secondaire, f",cavo secondario,分岐フィーダ,분기 급전선,linia przesyłowa odgałęźna,linha secundária,grenledning,
723-09-16,spur feeder,https://www.electropedia.org/iev/iev.nsf/display?openform&ievref=723-09-16,مغذي توزيع,"Stichleitung, <in einem Breitbandkabel-Verteilnetz> fVerteilleitung, <in einem Breitbandkabel-Verteilnetz> f",spur feederdistribution feeder,línea de distribución (línea terciaria),"ligne de distribution, fligne tertiaire, f",cavo di distribuzione,分配フーダ,지선 급전기분배 급전선,linia przesyłowa rozprowadzająca,linha terciárialinha de distribuição,fördelningsledning,
723-09-17,subscriber's feeder,https://www.electropedia.org/iev/iev.nsf/display?openform&ievref=723-09-17,مغذى المشتركِ,"Teilnehmerleitung, f",subscriber's feeder,línea de usuario (línea de abonado),"ligne d'usager, fligne de raccordement (d'usager) fligne d'abonné, f",cavo d'utente,加入者用フィーダ,가입자 급전선,linia przesyłowa abonencka,linha de utente,abonnentledning,
723-09-18,"star point, <in a cabled distribution system>",https://www.electropedia.org/iev/iev.nsf/display?openform&ievref=723-09-18,نقطة النجمة عقدة,"Sternpunkt, <eines Breitbandkabel-Verteilnetzes> mNetzknoten, <eines Breitbandkabel-Verteilnetzes> m","star point, <in a cabled distribution system>",nodo (de una red de teledistribución),"noeud de répartition, <d'un réseau de télédistribution> m",punto di ripartizione,"節, <ケーブル分配方式の>","성형 지점마디, 유선 분배 시스템노드",węzeł (systemu rozprowadzania kablowego),nó de repartição (de uma rede de teledistribuição),stjärnnätsnod,
723-09-19,distribution point,https://www.electropedia.org/iev/iev.nsf/display?openform&ievref=723-09-19,نقطة توزيع,"Verteilerstelle, f",distribution point,punto de distribución (de una red de teledistribución),point de distribution (d'un réseau de télédistribution) m,punto di distribuzione,分配点,분배점,punkt rozdzielczy,ponto de distribuição (de uma rede de teledistribuição),fördelningspunkt,
723-09-20,system outlet,https://www.electropedia.org/iev/iev.nsf/display?openform&ievref=723-09-20,مخرج نظامِ,"Netzausgang, m",system outlet,terminación de la red,"arrivée de réseau, f",punto terminale della rete (presa d'utente),システムアウトレット,시스템 출구,punkt przyłączenia abonentów,chegada de rede,anslutningspunkt,
723-09-21,looped system outlet,https://www.electropedia.org/iev/iev.nsf/display?openform&ievref=723-09-21,مخرج نظام حلقي,"Netzschleife, f",looped system outlet,salida directa (conexión directa),sortie directe (d'un réseau de télédistribution) f,prese d'utente in cascata,ループ方式アウトレット,고리 시스템 출구,przyłączenie odbiornika (bez stosowania linii abonenckiej),saída directa (numa rede de teledistribuição),slinganslutning,
723-09-22,subscriber's outlet,https://www.electropedia.org/iev/iev.nsf/display?openform&ievref=723-09-22,مخرج المشترك,"Teilnehmeranschluss, m",subscriber's outlet,toma (de usuario),"prise (d'usager), f",presa d'utente,加入者用アウトレット,가입자 출구,przyłącze abonenckie,tomada (de utente),mottagaruttag,
723-09-23,receiver lead,https://www.electropedia.org/iev/iev.nsf/display?openform&ievref=723-09-23,سلك المستقبل,"Empfänger-Zuleitung, f",receiver lead,cordón de enlace,"cordon de raccordement, m",cavo (di connessione) del ricevitore (alla presa d'utente),受信機リード,수신기 도입선,doprowadzenie do odbiornika,cabo de ligação,mottagarkabel,
723-09-24,cable (distribution system) receiver,https://www.electropedia.org/iev/iev.nsf/display?openform&ievref=723-09-24,كبل استقبال (نظام توزيع),"Kabelempfänger, m",cable (distribution system) receiver,receptor de teledistribución,"récepteur pour télédistribution, m",ricevitore (del sistema di distribuzione) via cavo,ケーブル受信機,케이블 분배 시스템 수신기,odbiornik przystosowany (do systemu rozprowadzania kablowego),receptor para teledistribuição,kabelmottagare,
723-09-25,tap,https://www.electropedia.org/iev/iev.nsf/display?openform&ievref=723-09-25,نقطة تفريع,"Abzweig, m",tap,derivador,"dérivateur, m",derivatore (d'utente),タップ,탭,wstawka,derivador,avtappare,
723-09-26,subscriber's convertor,https://www.electropedia.org/iev/iev.nsf/display?openform&ievref=723-09-26,محول المشترك,"Teilnehmerumsetzer, m",subscriber's convertor,convertidor de usuario,"convertisseur d'usager, m",convertitore d'utente,加入者用変換器,가입자 변환기,konwerter abonencki,conversor de utente,abonnentomvandlare,
723-09-27,channel adaptor,https://www.electropedia.org/iev/iev.nsf/display?openform&ievref=723-09-27,مهايئ القناة,"Kanaladapter, m",channel adaptor,adaptador de canal,"adaptateur de canal, m",adattore di canale,チャネルアダプタ,채널 어댑터채널 접속 소켓,adapter kanałowy,adaptador de canal,kanalanpassare,
723-09-28,(subscriber's) channel selector,https://www.electropedia.org/iev/iev.nsf/display?openform&ievref=723-09-28,منتقي القناة (المشترك),"Teilnehmerkanalwähler, m",(subscriber's) channel selector,selector (individual) de programas,"sélecteur (individuel) de programme, m",selettore di canale (dell'utente),加入者用チャネルセレクタチャネルセレクタ,가입자 채널 선택자,selektor kanałowy abonenckiselektor kanałowy,selector (individual) de programa,kanalväljare,
723-09-29,level controller (in a network),https://www.electropedia.org/iev/iev.nsf/display?openform&ievref=723-09-29,متحكم المستوى (في الشبكات),"Pegelregler, <in einem Netz> m",level controller (in a network),regulador de nivel (en una red de teledistribución),régulateur de niveau (dans un réseau de télédistribution) m,regolatore del livello,レベル制御器,"레벨 제어기, <망>",stabilizator poziomu (w sieci),regulador de nível (numa rede de teledistribuição),nivåkontrollenhet,
723-09-30,automatic gain control,https://www.electropedia.org/iev/iev.nsf/display?openform&ievref=723-09-30,تحكم  آلي في الكسب,"automatische Verstärkungsregelung, fautomatischer Verstärkungsregler, mAVR",automatic gain controlAGC,control automático de ganancia,"commande automatique de gain, fCAG, f",controllo automatico di guadagno,自動利得制御,자동 이득 제어에이지시,"automatyczna regulacja wzmocnienia, f",controlo automático de ganhoCAGAGC,automatisk nivåreglering,自动增益控制
723-09-31,wide-band amplifier (for MATV or CATV),https://www.electropedia.org/iev/iev.nsf/display?openform&ievref=723-09-31,مضخم النطاق العريض (لنظام  MATV او CATV ),"Breitbandverstärker, <für Gemeinschaftsantennenanlagen oder kommunale Gemeinschaftsantennenanlagen> m",wide-band amplifier (for MATV or CATV),amplificador de banda ancha,amplificateur à large bande (d'antenne collective ou communautaire) mamplificateur toutes bandes (d'antenne collective ou communautaire) m,amplificatore a larga banda,"広帯域増幅器, <共同受信>","광대역 증폭기, <공시청 안테나 텔레비전 또는 종합유선방송>",wzmacniacz szerokopasmowy,amplificador de banda larga (de antena colectiva ou comunitária),bredbandsförstärkare,
723-09-32,multi-channel amplifier (for MATV or CATV),https://www.electropedia.org/iev/iev.nsf/display?openform&ievref=723-09-32,مضخّم متعدّد القنوات  (لنظام  MATV او CATV ),"Mehrkanalverstärker, <für Gemeinschaftsantennenanlagen oder kommunale Gemeinschaftsantennenanlagen> m",multi-channel amplifier (for MATV or CATV),amplificador multicanal,amplificateur de groupe de canaux (d'antenne collective ou communautaire) mamplificateur multicanaux (d'antenne collective ou communautaire) m,amplificatore multi-canale,"多重チャネル増幅器, <共同受信>","다중 채널 증폭기, <공시청 안테나 텔레비전 또는 종합유선방송>",wzmacniacz wielokanałowy,amplificador de grupo de canais (de antena colectiva ou comunitária)amplificador multicanais (de antena colectiva ou comunitária),flerkanalförstärkare,
723-09-33,single channel amplifier (for MATV or CATV),https://www.electropedia.org/iev/iev.nsf/display?openform&ievref=723-09-33,مضخم القناة المفردة (لنظام  MATV او CATV ),"Einkanalverstärker, <für Gemeinschaftsantennenanlagen oder kommunale Gemeinschaftsantennenanlagen> m",single channel amplifier (for MATV or CATV),amplificador monocanal,amplificateur monocanal (d'antenne collective ou communautaire) m,amplificatore di canale (singolo),"単一チャネル増幅器, <共同受信>","단일 채널 증폭기, <공시청 안테나 텔레비전 또는 종합유선방송>",wzmacniacz jednokanałowy,amplificador monocanal (de antena colectiva ou comunitária),kanalförstärkare,
723-09-34,single-input multiband amplifier,https://www.electropedia.org/iev/iev.nsf/display?openform&ievref=723-09-34,مضخم متعدد الأقنية وحيد المدخل,"Mehrbandverstärker mit einem Eingang, <für Gemeinschaftsantennenanlagen oder kommunale Gemeinschaftsantennenanlagen> m",single-input multiband amplifier,amplificador (multibanda) de una sola entrada,amplificateur (multibandes) à une entrée (d'antenne collective ou communautaire) m,amplificatore multibanda ad ingresso singolo,"単一入力多周波帯域増幅器, <共同受信>",단일 입력 다중대역 증폭기,wzmacniacz wielozakresowy o pojedynczym wejściu,amplificador (multibandas) de entrada única (de antena colectiva ou comunitária),bredbandsförstärkare med en ingång,
723-09-35,multiband amplifier with n inputs (for MATV or CATV),https://www.electropedia.org/iev/iev.nsf/display?openform&ievref=723-09-35,مضخم متعدّد النطاقات بعدد (ن) مدخل,"Mehrbandverstärker mit n Eingängen, <für Gemeinschaftsantennenanlagen oder kommunale Gemeinschaftsantennenanlagen> m",multiband amplifier with n inputs (for MATV or CATV),amplificador (multibanda) con n entradas,amplificateur (multibandes) à n entrées (d'antenne collective ou communautaire) m,amplificatore multibanda con n ingressi,"n入力多重帯域増幅器, <共同受信>","n 입력 다중대역 증폭기, <공시청 안테나 텔레비전 또는 종합유선방송>",wzmacniacz wielozakresowy o n wejściach,amplificador (multibandas) de n entradas (de antena colectiva ou comunitária),bredbandsförstärkare med flera ingångar,
723-09-36,bridger amplifier,https://www.electropedia.org/iev/iev.nsf/display?openform&ievref=723-09-36,مضخّم قنطره,"Verteilverstärker, m",bridger amplifier,amplificador de derivación,"amplificateur de dérivation, m",amplificatore di derivazione,分岐増幅器,분기증폭기,wzmacniacz mostkowy,amplificador de derivação,förgreningsförstärkare,
723-09-37,spur amplifier,https://www.electropedia.org/iev/iev.nsf/display?openform&ievref=723-09-37,مضخّم مهمازِ,"Abzweigverstärker, m",spur amplifierline extenderdistribution amplifier,amplificador de distribución,"amplificateur de distribution, mrépéteur de distribution (terme déconseillé) m",amplificatore di distribuzione,分配増幅器,지선 증폭기선 확장기분배 증폭기,wzmacniacz kompensujący tłumienia (linii przesyłowej),amplificador de distribuição,kompensationsförstärkare,
