term_id,term,term_url,ar,cs,de,en,es,fi,fr,it,ja,ko,pl,pt,sv,zh
713-10-08,supradyne receiver,https://www.electropedia.org/iev/iev.nsf/display?openform&ievref=713-10-08,مستقبل فوق القوة,supradynní přijímač,"Supradyn-Empfänger, m",supradyne receiver,receptor supradino,supradynevastaanotin,"récepteur supradyne, m",ricevitore supradina,スープラダイン受信機,슈프러다인 수신기,odbiornik superdynowy,receptor supradino,superdynmottagare,高外差式接收机
713-10-09,autodyne reception,https://www.electropedia.org/iev/iev.nsf/display?openform&ievref=713-10-09,استقبال بقوة تلقائية,autodynní příjem,"Autoheterodyn-Empfang, m",autodyne reception,recepción autodina,autodynevastaanotto,"réception autodyne, f",ricevitore autodina,オートダイン受信,오토다인 수신,odbiór autodynowy,receptor autodino,autodynmottagning,自差式接收
713-10-10,homodyne reception,https://www.electropedia.org/iev/iev.nsf/display?openform&ievref=713-10-10,استقبال بقوة متجانسة,homodynní příjem,"Homodyn-Empfang, m",homodyne reception,recepción homodina,homodynevastaanotto,"réception (à démodulation) synchrone, fréception homodyne, f",ricevitore (a demodulazione) sincrona,ホモダイン受信,호모다인 수신동기 수신,odbiór homodynowy,recepção (com desmodulação) síncrona,homodynmottagning,零差式接收
713-10-11,intermediate frequency,https://www.electropedia.org/iev/iev.nsf/display?openform&ievref=713-10-11,تردد أوسطي,mezifrekvencemezifrekvenčníIF,"Zwischenfrequenz, fZF, Abkürzung",intermediate frequencyIF  (abbreviation),FI (abreviatura)frecuencia intermedia,välitaajuus,"fréquence intermédiaire, fFI (abréviation) f",FI (acronimo)frequenza intermedia,"中間周波数IF, （略語）",중간 주파수아이에프,częstotliwość pośrednia p.cz. (akronim),frequência intermédiaFI (abreviatura),mellanfrekvens,中频IF
713-10-12,image frequency (in superheterodyne reception),https://www.electropedia.org/iev/iev.nsf/display?openform&ievref=713-10-12,تردد الصورة ( في استقبال بقوة فوقية),"zrcadlový kmitočet, <v superheterodynním příjmu>","Spiegelfrequenz, <bei Superheterodyn-Empfang> f",image frequency (in superheterodyne reception),frecuencia imagen (en recepción superheterodina),peilitaajuus,"fréquence conjuguée, ffréquence image  (terme à proscrire dans ce sens) f",frequenza immagine,"影像周波数, <スーパヘテロダイン受信の>","영상 주파수, <슈퍼헤테로다인 수신>",częstotliwość lustrzana,frequência conjugada,spegelfrekvens,"镜像频率, <超外差式接收中>"
713-10-13,regenerative receiver,https://www.electropedia.org/iev/iev.nsf/display?openform&ievref=713-10-13,مستقبل مجدد,regenerativní přijímačpřijímač s kladnou zpětnou vazbou,"Rückkopplungsempfänger, m",regenerative receiver,receptor regenerativo,regeneratiivinen vastaanotin,"récepteur à réaction, m",ricevitore a reazione,再生受信機,재생 수신기,odbiornik reakcyjny,receptor regenerativo,regenerativ mottagare,再生接收机
713-10-14,super-regeneration,https://www.electropedia.org/iev/iev.nsf/display?openform&ievref=713-10-14,إعادة تجديد ممتازة,superregenerace,"Pendelempfang, m",super-regeneration,super-regeneración,superregenerointi,"superréaction, f",supereazione,超再生,초재생,super reakcja,super-regeneração,superregenerering,超再生
713-10-15,diversity (reception),https://www.electropedia.org/iev/iev.nsf/display?openform&ievref=713-10-15,تنوع (الإستقبال),výběrový (příjem),"Diversity-Empfang, m",diversity (reception),diversidad (en recepción),toistevastaanotto,"(réception en) diversité, f",(ricezione in) divérsità (ricezione in) diversità,ダイバーシティ受信ダイバーシティ,다이버시티 수신,odbiór różnorodny,(recepção em) diversidade,diversitet,分集接收
713-10-16,time diversity,https://www.electropedia.org/iev/iev.nsf/display?openform&ievref=713-10-16,تباين الزمن,časový výběr,"Zeitdiversity-Empfang, m",time diversity,diversidad temporal,aikatoiste,"diversité temporelle, f",diversità nel tempo,時間ダイバーシティ,시간 다이버시티,różnorodność czasowa,diversidade temporal,tidsdiversitet,时间分集
713-10-17,order of diversity,https://www.electropedia.org/iev/iev.nsf/display?openform&ievref=713-10-17,درجة التباين,řád výběru,"Diversity-Grad, m",order of diversity,orden de diversidad,toisteaste,"ordre de diversité, m",ordine di diversità,ダイバーシティオーダ,다이버시티 차수,rząd różnorodności,ordem de diversidade,antal diversitetsgrenar,分集度
713-10-18,double diversity (reception),https://www.electropedia.org/iev/iev.nsf/display?openform&ievref=713-10-18,تباين مزدوج (استقبال),dvojitý výběrový (příjem),"Doppeldiversity-Empfang, m",double diversity (reception),doble diversidad (en recepción),kaksoistoiste,"(réception en) diversité double, f",(ricezione in) diversità doppia (ricezione in) diversità doppia,ダブルダイバーシティ受信ダブルダイバーシティ,이중 다이버시티 수신,odbiór przy różnorodności podwójnej   różnorodność podwójna,(recepção em) diversidade dupla,tvågrensdiversitet,双重分集接收
713-10-19,space diversity (reception),https://www.electropedia.org/iev/iev.nsf/display?openform&ievref=713-10-19,تباين مكاني (استقبال),prostorový výběrový (příjem),"Raumdiversity-Empfang, m",space diversity (reception),diversidad espacial (en recepción),paikkatoiste,"(réception en) diversité d'espace, f",(ricezione in) diversità di spazio (ricezione in) diversità di spazio,空間ダイバーシティ受信空間ダイバーシティ,공간 다이버시티 수신,odbiór przy różnorodności przestrzennejróżnorodność przestrzenna,(recepção em) diversidade de espaço,rumsdiversitet,空间分集接收
713-10-20,site diversity (reception),https://www.electropedia.org/iev/iev.nsf/display?openform&ievref=713-10-20,تباين موقع (استقبال),místní výběrový (příjem),"Ortsdiversity-Empfang, m",site diversity (reception),diversidad de emplazamiento (recepción),asematoisteasemapaikkatoiste,"(réception en) diversité d'emplacement, f",(ricezione in) diversità di luogo (ricezione in) diversità di luogo,サイトダイバーシティ受信サイトダイバーシティ,사이트 다이버시티 수신위치 상이점 수신,odbiór przy różnorodności miejscaróżnorodność miejsca,(recepção em) diversidade de local,lägesdiversitet,位置分集接收
713-10-21,frequency diversity (reception),https://www.electropedia.org/iev/iev.nsf/display?openform&ievref=713-10-21,تباين تردد (استقبال),kmitočtový výběrový (příjem),"Frequenzdiversity-Empfang, m",frequency diversity (reception),diversidad de frecuencia (en recepción),taajuustoiste,"(réception en) diversité de fréquence, f",(ricezione in)diversità di frequenza (ricezione in) diversità di frequenza,周波数ダイバーシティ受信周波数ダイバーシティ,주파수 다이버시티 수신수신 주파수 합성,odbiór przy różnorodności częstotliwościowejróżnorodność częstotliwościowa,(recepção em) diversidade de frequência,frekvensdiversitet,频率分集接收
713-10-22,cross band diversity (reception),https://www.electropedia.org/iev/iev.nsf/display?openform&ievref=713-10-22,تباين نطاقات متقاطعة (استقبال),pásmový výběrový (příjem),"Diversity-Empfang mit Frequenzumsetzung, m",cross band diversity (reception),diversidad de banda cruzada (en recepción),taajuusaluetoiste,"(réception en) diversité interbande, f",(ricezione in) diversità tra bande (ricezione in) diversità tra bande,クロスバンドダイバーシティ受信クロスバンドダイバーシティ,교차 주파 밴드 다이버시티 수신교차 주파 밴드 변화 수신,odbiór przy różnorodności międzypasmowejróżnorodność międzypasmowa,(recepção em) diversidade interbanda,kanaldiversitet,跨频带分集接收
713-10-23,polarization diversity (reception),https://www.electropedia.org/iev/iev.nsf/display?openform&ievref=713-10-23,تباين استقطاب (استقبال),polarizační výběrový (příjem),"Polarisationsdiversity-Empfang, m",polarization diversity (reception),diversidad de polarización (en recepción),polarisaatiotoiste,"(réception en) diversité de polarisation, f",{ricezione in) diversità di polarizzazione,偏波ダイバーシティ受信偏波ダイバーシティ,편파 다이버시티 수신,odbiór przy różnorodności polaryzacjiróżnorodność polaryzacji,(recepção em) diversidade de polarização,polarisationsdiversitet,极化分集接收
713-10-24,angle diversity (reception),https://www.electropedia.org/iev/iev.nsf/display?openform&ievref=713-10-24,تباين زاوي (استقبال),úhlový výběrový (příjem),"Winkeldiversity-Empfang, m",angle diversity (reception),diversidad angular (en recepción),kulmatoiste,"(réception en) diversité angulaire, f",(ricezione in) diversità d'angolo,角度ダイバーシティ受信角度ダイバーシティ,각도 다이버시티 수신,odbiór przy różnorodności kątowejróżnorodność kątowa,(recepção em) diversidade angular,vinkeldiversitet,角度分集接收
713-10-25,diversity gain,https://www.electropedia.org/iev/iev.nsf/display?openform&ievref=713-10-25,كسب التباين,výběrový zisk,"Diversity-Gewinn, m",diversity gain,ganancia de diversidad,toistevahvistus,"gain de diversité, m",guadagno di diversità,ダイバーシティ利得,발산 이득,wzmocnienie różnorodności,ganho de diversidade,diversitetsvinst,分集增益
713-10-26,diversity improvement factor,https://www.electropedia.org/iev/iev.nsf/display?openform&ievref=713-10-26,عامل تحسين التباين,poměr zlepšení výběrem,"Diversity-Verbesserungsfaktor, m",diversity improvement factor,factor de mejora por diversidad,toisteparannus,"facteur d'amélioration de diversité, m",fattore di miglioramento di diversità,ダイバーシティ改善率,다이버시티 개선도,współczynnik polepszenia wywołany różnorodnością,factor de melhoria de diversidade,diversitetsförbättringsfaktor,分集改善因数
713-10-27,(diversity) combiner,https://www.electropedia.org/iev/iev.nsf/display?openform&ievref=713-10-27,دامج (تباين),(výběrový) slučovač,"Diversity-Kombinator, m",(diversity) combiner,combinador (de diversidad),toisteyhdistelin,"combineur (de diversité), m",cornbinatore (di diversità),ダイバーシティコンバイナコンバイナ,다이버시티 결합기,sumator sygnałów różnorodności sumator sygnałów,combinador (de diversidade),diversitetssammanvägare,分集合并器
713-10-28,exalted carrier reception,https://www.electropedia.org/iev/iev.nsf/display?openform&ievref=713-10-28,استقبال الموجات الحاملة عالية المنسوب,příjem se zvýšenou úrovní nosné,"Empfang mit Trägeranhebung, f",exalted carrier reception,recepción con reforzamiento de la portadora,kantoaallonkorostusvastaanotto,"réception avec renforcement de la porteuse, f",ricezione con esaltamento della portante,強調搬送波受信,강화 반송파 수신,odbiór przy powiększonej częstotliwości nośnej,recepção com reforço da portadora,demodulering med förstärkt bärvåg,增强载波接收
713-10-29,local carrier reception,https://www.electropedia.org/iev/iev.nsf/display?openform&ievref=713-10-29,استقبال الموجة الحاملة المحلية,příjem s místní nosnoudemodulace s místní nosnou,"Empfang mit Trägerzusatz, m",local carrier receptionlocal carrier demodulation,recepción con portadora local,paikalliskantoaaltovastaanotto,"réception avec porteuse locale, f",ricezione con portante locale,ローカル搬送波受信ローカル搬送波復調,국부 반송파 수신국부 반송파 복조,odbiór z lokalną częstotliwością nośną,recepção com portadora local,lokal bärvågsdemodulering,本地载波接收本地载波解调
713-10-30,reconditioned carrier reception,https://www.electropedia.org/iev/iev.nsf/display?openform&ievref=713-10-30,استقبال الموجة الحاملة المجددة,příjem s obnovenou nosnoudemodulace s obnovenou nosnou,"Empfang mit Trägerrückgewinnung, f",reconditioned carrier receptionreconditioned carrier demodulation,demodulación con regeneración de la portadora,kantoaallon palauttava vastaanotto,"réception avec régénération de la porteuse, f",ricezione con rigenerazione della portante,再生搬送波受信再生搬送波復調,재생 반송파 수신재생 반송파 복조,odbiór z regenerowaną częstotliwością nośną,recepção com regeneração da portadora,demodulering med regenererad bärvåg,恢复载波接收恢复载波解调
713-10-31,muting,https://www.electropedia.org/iev/iev.nsf/display?openform&ievref=713-10-31,كبت,umlčování,"Stummschaltung, <bei schwachem Signal> f",mutingsquelch (US),bloqueo anti-ruido,mykistys,blocage antibruit (d'un récepteur) m,dispositivo di silenziamento (di un ricevitore),ミューティングスケルチ,뮤팅스퀠치잡음 억제,wyciszanie,bloqueio anti-ruído,,噪声抑制静音
713-10-32,desensitizing,https://www.electropedia.org/iev/iev.nsf/display?openform&ievref=713-10-32,إزالة الحساسية,desenzibilaceznecitlivění,"Stummschaltung, <bei Störung> f",desensitizing,bloqueo antiinterferencias,epäherkistys,blocage antibrouillage (d'un récepteur) m,,感度抑圧,감도 억압,odczulanie,bloqueio por dessensibilização,,降敏
713-10-33,automatic gain control,https://www.electropedia.org/iev/iev.nsf/display?openform&ievref=713-10-33,تحكم تلقائي(الي) في الكسب,automatické řízení ziskuAGC,"automatische Verstärkungsregelung, fautomatischer Verstärkungsregler, mAVR",automatic gain controlAGC,CAG (abreviatura)control automático de ganancia,automaattinen vahvistuksensäätö,"commande automatique de gain, fCAG, f",RAS (acronìmo)regolatore automatico di guadagno,自動利得制御,자동 이득 제어에이쥐시,"regulacja wzmocnienia automatyczna, fARW",controlo automático de ganhoCAGAGC,automatisk volymkontroll,自动增益控制AGC自动音量控制
713-10-34,(sensitivity) threshold of automatic gain control,https://www.electropedia.org/iev/iev.nsf/display?openform&ievref=713-10-34,عتبة (حساسية)التحكم التلقائي في الكسب,práh (citlivosti) automatického řízení zisku,"Empfindlichkeitsschwelle der automatischen Verstärkungsregelung, f",(sensitivity) threshold of automatic gain control,umbral (de sensibilidad) del control automático de ganancia,automaattisen vahvistuksensäädön kynnys,"seuil (de sensibilité) de la commande automatique de gain, m",soglia (di sensibilità) del regolatore automatico di guadagno,自動利得制御の感度しきい値自動利得制御のしきい値,감도 자동이득제어 문턱값,próg czułości automatycznej regulacji wzmocnienia próg automatycznej regulacji wzmocnienia,limiar (de sensibilidade) do controlo automático de ganho,tröskelvärde för automatisk volymkontroll,自动增益控制的灵敏度门限
713-10-35,automatic frequency control (of a superheterodyne receiver),https://www.electropedia.org/iev/iev.nsf/display?openform&ievref=713-10-35,تحكم تلقائي (الي) التردد (لمستقبل قوة فوقية),"automatické řízení kmitočtu, <superheterodynního přijímače>","automatische Frequenzregelung, <eines Superhet-Empfängers> fAFR",automatic frequency control (of a superheterodyne receiver)AFC  (abbreviation),CAF (abreviatura)control automático de frecuencia,automaattinen taajuudensäätö,commande automatique de fréquence (d'un récepteur superhétérodyne) fCAF  (abréviation) f,RAF (acronìmo)regolatore automatico di frequenza (di un ricevitore supereterodina),"自動周波数制御, <スーパヘテロダイン受信機の>AFC, （略語）","자동주파수제어, <슈퍼헤테로다인 수신기>에이에프시",regulacja częstotliwości automatyczna ARCz (akronim),controlo automático de frequência (de um receptor superheterodino)CAF (abreviatura),automatisk frekvenskontroll,"自动频率控制, <超外差式接收机的>AFC"
713-10-36,(sensitivity) threshold of automatic frequency control,https://www.electropedia.org/iev/iev.nsf/display?openform&ievref=713-10-36,عتبة (حساسية) التحكم التلقائي (الآلي) في التردد,práh (citlivosti) automatického řízení kmitočtu,"Empfindlichkeitsschwelle der automatischen Frequenzregelung, f",(sensitivity) threshold of automatic frequency control,umbral (de sensibilidad) del control automático de frecuencia,automaattisen taajuudensäädön kynnysautomaattisen taajuudensäädön herkkyyskynnys,"seuil (de sensibilité) de commande automatique de fréquence, m",soglia (di sensibilità) del regolatore automatico di frequenza,自動周波数制御の感度しきい値自動周波数制御のしきい値,감도 자동주파수제어 문턱값,próg czułości automatycznej regulacji częstotliwości próg automatycznej regulacji częstotliwości,limiar (de sensibilidade) do controlo automático de frequência,tröskelvärde för automatisk frekvenskontroll,自动频率控制的灵敏度门限
713-10-37,wave-trap,https://www.electropedia.org/iev/iev.nsf/display?openform&ievref=713-10-37,مصيدة للموجة,odlaďovačrezonanční zádržhradicí tlumivka,"Sperrfilter, nFrequenzsperre, f",wave-trap,filtro antiinterferencia,aaltoloukku,"filtre antibrouillage, mfiltre éliminateur  (de brouillage) mcircuit bouchon, m",circuito trappola,ウェーブトラック,웨이브 트랩,filtr pułapka,filtro anti-interferênciacircuito tampão,vågfälla,陷波器
713-10-38,tone control,https://www.electropedia.org/iev/iev.nsf/display?openform&ievref=713-10-38,تحكم في النغمة,regulátor tónu,"Tonblende, fTonsteller, mKlangsteller, m",tone control,control de tono,äänensävyn säätö,"réglage de tonalité, m",regolatore di tono,音質調整,음질 조절,regulator tonu,regulação de tonalidade,tonkontroll,音质控制
713-10-39,interstation noise suppression,https://www.electropedia.org/iev/iev.nsf/display?openform&ievref=713-10-39,اخماد الضوضاء بين المحطات,potlačení šumu mezi stanicemitiché ladění,"Stummschaltung, <bei Abstimmung> f",interstation noise suppressioninterstation mutingnoise suppression  (deprecated),supresión de ruido entre estaciones,virityksen aikainen mykistys,"(dispositif de) réglage silencieux, m",(dispositivo di) sintonia silenziosa,インタステーション雑音抑圧インターステーションミューティング,국간 잡음 억제국간 뮤팅,wyciszanie podczas strojenia,supressão de ruído inter-estações,,"台间噪声抑制台间静噪噪声抑制, <拒用>"
713-10-40,band-spreading,https://www.electropedia.org/iev/iev.nsf/display?openform&ievref=713-10-40,تمديد النطاق,rozprostření pásma,"Bandspreizung, f",band-spreading,ensanchamiento de banda,kaistanlevityskaistanlevitystoiminne,"dispositif à bande étalée, m",espansione di gamma,帯域拡大,대역 확산,rozszerzanie pasma,dispositivo de banda espraiada,bandexpandering,波段扩展
713-10-41,"preselected-channel ..., qualifier",https://www.electropedia.org/iev/iev.nsf/display?openform&ievref=713-10-41,قناة منتقاة مسبقا,"programovatelný kanál, <vymezení>kanálová předvolba, <vymezení>","Kanalvorwahl…, in Zusammensetzungen","preselected-channel ..., qualifier",canal preseleccionadode canal preseleccionado,esivalintakanavat,"à canaux préréglés, adj",a canali presintonizzati,"プリセレクトチャネル, 形容句",사전 선택 채널,kanał programowany,de canais pré-regulados (adjectivo),kanalförvals-,"预选信道…, <限定词>"
713-10-42,threshold (of a demodulator),https://www.electropedia.org/iev/iev.nsf/display?openform&ievref=713-10-42,استهلال (لمزيل تضمين),"práh, <demodulátoru>","Schwellenwert, <eines Demodulators> m",threshold (of a demodulator),umbral (de un demodulador),demodulaattorin kynnys,seuil (d'un démodulateur) m,soglia (di un demodulatore),"しきい値, <復調器の>","문턱값, <복조기>",próg (demodulatora),limiar (de um desmodulador),demoduleringströskel,"门限, <解调器的>"
713-10-43,modulation gain,https://www.electropedia.org/iev/iev.nsf/display?openform&ievref=713-10-43,كسب تضمين,modulační zisk,"Modulationsgewinn, m",modulation gain,ganancia de modulación,modulaatioparannus,"gain de modulation, m",guadagno di demodulazione,変調利得,변조 이득,zysk modulacji,ganho de modulação,moduleringsvinst,调制增益
713-10-44,threshold extension demodulation,https://www.electropedia.org/iev/iev.nsf/display?openform&ievref=713-10-44,ازالة التضمين بتوسيع الاستهلال,demodulace se sníženým prahem,"Demodulator mit Schwellenwertminderung, m",threshold extension demodulation,demodulación por extensión de umbral,kynnystä alentava ilmaisin,"démodulateur à abaissement de seuil, mdémodulateur à seuil amélioré, m",demodulatore a soglia ridotta,しきい値改善復調,문턱값 확장 복조,demodulacja z obniżonym progiem,desmodulador de limiar reduzido,,门限扩展解调
713-10-45,preamplifier,https://www.electropedia.org/iev/iev.nsf/display?openform&ievref=713-10-45,مضخم مسبق,předzesilovač,"Vorverstärker, m",preamplifier,preamplificador,esivahvistin,"préamplificateur, m",,前置増幅器,전치증폭기,przedwzmacniacz,pré-amplificador,förförstärkare,前置放大器
713-10-46,low-noise amplifier,https://www.electropedia.org/iev/iev.nsf/display?openform&ievref=713-10-46,مضخم منخفض الشوشرة,nízkošumový zesilovačLNA,"rauscharmer Verstärker, m",low-noise amplifierLNA,amplificador de bajo ruido ABR (abreviatura),pienikohinainen vahvistin,"amplificateur à faible bruit, m",LNA (abbreviazione) amplificatore a basso rumore,低雑音増幅器,저잡음 증폭기엘엔에이,"wzmacniacz o niskim poziomie szumów, mwzmacniacz niskoszumowy, m",amplificador de baixo ruído,lågbrusig förstärkare,低噪声放大器LNA
713-10-47,voltage-controlled oscillator,https://www.electropedia.org/iev/iev.nsf/display?openform&ievref=713-10-47,مذبذب يتم التحكم فيه بواسطة الجهد,napěťově řízený oscilátorVCO,"spannungsgesteuerter Oszillator, mVCO, Abkürzung",voltage-controlled oscillatorVCO (abbreviation),oscilador controlado por tensión,jänniteohjattu oskillaattori,"oscillateur commandé en tension, mOCT  (abréviation) m",VCO (acronímo)oscillatore controllato in tensione,"電圧制御発信器VCO, （略語）",전압 제어 발진기브이시오,oscylator regulowany napięciem,oscilador controlado em tensão,spänningsstyrd oscillator,压控振荡器VCO
713-10-48,phase locked loop,https://www.electropedia.org/iev/iev.nsf/display?openform&ievref=713-10-48,حلقة   مقفلة للطور,smyčka s fázovým závěsemPLL,"Phasenregelkreis, mPLL, Abkürzung",phase locked loopphase lock loopPLL (abbreviation),bucle enganchado en fase,vaihelukittu silmukka,"boucle à verrouillage de phase, f",anello ad aggancio di fase PLL (acronìmo),"位相同期ループPLL, （略語）",위상 동기 루프피엘엘,pętla fazowa,malha de captura de fase,faslåst slinga,锁相环PLL
713-10-49,watch receiver,https://www.electropedia.org/iev/iev.nsf/display?openform&ievref=713-10-49,مستقبل مترقب,čekající přijímač,"Standby-Empfänger, m",watch receiver,receptor de espera,päivystysvastaanotin,"récepteur de veille, m",ricevitore di attesa,ウォッチレシーバ,워치 수신기,odbiornik sterowany,receptor de vigília,övervakningsmottagare,监视接收机
713-10-50,panoramic receiver,https://www.electropedia.org/iev/iev.nsf/display?openform&ievref=713-10-50,مستقبل واسع الرؤية,panoramatický přijímač,"Panoramaempfänger, m",panoramic receiver,receptor panorámico,panoramavastaanotin,"récepteur panoramique, m",ricevitore panoramico,パノラマ受信機,파노라마 수신기,odbiornik panoramiczny,receptor panorâmico,panoramamottagare,扫描接收机
713-10-51,automatic-scanning receiver,https://www.electropedia.org/iev/iev.nsf/display?openform&ievref=713-10-51,مستقبل بمسح تلقائي (آلي),automaticky snímající přijímač,"automatischer Suchempfänger, m",automatic-scanning receiver,receptor de sintonía automática,itsehakeva vastaanotin,"récepteur à recherche automatique, m",ricevitore a ricerca automatica,自動走査受信機,자동 주사 수신기,odbiornik strojony automatycznie,receptor de procura automática,avsökningsmottagare,自动扫描接收机
713-10-52,sensitivity (of a receiver),https://www.electropedia.org/iev/iev.nsf/display?openform&ievref=713-10-52,حساسية (لمستقبل),"citlivost, <přijímače>","Empfindlichkeit, <eines Empfängers> fSchwellenpegel, <eines Empfängers> m",sensitivity (of a receiver),sensibilidad (de un receptor),herkkyysvastaanottimen herkkyys,sensibilité (d'un récepteur) f,sensibilità (di un ricevitore),"感度, <受信機の>","감도, <수신기>",czułość (odbiornika),sensibilidade (de um receptor),känslighet,"灵敏度, <接收机的>"
