term_id,term,term_url,ar,de,en,es,fr,it,ja,ko,mn,pl,pt,sl,sr,sv,zh
436-01-01,capacitance of a capacitor (property),https://www.electropedia.org/iev/iev.nsf/display?openform&ievref=436-01-01,سعة المكثف (خاصيه),"Kapazität eines Kondensators (Eigenschaft), f",capacitance of a capacitor (property),capacidad de un condensador (propiedad),capacité d'un condensateur (propriété) f,capacità di un condensatore (proprietà),コンデンサのキャパシタンス,"커패시터의 커패시턴스, <속성>","конденсаторын багтаамж, <шинж чанар>",pojemność kondensatora (właściwość),capacidade de um condensador (propriedade)capacidade de um capacitor (propriedade),kapacitivnost kondenzatorja,"капацитивност кондензатора , <особина> ж јд",kapacitans,"电容的电容量, <定性的>"
436-01-02,capacitance of a capacitor (quantity),https://www.electropedia.org/iev/iev.nsf/display?openform&ievref=436-01-02,سعة المكثف (كميه),"Kapazität eines Kondensators (Größenordnungen), f",capacitance of a capacitor (quantity),capacidad de un condensador (magnitud),capacité d'un condensateur (grandeur) f,capacità di un condensatore (grandezza),コンデンサの静電容量,"커패시터의 커패시턴스, <양>","конденсаторын багтаамж, <тоо хэмжээ>",pojemność kondensatora (wielkość),capacidade de um condensador (grandeza)capacidade de um capacitor (grandeza),kapaciteta kondenzatorjazmogljivost kondenzatorja,"капацитивност кондензатора, <величина> ж јд",kapacitans,"电容的电容量, <定量的>"
436-01-03,(capacitor) element,https://www.electropedia.org/iev/iev.nsf/display?openform&ievref=436-01-03,عنصر (المكثف),"Kondensatorelement, n",(capacitor) element,elemento (de condensador),"élément (de condensateur), m",elemento capacitivo,（コンデンサ）素子コンデンサ素子,커패시터 구성요소,конденсаторын элемент,zwijka kondensatorowa  zwijka,elemento (de condensador),kondenzatorski element,"кондензатор елемент , м јд",kondensatorelement,电容器元件
436-01-04,(capacitor) unit,https://www.electropedia.org/iev/iev.nsf/display?openform&ievref=436-01-04,وحدة (المكثف),"Kondensatoreinheit, f",(capacitor) unit,condensador unitariounidad (de un condensador),"condensateur unitaire, munité (de condensateur), f",unità capacitiva,（コンデンサ）ユニットコンデンサユニット,커패시터 단위체,нэгж конденсатор,jednostka kondensatorowa człon kondensatora,condensador unitáriocapacitor unitário,kondenzatorska enota,"кондензатор јединица, м јд",kondensatorenhet,电容器单元
436-01-05,(capacitor) stack,https://www.electropedia.org/iev/iev.nsf/display?openform&ievref=436-01-05,رص (المكثف)رصيص (المكثف),"Kondensatorstapel, m",(capacitor) stack,banco (de condensadores),"empilage (de condensateurs), m",colonna di condensatori,（コンデンサ）スタックコンデンサスタック,커패시터 더미,блок конденсатор,stos kondensatorów,banco (de condensadores),kondenzatorski paket,"кондензатор низ, м јд",kondensatorstapel,电容器叠柱
436-01-06,(capacitor) bank,https://www.electropedia.org/iev/iev.nsf/display?openform&ievref=436-01-06,مجموعة (مكثف),"Kondensatorbatterie, f",(capacitor) bank,batería (de condensadores),"batterie (de condensateurs), f",batteria di condensatori,（コンデンサ）バンクコンデンサバンク,커패시터 뱅크,конденсаторын батарей,bateria kondensatorów  bateria,bateria (de condensadores),kondenzatorska baterija,"кондензатор  батерија, м јд",kondensatorbatteri,电容器组
436-01-07,capacitor installation,https://www.electropedia.org/iev/iev.nsf/display?openform&ievref=436-01-07,تركيب المكثف,"Kondensatoranlage, f",capacitor installation,instalación de un condensador,"installation de condensateurs, f",installazione di un condensatore,コンデンサ設備,커패시터 설비,конденсаторын тоног төхөөрөмж,zespól kondensatorów  instalacja kondensatorowa,instalação de condensadores,kondenzatorska naprava,"кондензаторско постројење, с јд",kondensatoranläggning,电容器成套装置
436-01-08,charging of a capacitor,https://www.electropedia.org/iev/iev.nsf/display?openform&ievref=436-01-08,شحن مكثف,"Laden eines Kondensators, n",charging of a capacitor,puesta en carga de un condensador,"(mise en) charge d'un condensateur, f",carica di un condensatore,コンデンサの充電,커패시터 충전,конденсаторын цэнэглэлт,ładowanie kondensatora,carregamento de um condensadorcarga de um condensador (desaconselhado neste sentido),polnjenje kondenzatorja,"пуњење кондензатора, с јд",uppladdning,"充电, <电容器的>"
436-01-09,charging current of a capacitor,https://www.electropedia.org/iev/iev.nsf/display?openform&ievref=436-01-09,تيار شحن مكثف,"Ladestrom eines Kondensators, m",charging current of a capacitor,corriente en carga de un condensador,"courant de charge d'un condensateur, m",corrente di carica di un condensatore,コンデンサの充電電流,커패시터 충전 전류,конденсаторын цэнэглэлтийн гүйдэл,prąd ładowania kondensatora,corrente de carregamento de um condensadorcorrente de carga de um condensador (desaconselhado neste sentido),polnilni tok kondenzatorja,"струја пуњења кондензатора, ж јд",uppladdningsström,"充电电流, <电容器的>"
436-01-10,discharging of a capacitor,https://www.electropedia.org/iev/iev.nsf/display?openform&ievref=436-01-10,تفريغ مكثف,"Entladen eines Kondensators, n",discharging of a capacitor,descarga de un condensador,"décharge d'un condensateur, f",scarica di un condensatore,コンデンサの放電,커패시터 방전,конденсаторын цэнэг алдалт,rozładowanie kondensatora,descarregamento de um condensadordescarga de um condensador (desaconselhado neste sentido),praznjenje kondenzatorja,"пражњење кондензатора, с јд",urladdning,"放电, <电容器的>"
436-01-11,discharging current of a capacitor,https://www.electropedia.org/iev/iev.nsf/display?openform&ievref=436-01-11,تيار تفريغ مكثف,"Entladestrom eines Kondensators, m",discharging current of a capacitor,corriente de descarga de un condensador,"courant de décharge d'un condensateur, m",corrente di scarica di un condensatore,コンデンサの放電電流,커패시터 방전 전류,конденсаторын цэнэг алдалтын гүйдэл,prąd rozładowania kondensatora,corrente de descarregamento de um condensadorcorrente de descarga de um condensador (desaconselhado neste sentido),praznilni tok kondenzatorja,"струја пражњења кондензатора, ж јд",urladdningsström,"放电电流, <电容器的>"
436-01-12,rated capacitance of a capacitor,https://www.electropedia.org/iev/iev.nsf/display?openform&ievref=436-01-12,سعة اسمية لمكثف,"Bemessungskapazität eines Kondensators, f",rated capacitance of a capacitor,capacidad asignada de un condensador,"capacité assignée d'un condensateur, f",capacità nominale di un condensatore,コンデンサの定格静電容量,커패시터 정격 정전 용량커패시터 정격 커패시턴스,конденсаторын хэвийн багтаамж,pojemność znamionowa kondensatora,capacidade estipulada de um condensador,naznačena kapacitivnost kondenzatorja,"назначена капацитивност кондензатора, ж јд",markkapacitans,"额定电容, <电容器的>"
436-01-13,rated current of a capacitor,https://www.electropedia.org/iev/iev.nsf/display?openform&ievref=436-01-13,تيار اسمي لمكثف,"Bemessungsstrom eines Kondensators, m",rated current of a capacitor,corriente asignada de un condensador,"courant assigné d'un condensateur, m",corrente nominale di un condensatore,コンデンサの定格電流,커패시터 정격 전류,конденсаторын хэвийн гүйдэл,prąd znamionowy kondensatora,corrente estipulada de um condensador,naznačeni tok kondenzatorja,"назначена струја кондензатора, ж јд",märkström,"额定电流, <电容器的>"
436-01-14,rated frequency of a capacitor,https://www.electropedia.org/iev/iev.nsf/display?openform&ievref=436-01-14,تردد اسمي لمكثف,"Bemessungsfrequenz eines Kondensators, f",rated frequency of a capacitor,frecuencia asignada de un condensador,"fréquence assignée d'un condensateur, f",frequenza nominale di un condensatore,コンデンサの定格周波数,커패시터 정격 주파수,конденсаторын хэвийн давтамж,częstotliwość znamionowa kondensatora,frequência estipulada de um condensador,naznačena frekvenca kondenzatorja,"назначена фреквенција кондензатора, ж јд",märkfrekvens,"额定频率, <电容器的>"
436-01-15,rated voltage of a capacitor,https://www.electropedia.org/iev/iev.nsf/display?openform&ievref=436-01-15,جهد اسمي لمكثف,"Bemessungsspannung eines Kondensators, f",rated voltage of a capacitor,tensión asignada de un condensador,"tension assignée d'un condensateur, f",tensione nominale di un condensatore,コンデンサの定格電圧,커패시터 정격 전압,конденсаторын хэвийн хүчдэл,napięcie znamionowe kondensatora,tensão estipulada de um condensador,naznačena napetost kondenzatorja,"назначени напон кондензатора, м јд",märkspänning,"额定电压, <电容器的>"
436-01-16,rated output of a capacitor,https://www.electropedia.org/iev/iev.nsf/display?openform&ievref=436-01-16,قدرة اسمية لمكثف,"Bemessungsleistung eines Kondensators, f",rated output of a capacitor,potencia asignada de un condensador,"puissance assignée d'un condensateur, f",potenza nominale di un condensatore,コンデンサの定格出力,커패시터 정격 출력,конденсаторын хэвийн чадал,moc kondensatora znamionowa,potência estipulada de um condensador,naznačena moč kondenzatorja,"назначена снага кондензатора, ж јд",märkeffekt,"额定容量, <电容器的>额定输出, <电容器的>"
436-01-17,rated temperature category of a capacitor,https://www.electropedia.org/iev/iev.nsf/display?openform&ievref=436-01-17,تصنيف حراري مقنن,"Bemessungstemperaturklasse eines Kondensators, f",rated temperature category of a capacitor,categoría de temperatura asignada de un condensador,"catégorie de température assignée d'un condensateur, f",classe di temperatura nominale di un condensatore,コンデンサの定格温度範囲,커패시터 정격 온도 범위,конденсаторын хэвийн температурын зэрэглэл,kategoria znamionowa temperatury kondensatora,categoria estipulada de temperatura de um condensador,naznačeni temperaturni razred kondenzatorja,"назначени температурни разред кондензатора, м јд",märktemperaturomrade,"额定温度类别, <电容器的>"
436-02-01,power capacitor,https://www.electropedia.org/iev/iev.nsf/display?openform&ievref=436-02-01,مكثف قدرة,"Leistungskondensator, m",power capacitor,condensador de potencia,"condensateur de puissance, m",condensatore di potenza,電力用コンデンサ,전력 커패시터전력용 커패시터,хүчний конденсатор,kondensator energetyczny,condensador de potênciacapacitor de potência,močnostni kondenzator,"енергетски кондензатор, м јд",kraftkondensator,电力电容器
436-02-02,shunt capacitor,https://www.electropedia.org/iev/iev.nsf/display?openform&ievref=436-02-02,مكثف توازي,"Parallelkondensator, m",shunt capacitor,condensador en paralelocondensador shunt,"condensateur-shunt, mcondensateur en dérivation, m",condensatore di rifasamento in parallelo,分路コンデンサ,분로 커패시터병렬 커패시터,шунтлэгч конденсатор,kondensator bocznikowy kondensator równoległy,condensador-derivação,vzporedni kondenzator,"паралелно везан кондензатор, м јд",shuntkondensator,并联电容器
436-02-03,series capacitor,https://www.electropedia.org/iev/iev.nsf/display?openform&ievref=436-02-03,مكثف توال,"Reihenkondensator, m",series capacitor,condensador serie,"condensateur-série, m",condensatore serie,直列コンデンサ,직렬 커패시터,цуваа конденсатор,kondensator szeregowy,condensador-série,zaporedni kondenzator,"редно везан кондензатор, м јд",seriekondensator,串联电容器
436-02-04,motor starting capacitor,https://www.electropedia.org/iev/iev.nsf/display?openform&ievref=436-02-04,مكثف بدء تشغيل المحرك,"Motoranlaufkondensator, m",motor starting capacitor,condensador para arranque de motor,"condensateur de démarrage de moteur, m",condensatore per avviamento motori,電動機起動用コンデンサ,전동기 기동 커패시터,хөдөлгүүр асаах конденсатор,kondensator rozruchowy silnika,condensador de arranque de motor,zagonski kondenzator motorja,"кондензатор за покретање мотора, м јд",motorstartkondensator,电动机起动电容器
436-02-05,motor running capacitor,https://www.electropedia.org/iev/iev.nsf/display?openform&ievref=436-02-05,مكثف تشغيل محرك (مستمر),"Motorbetriebskondensator, m",motor running capacitor,condensador permanente de motor,"condensateur (permanent) de moteur, m",condensatore statico per motori,電動機稼働用コンデンサ,전동기 운전 커패시터,хөдөлгүүр ажиллуулах конденсатор,kondensator roboczy silnika  kondensator silnikowy do pracy ciągłej,condensador (permanente) de motor,obratovalni kondenzator motorja,"кондензатор за трајни рад мотора, м јд",motorkondensator,电动机运转电容器
436-02-06,filter capacitor,https://www.electropedia.org/iev/iev.nsf/display?openform&ievref=436-02-06,مكثف تنعيم (ترشيح),"Filterkondensator, m",filter capacitor,condensador antiparasitariocondensador de filtrado,"condensateur de filtrage, m",condensatore di filtro,フィルタコンデンサ,필터 커패시터,шүүлтийн конденсатор,kondensator filtru,condensador de filtragem,filtrski kondenzator,"кондензатор за филтерске примене , м јд",filterkondensator,滤波电容器
436-02-07,power electronic capacitor,https://www.electropedia.org/iev/iev.nsf/display?openform&ievref=436-02-07,مكثف ألكترونيات القدرة,"Leistungselektronikkondensator, m",power electronic capacitor,condensador para electrónica de potencia,"condensateur pour électronique de puissance, m",condensatore per elettronica di potenza,電源電力用コンデンサ,전력 전자 커패시터,хүчний электроникийн конденсатор,kondensator energoelektroniczny,condensador para electrónica de potência,kondenzator za močnostno elektroniko,"кондензатор за енергетску електронику, м јд",kondensator för kraftelektronik,电力电子电容器
436-02-08,energy storage capacitor,https://www.electropedia.org/iev/iev.nsf/display?openform&ievref=436-02-08,مكثف تخزين الطاقة,"Energiespeicherkondensator, m",energy storage capacitor,condensador de almacenamiento de energía,"condensateur de stockage d'énergie, m",condensatore per immagazzinamento di energia,エネルギー蓄積用コンデンサ,에너지 저장 커패시터,цахилгаан энерги хураах конденсатор,kondensator magazynujący energię,condensador de armazenamento de energia,kondenzator za shranjevanje energije,"кондензатор за складиштење енергије, м јд",urladdningskondensator,贮能电容器脉冲电容器
436-02-09,circuit-breaker capacitors,https://www.electropedia.org/iev/iev.nsf/display?openform&ievref=436-02-09,مكثفات قاطع الداره,"Kondensatoren für Leistungsschalter, m",circuit-breaker capacitors,condensador para interruptores automáticos,"condensateurs pour disjoncteurs, m pl",condensatore per interruttori,遮断コンデンサ,차단기 커패시터,таслуурын конденсаторууд,kondensatory wyłącznikowe,condensador para disjuntores,odklopniški kondenzatorji,"кондензатори за прекидач, м мн",brytarkondensator,断路器电容器均压电容器
436-02-10,capacitor voltage divider,https://www.electropedia.org/iev/iev.nsf/display?openform&ievref=436-02-10,مقسم جهد سعوي,"kapazitiver Spannungsteiler, m",capacitor voltage divider,divisor capacitivo,"diviseur capacitif, m",divisore di tensione capacitivo,コンデンサ分圧器,커패시터 전압 분배기,багтаамжийн хүчдэл хуваагч,dzielnik napięcia pojemnościowy  dzielnik pojemnościowy,divisor capacitivo,kapacitivni napetostni delilnik,"капацитивни делитељ напона, м јд",kapacitiv spänningsdelare,电容分压器
436-02-11,coupling capacitor,https://www.electropedia.org/iev/iev.nsf/display?openform&ievref=436-02-11,مكثف ربط,"Kopplungskondensator, m",coupling capacitor,condensador de acoplamiento,"condensateur de couplage, m",condensatore di accoppiamento,結合コンデンサ,결합 커패시터결합 콘덴서,холбооны конденсатор,kondensator sprzęgający,condensador de acoplamento,sklopni kondenzator,"спрежни кондензатор, м јд",kopplingskondensator,耦合电容器
436-02-12,high-voltage capacitor (of a capacitor divider),https://www.electropedia.org/iev/iev.nsf/display?openform&ievref=436-02-12,مكثف جهد عالي لمقسم جهد سعوي,"Oberspannungskondensator (eines kapazitiven Spannungsleiters), m",high-voltage capacitor (of a capacitor divider),condensador para alta tensión (de un divisor capacitivo),condensateur à haute tension (d'un diviseur capacitif) m,condensatore di alta tensione,高圧コンデンサ,"고압 커패시터, <커패시터 분압기>","өндөр хүчдэлийн конденсатор, <багтаамжийн хуваагчийн>",kondensator wysokonapięciowy (dzielnika pojemnościowego),condensador de alta tensão (de um divisor capacitivo),visokonapetostni kondenzator (kapacitivnega delilnika),"високонапонски кондензатор , <капацитивног делитеља> м јд",högspänningsdel,"高压电容器, <电容分压器的>"
436-02-13,intermediate-voltage capacitor (of a capacitor divider),https://www.electropedia.org/iev/iev.nsf/display?openform&ievref=436-02-13,مكثف جهد متوسط لمقسم جهد سعوي,"Unterspannungskondensator (eines kapazitiven Spannungsteilers), m",intermediate-voltage capacitor (of a capacitor divider),condensador para tensión intermedia (de un divisor capacitivo),condensateur à tension intermédiaire (d'un diviseur capacitif) m,condensatore di media tensione,中間電圧コンデンサ,"중압 커패시터, <커패시터 분압기>","завсрын хүчдэлийн конденсатор, <багтаамжийн хуваагчийн>",kondensator napięcia pośredniego (dzielnika pojemnościowego),condensador de tensão intermédia (de um divisor capacitivo),vmesnonapetostni kondenzator (kapacitivnega delilnika),"разделни кондензатор, <капацитивног делитеља> м јд",mellanspänningsdel,"中压电容器, <电容分压器的>"
436-03-01,line terminal,https://www.electropedia.org/iev/iev.nsf/display?openform&ievref=436-03-01,طرف (نهاية) خط,"Außenleiter-Anschlusspunkt, mAußenleiterklemme, f",line terminal,borne de línea,"borne de ligne, f",terminale di linea,回線端子,선로 단자,шугамын гаргалга,zacisk liniowy,terminal de linha,omrežna sponka,"линијски прикључак, м јд",fasuttag,线路端子
436-03-02,earth terminal,https://www.electropedia.org/iev/iev.nsf/display?openform&ievref=436-03-02,طرف الأرضي,"Erdungsanschlusspunkt, mErdungsklemme, f",earth terminal,borne de tierra,"borne de terre, f",terminale di terra,接地端子,대지 단자지구 단자,газардуулгын гаргалга,zacisk uziomowy,terminal de terra,ozemljitvena sponka,"прикључак за уземљење, м јд",jordningsuttag,接地端子
436-03-03,intermediate-voltage terminal (of a capacitor divider),https://www.electropedia.org/iev/iev.nsf/display?openform&ievref=436-03-03,طرف جهد متوسط لمقسم جهد سعوي,"Unterspannungsanschlussklemme (eines kapazitiven Spannungsteilers), f",intermediate-voltage terminal (of a capacitor divider),borne intermedio (de un divisor capacitivo),borne intermédiaire (d'un diviseur capacitif) f,terminale a tensione intermedia,中圧端子中間電圧端子,"중압 단자, <커패시터 분압기>","завсрын хүчдэлийн гаргалга, <багтаамжийн хуваагчийн>",zacisk napięcia pośredniego (dzielnika pojemnościowego),terminal intermédio (de um divisor capacitivo),vmesnonapetostna sponka (kapacitivnega delilnika),"разделни прикључак, <капацитивног делитеља> м јд",mellanspänningsuttag,"中压端子, <电容分压器的>"
436-03-04,low-voltage terminal (of a capacitor divider),https://www.electropedia.org/iev/iev.nsf/display?openform&ievref=436-03-04,طرف جهد منخفض لمقسم جهد سعوي,"Niederspannungsanschlussklemme (eines kapazitiven Spannungsleiters), f",low-voltage terminal (of a capacitor divider),borne de baja tensión (de un divisor capacitivo),borne basse tension (d'un diviseur capacitif) f,terminale a bassa tensione,低圧端子,"저압 단자, <커패시터 분압기>","нам хүчдэлийн гаргалга, <багтаамжийн хуваагчийн>",zacisk napięcia niskiego (dzielnika pojemnościowego),terminal de baixa tensão (de um divisor capacitivo),nizkonapetostna sponka (kapacitivnega delilnika),"нисконапонски прикључак, <капацитивног делитеља> м јд",lagspänningsuttag,"低压端子, <电容分压器的>"
436-03-05,electrolytic capacitor,https://www.electropedia.org/iev/iev.nsf/display?openform&ievref=436-03-05,مكثف الكتروليتي,"Elektrolytkondensator, m",electrolytic capacitor,condensador electrolítico,"condensateur électrolytique, m",condensatore elettrolitico,電界コンデンサ,전해 커패시터,электролит конденсатор,kondensator elektrolityczny,condensador electrolíquido,elektrolitni kondenzator,"електролитички кондензатор, м јд",elektrolytkondensator,电解电容器
436-03-06,AC electrolytic capacitor,https://www.electropedia.org/iev/iev.nsf/display?openform&ievref=436-03-06,مكثف الكترولتيتي لتيار متردد,"Wechselstrom-Elektrolytkondensator, m",AC electrolytic capacitor,condensador electrolítico para corriente alterna,"condensateur électrolytique pour courant alternatif, m",condensatore elettrolitico per corrente alternata,交流電解コンデンサ,교류 전극 커패시터,хувьсах гүйдлийн электролит конденсатор,kondensator elektrolityczny prądu przemiennego,condensador electrolíquido para corrente alternada,elektrolitni kondenzator za izmenični tok,"електролитички кондензатор наизменичне струје, м јд",elektrolyikondensator för växelström,交流电解电容器
436-03-07,paper capacitor,https://www.electropedia.org/iev/iev.nsf/display?openform&ievref=436-03-07,مكثف ورقي,"Papierkondensator, m",paper capacitor,condensador de papel,"condensateur au papier, m",condensatore con dielettrico di carta,紙コンデンサ,종이 커패시터,цаасан конденсатор,kondensator papierowy  kondensator z dielektrykiem papierowym,condensador de papel,papirni kondenzator,"кондензатор са папирним диелектриком, м јд",papperskondensator,纸介质电容器
436-03-08,film capacitor,https://www.electropedia.org/iev/iev.nsf/display?openform&ievref=436-03-08,مكثف ذو غشاء رقيق,"Kunststoffkondensator, m",film capacitor,condensador de película,"condensateur au film, m",condensatore con dielettrico plastico,フィルムコンデンサ,박막 커패시터,хальсан конденсатор,kondensator tworzywowy  kondensator z dielektrykiem z tworzywa,condensador de filme,kondenzator s plastično folijo,"кондензатор са диелектриком од филма, м јд",plastfilmkondensator,膜介质电容器
436-03-09,mixed dielectric capacitor,https://www.electropedia.org/iev/iev.nsf/display?openform&ievref=436-03-09,مكثف ذو عزل كهربائى مختلط,"Kondensator mit gemischtem Dielektrikum, m",mixed dielectric capacitor,condensador de dieléctrico mixto,"condensateur à diélectrique mixte, m",condensatore con dielettrico misto,複合誘電コンデンサ,혼합 유전체 커패시터,холимог диэлектриктэй конденсатор,kondensator z dielektrykiem mieszanym,condensador de dieléctrico misto,kondenzator z mešanim dielektrikom,"кондензатор са мешовитим диелектриком, м јд",blandfoliekondensator,复合介质电容器
