term_id,term,term_url,ar,de,en,es,fr,it,ja,ko,pl,pt,zh
715-09-14,both-way circuit,https://www.electropedia.org/iev/iev.nsf/display?openform&ievref=715-09-14,دارة مزدوجة المساراتدارة باتجاهين,"beidseitig gerichtete Leitung, f",both-way circuittwo-way circuit,circuito de doble sentido,"circuit à double sens, mcircuit mixte, m",circuito a traffico bidirezionale,両方向回線双方向回線,양방향 회선,łącze obukierunkowe,circuito mistocircuito de duplo sentido,双向电路
715-10-01,message switching,https://www.electropedia.org/iev/iev.nsf/display?openform&ievref=715-10-01,تبديل الرسائل,"Nachrichtenvermittlung, fSendungsvermittlung, f",message switching,conmutación de mensajes,"commutation de messages, f",commutazione di messaggio,メッセージ交換,메시지 교환,komutacja wiadomości,comutação de mensagens,消息交换
715-10-02,message switching network,https://www.electropedia.org/iev/iev.nsf/display?openform&ievref=715-10-02,شبكة تبديل الرسائل شبكة توصيل الرسائل,"Nachrichtenvermittlungsnetz, nsendungsvermitteltes Netz, n",message switching networkstore and forward switched network,red de conmutación de mensajes,"réseau à commutation de messages, m",rete a commutazione di messaggio,メッセージ交換網蓄積交換網,메시지 교환망저장 전달 교환망,sieć o komutacji wiadomości,rede de mensagens comutadasrede de comutação de mensagens,消息交换网
715-11-01,packet switching,https://www.electropedia.org/iev/iev.nsf/display?openform&ievref=715-11-01,تبديل قالب كامل,"Paketvermittlung, f",packet switching,conmutación de paquetes,"commutation de paquets, fcommutation par paquets, f",commutazione di pacchetto,パケット交換,패킷 교환,komutacja pakietów,comutação de pacotes,分组交换
715-11-02,packet switched network,https://www.electropedia.org/iev/iev.nsf/display?openform&ievref=715-11-02,شبكة تبديل القالب الكامل,"Paketvermittlungsnetz, npaketvermitteltes Netz, n",packet switched network,red de conmutación de paquetes,"réseau à commutation de paquets, m",rete a commutazione di pacchetto,パケット交換網,패킷 교환망,sieć o komutacji pakietów,rede de pacotes comutadosrede de comutação de pacotes,分组交换网
