term_id,term,term_url,ar,de,en,es,fr,it,ja,ko,pl,pt,sv,zh
221-04-39,effective area (of a search coil),https://www.electropedia.org/iev/iev.nsf/display?openform&ievref=221-04-39,ملف بحث,"effektive Fläche (einer Suchspule), f",effective area (of a search coil),área equivalente (de una bobina de exploración)sección efectiva (de una bobina de exploración),section effective (d'une bobine d'exploration) faire équivalente (d'une bobine d'exploration) f,sezione effettiva (di una bobina d’esplorazione)area equivalente (di una bobina d’esplorazione),"実効面積, <探りコイルの>","유효 단면적, 검색 코일실효 단면적, 검색 코일",powierzchnia skuteczna cewki probierczej,secção equivalente (de uma bobine de exploração),mätspolens effektiva area,"有效面积, <测试线圈的>"
221-04-40,area turns (of a search coil),https://www.electropedia.org/iev/iev.nsf/display?openform&ievref=221-04-40,المساحة الفعالة (لملف البحث),"Windungsfläche (einer Suchspule), f",area turns (of a search coil),producto del número de espiras por la sección efectiva (de una bobina de exploración),produit du nombre de spires par la section effective (d'une bobine d'exploration) m,prodotto del numero di spire perla sezione effettiva (di una bobina d’esplorazione),"エリアターン, <探りコイルの>","면적회전수, 검색 코일",powierzchniozwoje cewki probierczejpowierzchniozwoje,produto do número de espiras pela secção equivalente (de uma bobine de exploração),areavarvprodukt,"面积匝数, <测试线圈的>"
221-05-01,gyromagnetic effect,https://www.electropedia.org/iev/iev.nsf/display?openform&ievref=221-05-01,لفات مساحة (لملف البحث),"gyromagnetischer Effekt, m",gyromagnetic effect,efecto giromagnético,"effet gyromagnétique, m",effetto giromagnetico,磁気回転効果ジャイロ磁気効果,자이로자기 효과,zjawisko giromagnetyczne,efeito giromagnético,gyromagnetisk effek,旋磁效应
221-05-02,Faraday effect,https://www.electropedia.org/iev/iev.nsf/display?openform&ievref=221-05-02,تأثير جيرومغناطيسى,"Faraday-Effekt, mFaraday-Rotation, f",Faraday effectFaraday rotation,efecto Faradayrotación de Faraday,"effet Faraday, mrotation de Faraday, f",effetto Faradayrotazione di Faraday,ファラデー効果,패러데이 효과,zjawisko Faradayarotacja Faradaya,efeito Faradayrotação de Faraday,faradayeffekt,法拉第效应法拉第旋转
221-05-03,gyromagnetic coefficient (of an electron),https://www.electropedia.org/iev/iev.nsf/display?openform&ievref=221-05-03,تأثير فاراداي,"gyromagnetischer Koeffizient (eines Elektrons), m",gyromagnetic coefficient (of an electron)gyromagnetic ratio (deprecated),cociente giromagnético (desaconsejado)coeficiente giromagnético (de un electrón),coefficient gyromagnétique (d'un électron) mrapport gyromagnétique (terme déconseillé) m,coefficiente giromagnetico (di un elettrone),"ジャイロ磁気定数, <電子の>","자이로자기 계수, 전자",współczynnik giromagnetyczny  (elektronu),coeficiente giromagnético (de um electrão),gyromagnetisk kvot,"旋磁系数, <电子的>"
221-05-04,gyromagnetic resonance,https://www.electropedia.org/iev/iev.nsf/display?openform&ievref=221-05-04,معامل جيرو مغناطيسي (للإلكترون),"gyromagnetische Resonanz, f",gyromagnetic resonance,resonancia giromagnética,"résonance gyromagnétique, f",risonanza giromagnetica,ジャイロ磁気共鳴,자이로자기 공명,rezonans giromagnetyczny,ressonância giromagnética,gyromagnetisk resonans,旋磁共振
221-05-05,gyromagnetic material,https://www.electropedia.org/iev/iev.nsf/display?openform&ievref=221-05-05,رنين جيرو مغناطيسي,"gyromagnetischer Werkstoff, mgyromagnetisches Medium, n",gyromagnetic materialgyromagnetic medium,medio giromagnéticosustancia giromagnética,"substance gyromagnétique, fmilieu gyromagnétique, m",materiaIe giromagneticomezzo giromagnetico,磁気回転材料ジャイロ磁性材料,자이로자성 재료자이로자성 매체,substancja giromagnetycznaośrodek giromagnetyczny,substância giromagnéticomeio giromagnético,gyromagnetiskt material; gyromagnetiskt medium,旋磁材料旋磁介质
221-05-06,gyromagnetic device,https://www.electropedia.org/iev/iev.nsf/display?openform&ievref=221-05-06,مادة جيرومغناطيسي,"gyromagnetisches Bauelement, n",gyromagnetic device,dispositivo giromagnético,"dispositif gyromagnétique, m",dispositivo giromagnetico,ジャイロ磁気デバイス,자이로자기 장치,przyrząd giromagnetyczny,dispositivo giromagnético,gyromagnetisk anordning,旋磁器件
221-05-07,gyromagnetic resonator,https://www.electropedia.org/iev/iev.nsf/display?openform&ievref=221-05-07,جهاز جيرومغناطيسي,"gyromagnetischer Resonator, m",gyromagnetic resonator,resonador giromagnético,"résonateur gyromagnétique, m",risonatore giromagnetic,ジャイロ磁気共鳴器,자이로자기 공명기,rezonator giromagnetyczny,ressoador giromagnético,gyromagnetisk resonator,旋磁共振子
221-05-08,non-reciprocal phase-shifter,https://www.electropedia.org/iev/iev.nsf/display?openform&ievref=221-05-08,مرنان جيرومغناطيسي,"nichtreziproker Phasenschieber, m",non-reciprocal phase-shifter,desfasador directodesfasador no recíproco,"déphaseur non réciproque, mdéphaseur directif, m",sfasatore non-reciproco sfasatore direzionale,非可逆移相器,비가역 이상기,przesuwnik fazy nieodwracalny,desfazador não recíprocodesfazador direccional,irreciprok fasändrare,非互易移相器
221-05-09,non-reciprocal polarization rotator,https://www.electropedia.org/iev/iev.nsf/display?openform&ievref=221-05-09,مزيح طور غير تبادلي,"nichtreziproker Polarisationsdreher, mnichtreziproker Faraday-Rotator, m",non-reciprocal polarization rotatornon-reciprocal wave rotator,rotador de onda no recíprocorotador de polarización,"rotateur de polarisation non réciproque, mrotateur d'onde non réciproque, m",rotatore di polarizzazione non reciprocorotatore d’onda non reciproco,非可逆偏光回転子,비가역편광 회전자,rotator polaryzacji nieodwracalny,rodador de polarização não recíprocorodador de onda não recíproco,irreciprok polarisationsvridare; irreciprok vågvridare,非互易极化旋转器非互易波旋转器
221-05-10,microwave gyrator,https://www.electropedia.org/iev/iev.nsf/display?openform&ievref=221-05-10,مدوّر استقطاب غير تبادلي,"Mikrowellen-Gyrator, m",microwave gyrator,girado de hiperfrecuenciasgirador de microondas,"gyrateur hyperfréquence, m",giratore per iperfrequenze,マイクロ波ジャイレータ,마이크로파 자이레이터,girator mikrofalowy,girador de hiperfrequências,mikrovågsgyrator,微波回转器
221-05-11,circulator,https://www.electropedia.org/iev/iev.nsf/display?openform&ievref=221-05-11,مدور بالأمواج الدقيقة,"Zirkulator, m",circulator,circulador,"circulateur, m",circolatore,サーキュレータ,서큘레이터,cyrkulator,circulador,cirkulator,环行器
221-05-12,phase-shift circulator,https://www.electropedia.org/iev/iev.nsf/display?openform&ievref=221-05-12,ممرر,"Phasenverschiebungszirkulator, m",phase-shift circulator,circulador de desfase,"circulateur à déphasage, m",circolatore a sfasamento,移相形サーキュレータ,이상형 서큘레이터,cyrkulator z przesuwnikiem fazy,circulador de desfazagem,fasändringscirkulator,相移式环行器
221-05-13,(wave) rotation circulator,https://www.electropedia.org/iev/iev.nsf/display?openform&ievref=221-05-13,ممرر مزيح للطور,"Polarisationsdrehzirkulator, mZirkulator mit Faraday-Rotator, m",(wave) rotation circulator,circulador de rotación (de polarización),"circulateur à rotation (de polarisation), m",circolatore a rotazione (di polarizzazione),波形回転形サーキュレータ回転形サーキュレータ,회전형 서큘레이터,cyrkulator rotacyjny,circulador de rotação (de polarização),rotationscirkulator; vågvridningscirkulator,波旋转式环行器
221-05-14,junction circulator,https://www.electropedia.org/iev/iev.nsf/display?openform&ievref=221-05-14,ممرر دوراني (لموجة),"Verzweigungszirkulator, m",junction circulator,circulador de unión,"circulateur jonction, m",circolatore di piunzione,ジャンクション形サーキュレータ,교차점형 서큘레이터,cyrkulator rozgałęźny,circulador de junção,greningscirkulator,结环行器
221-05-15,lumped-element circulator,https://www.electropedia.org/iev/iev.nsf/display?openform&ievref=221-05-15,ممرر وصلة,"Zirkulator aus konzentrierten Elementen, m",lumped-element circulator,circulador de elementos localizados,"circulateur à éléments localisés, m",circolatore a elementi localizzati,集中定数形サーキュレータ,집중상수형 서큘레이터,cyrkulator o elementach skupionych,circulador de elementos localizados,kretselementcirkulator,集中元件环行器
221-05-16,(microwave) isolator,https://www.electropedia.org/iev/iev.nsf/display?openform&ievref=221-05-16,ممرر عنصر مجمع,"Einweg-Dämpfungsglied, nMikrowellenisolator, mIsolator, m",(microwave) isolatorone-way attenuator,aislador (hiperfrecuencias)atenuador unidireccional,"isolateur (hyperfréquence), maffaiblisseur unidirectionnel, m",isolatore (per iperfrequenza)smorzatore unidirezionale,マイクロ波アイソレータアイソレータ,마이크로파 단향관,izolator mikrofalowyizolatortłumik jednokierunkowy,isolador (de hiperfrequências)atenuador unidireccional,isolator; envägsdämpare,微波隔离器单向衰减器
221-05-17,(wave) rotation isolator,https://www.electropedia.org/iev/iev.nsf/display?openform&ievref=221-05-17,عازل بالأمواج الدقيقة,"Einweg-Dämpfungsglied mit Faraday-Rotator, n",(wave) rotation isolator,aislador de rotación (de poIarización),"isolateur à rotation (de polarisation), m",isolatore a rotazione (di polarizzazione),波形回転形アイソレータ,전파 회전형 단향관,izolator rotacyjny,isolador de rotação (de polarização),rotationsisolator; vågvridningsisolator,波旋转式隔离器
221-05-18,resonance (absorption) isolator,https://www.electropedia.org/iev/iev.nsf/display?openform&ievref=221-05-18,عازل تدوير الموجة,"Einweg-Dämpfungsglied mit Resonanzabsorption, n",resonance (absorption) isolator,aislador de absorción (de resonancia)aislador de resonancia,"isolateur à résonance, misolateur (à absorption) à la résonance, m",isolatore a risonanzaisolatore (ad assorbimento) a risonanza,共鳴吸収形アイソレータ,공진흡수형 단향관,izolator rezonansowyizolator o absorpcji rezonansowej,isolador (de absorção) de ressonância,resonans(absorptions)isolator,共振吸收式隔离器
221-05-19,field-displacement isolator,https://www.electropedia.org/iev/iev.nsf/display?openform&ievref=221-05-19,عازل (امتصاص)الرنين,"Einweg-Dämpfungsglied mit Feldverschiebung, n",field-displacement isolator,aislador de desplazamiento de campo,"isolateur à déplacement de champ, m",isolatore a spostamento di campo,電界変位形アイソレータ,전계변위형 단향관,izolator o polu przemieszczonym,isolador de deslocamento de campo,fältändringsisolator,场移式隔离器
221-05-20,lumped-element isolator,https://www.electropedia.org/iev/iev.nsf/display?openform&ievref=221-05-20,عازل إزاحة مجال,"Einweg-Dämpfungsglied aus konzentrierten Elementen, n",lumped-element isolator,aislador de elementos localizados,"isolateur à éléments localisés, m",isolatore a elementi localizzati,集中定数形アイソレータ,집중상수형 단향관,izolator o elementach skupionych,isolador de elementos localizados,kretselementisolator,集中元件隔离器
221-05-21,gyromagnetic filter,https://www.electropedia.org/iev/iev.nsf/display?openform&ievref=221-05-21,عازل لعنصر مجمع,"gyromagnetisches Filter, n",gyromagnetic filterYIG filter (deprecated)garnet filter (deprecated),filtro de YIG (desaconsejado)filtro giromagnéticofiltro granate (desaconsejado),"filtre gyromagnétique, mfiltre à YIG (terme déconseillé) mfiltre à grenat (terme déconseillé) m",filtro giromagnetico,ジャイロ磁気フィルタ,자이로자기 필터,filtr giromagnetyczny,filtro giromagnético,gyromagnetiskt filter,旋磁滤波器
221-05-22,gyromagnetic power limiter,https://www.electropedia.org/iev/iev.nsf/display?openform&ievref=221-05-22,مرشح جيرومغناطيسى,"gyromagnetischer Leistungsbegrenzer, m",gyromagnetic power limiter,limitador de potencia giromagnética,"limiteur de puissance gyromagnétique, m",limitatore di potenza giromagnetico,ジャイロ磁気パワーリミッタ,자이로자기 전력제한기,ogranicznik mocy giromagnetyczny,limitador de potência giromagnética,gyromagnetisk effektbegränsare,旋磁功率限幅器
221-05-23,differential phase-shift (of a non-reciprocal phase-shifter),https://www.electropedia.org/iev/iev.nsf/display?openform&ievref=221-05-23,محدد قدرة جيرومغناطيسى,"Phasenverschiebungsdifferenz (eines nichtreziproken Phasenschiebers), f",differential phase-shift (of a non-reciprocal phase-shifter),desfase diferencial (de un desfasador no recíproco),déphasage différentiel (d'un déphaseur non réciproque) m,sfasamento differenziale (di uno sfasatore non-reciproco),"差動移相, <非可逆移相器 の>","차동 이상, 비가역 이상기",przesunięcie fazy różniczkowe (w przesuwniku fazy nieodwracalnym),desfazagem diferencial (de um desfazador não recíproco),fasändringsskillnad,"差相移, <非互易移相器的>"
221-05-24,forward direction (of an isolator or a circulator),https://www.electropedia.org/iev/iev.nsf/display?openform&ievref=221-05-24,مزيح الطور التفاضلي (لمزيح الطور اللاتبادلي),"Vorwärtsrichtung (eines Einweg-Dämpfungsglieds oder Zirkulators), f",forward direction (of an isolator or a circulator),sentido directo (de un aislador o de un circulador),sens direct (d'un isolateur ou d'un circulateur) m,senso diretto (di un isolatore o di un circolatore),"順方向, <アイソレータまたはサーキュレータの>","순방향, 단향관 또는 서큘레이터",kierunek przepustowy (w izolatorze lub cyrkulatorze),sentido directo (de um isolador ou de um circulador),framriktning,"正向, <隔离器或环行器的>"
221-05-25,reverse direction (of an isolator or a circulator),https://www.electropedia.org/iev/iev.nsf/display?openform&ievref=221-05-25,إتّجاه أمامي (لعازل أو ممرّر),"Rückwärtsrichtung (eines Einweg-Dämpfungsglieds oder Zirkulators), f",reverse direction (of an isolator or a circulator),sentido inverso (de un aislador o de un circulador),sens inverse (d'un isolateur ou d'un circulateur) m,senso inverso (di un isolatore o di un circolatore),"逆方向, <アイソレータまたはサーキュレータの>","역방향, 단향관 또는 서큘레이터",kierunek zaporowy (w izolatorze lub cyrkulatorze),sentido inverso (de um isolador ou de um circulador),backriktning,"反向, <隔离器或环行器的>"
221-05-26,forward loss,https://www.electropedia.org/iev/iev.nsf/display?openform&ievref=221-05-26,إتّجاه عكسي (لعازل أو ممرّر),"Vorwärtsdämpfung, f",forward loss,atenuación directa,"affaiblissement direct, m",smorzamento diretto,順方向損失,순방향 손실,straty w kierunku przepustowymtłumienie w kierunku przepustowym,atenuação directa,framdämpning,正向损耗
221-05-27,reverse loss,https://www.electropedia.org/iev/iev.nsf/display?openform&ievref=221-05-27,فقد (إضعاف) أمامى,"Rückwärtsdämpfung, f",reverse loss,atenuación inversa,"affaiblissement inverse, m",smorzamento inverso,逆方向損失,역방향 손실,straty w kierunku zaporowymtłumienie w kierunku zaporowym,atenuação inversa,backdämpning,反向损耗
221-05-28,cross coupling (of a circulator),https://www.electropedia.org/iev/iev.nsf/display?openform&ievref=221-05-28,فقد (إضعاف) عكسى,"Kreuzkopplung (eines Zirkulators), f",cross coupling (of a circulator),acoplamiento cruzado (de un circulador)acoplamiento mutuo (de un circulador),couplage mutuel (d'un circulateur) m,mutuo accoppiamento (di un circolatore),"クロスカップリング, <サーキュレータの>","교차결합, 서큘레이터",sprzężenie skrośne cyrkulatorasprzężenia skrośne,acoplamento mútuo (de um circulador),tvärsdämpning,"交叉耦合, <环行器的>"
221-05-29,loss ratio,https://www.electropedia.org/iev/iev.nsf/display?openform&ievref=221-05-29,إقتران متقاطع (لممرر),"Verlustverhältnis, n",loss ratio,factor de atenuaciónfactor de pérdidas,"facteur d'affaiblissement, mfacteur de pertes, m",fattore di smorzamentofattore di perdita,損失率,손실율,stosunek tłumień,factor de atenuaçãofactor de perdas,dämpningskvot,损耗比
