id,english,arabic,french,uri,description,vt,uatv
127728,CIF sale (Cost Insurance Freight),بَيْع 'سيف',vente 'C.I.F'; vente 'C.A.F',http://www.arabterm.org/index.php?id=40&L=1&tx_3m5techdict_pi1[id]=127728,بيع من البيوع البحرية يتولى البائع فيه شحن البضائع والتعاقد على نقلها والتأمين عليها، ذلك أن السعر يشمل كلفة البضائع والتأمين وتكاليف الشحن حتى مركز وصول البضاعة إلى بلد المستورد.,True,True
128440,F.A.S - sale (Free Alongside Ship),بَيْع 'فاس',vente 'F.A.S',http://www.arabterm.org/index.php?id=40&L=1&tx_3m5techdict_pi1[id]=128440,بيع من البيوع البحرية يلتزم فيه البائع بتسليم البضاعة على الرصيف بجانب السفينة.,True,True
128441,F.O.B - sale (Free On Board),بَيْع 'فوب',vente 'F.O.B',http://www.arabterm.org/index.php?id=40&L=1&tx_3m5techdict_pi1[id]=128441,بيع من البيوع البحرية يسلم فيه البائع البضاعة على سطح السفينة التي يعينها المشتري.,True,True
129039,Legal capacity,أهلية قانونية,capacité juridique,http://www.arabterm.org/index.php?id=40&L=1&tx_3m5techdict_pi1[id]=129039,الأهلية نوعان: أهلية وجوب وأهلية أداء. الأولى هي صلاحية الشخص لاكتساب الحقوق وتحمل الواجبات التي يحددها القانون، وهي ملازمة له طول حياته ولا يمكن حرمانه منها، أما الثانية فهي صلاحية الشخص لممارسة حقوقه الشخصية والمالية ونفاذ تصرفاته حسب القانون.,True,True
129130,Loan contract,عقد قرض,contrat de crédit,http://www.arabterm.org/index.php?id=40&L=1&tx_3m5techdict_pi1[id]=129130,,True,True
127228,abandoned,متخلى عنه، مهجور,abandonné,http://www.arabterm.org/index.php?id=40&L=1&tx_3m5techdict_pi1[id]=127228,,True,True
127229,abandoned properties,أملاك مهجورة، أموال مهجورة,biens abandonnés,http://www.arabterm.org/index.php?id=40&L=1&tx_3m5techdict_pi1[id]=127229,,True,True
127230,abandonment,هجْر، تخلٍّ,délaissement; abandon,http://www.arabterm.org/index.php?id=40&L=1&tx_3m5techdict_pi1[id]=127230,فعل قانوني يتمثل في تخلي مكلف كامل الأهلية عن حق من حقوقه الثابتة طوعا.,True,True
127231,abandonment of conjugal home,هجْر منـزل الزوجية,abandon de domicile conjugal,http://www.arabterm.org/index.php?id=40&L=1&tx_3m5techdict_pi1[id]=127231,هجر الزوج بيت الزوجية مدة طويلة بدون مبرر مقبول، وهو يعطي الزوجة  حق طلب التطليق، أما هجر الزوجة  البيت فيعتبر نشوزا يُسقط حقها في النفقة.,True,True
127232,abandonment of family,هَجْر الأسرة,abandon de famille,http://www.arabterm.org/index.php?id=40&L=1&tx_3m5techdict_pi1[id]=127232,تملص الأب أو الأم  عمدا من كل أو بعض الواجبات المادية أو المعنوية  المتعلقة برعاية  أو وصاية أو حضانة تجاه الفروع أو الأصول، ويعتبرجنحة  يعاقب عليها القانون.,True,True
127233,abandonment of litigation,تَنَازُل عن الدعوى,abandon de procès,http://www.arabterm.org/index.php?id=40&L=1&tx_3m5techdict_pi1[id]=127233,تَنَازُل المدعي عن الدعوى التي تقدم بها أمام المحكمة.,True,True
127234,abandonment of power,تنازُل عن السلطة، تخلٍّ عن السلطة,abandon de pouvoir,http://www.arabterm.org/index.php?id=40&L=1&tx_3m5techdict_pi1[id]=127234,,True,True
127235,abate (to),خَصَمَ، خَفَّض,dégrever,http://www.arabterm.org/index.php?id=40&L=1&tx_3m5techdict_pi1[id]=127235,,True,True
127236,abatement,تخفيض، خَصْم,abattement; dégrèvement,http://www.arabterm.org/index.php?id=40&L=1&tx_3m5techdict_pi1[id]=127236,,True,True
127237,abbreviation,اختصار، اختزال,abréviation,http://www.arabterm.org/index.php?id=40&L=1&tx_3m5techdict_pi1[id]=127237,,True,True
127238,abduction,اختطاف بالقوة، خَطْف بالقوة,abduction; enlèvement,http://www.arabterm.org/index.php?id=40&L=1&tx_3m5techdict_pi1[id]=127238,جريمة تقوم على اختطاف أشخاص باستعمال العنف والتهديد.,True,True
127239,abeyance,تعليق,désuétude,http://www.arabterm.org/index.php?id=40&L=1&tx_3m5techdict_pi1[id]=127239,آلية من آليات إلغاء القوانين في بعض التشريعات، بحيث يكون مآل كل قانون لا يتم تطبيقه أو استعماله لمدة طويلة من الزمن هو الإلغاء لعدم الاستعمال، في حين أن أغلب التشريعات لا تجيز هذا النوع من الإلغاء وتفرض أن يأتي الإلغاء بشكل صريح أو ضمني.,True,True
127240,abortion,إجهاض، إسقاط الجنين,avortement,http://www.arabterm.org/index.php?id=40&L=1&tx_3m5techdict_pi1[id]=127240,جريمة تقوم على إجهاض أو محاولة إجهاض امرأة حبلى أو يظن أنها كذلك، برضاها أو بدونه سواء كان ذلك بواسطة طعام أو شراب أو عقاقير أو تحايل أو عنف أو أية وسيلة أخرى.,True,True
127241,abrogate,أَلْغَى، نَسخَ,abroger,http://www.arabterm.org/index.php?id=40&L=1&tx_3m5techdict_pi1[id]=127241,,True,True
127242,abrogation,إلغاء، نَسْخ,abrogation,http://www.arabterm.org/index.php?id=40&L=1&tx_3m5techdict_pi1[id]=127242,إنهاء سريان كل أو بعض أحكام قانون ما، بعد النص على ذلك صراحة ضمن أحكام القانون الجديد  أو تعارض أحكام هذا الأخير مع النص القانوني القديم.,True,True
127243,absence,غياب,absence,http://www.arabterm.org/index.php?id=40&L=1&tx_3m5techdict_pi1[id]=127243,,True,True
127244,absent,غائِب,absent,http://www.arabterm.org/index.php?id=40&L=1&tx_3m5techdict_pi1[id]=127244,,True,True
127245,absolute,مُطْلَق,absolu,http://www.arabterm.org/index.php?id=40&L=1&tx_3m5techdict_pi1[id]=127245,,True,True
127246,absolute acceptance,قَبول مُطْلق,acceptation absolue,http://www.arabterm.org/index.php?id=40&L=1&tx_3m5techdict_pi1[id]=127246,,True,True
127247,absolute incompetence,عدم اختصاص مُطْلق,incompétence absolue,http://www.arabterm.org/index.php?id=40&L=1&tx_3m5techdict_pi1[id]=127247,الحالة التي تكون فيها الهيئة القضائية التي رفعت إليها الدعوى  غير مختصة بالفصل فيها بسبب عدم ولايتها.,True,True
127248,absolute majority,أغلبية مُطْلقة,majorité absolue,http://www.arabterm.org/index.php?id=40&L=1&tx_3m5techdict_pi1[id]=127248,أغلبية يُشترط فيها على الأقل  نصف الأعضاء أو الأصوات زائد واحد.,True,True
127249,absolute monarchy,مَلَكية مُطْلقة,monarchie absolue,http://www.arabterm.org/index.php?id=40&L=1&tx_3m5techdict_pi1[id]=127249,نظام سياسي يمارس  فيه الملك  أو الإمبراطور الحكم المطلق ويستبد بجميع السلطات.,True,True
127250,absolute nullity,بُطلان مُطْلَق,nullité absolue,http://www.arabterm.org/index.php?id=40&L=1&tx_3m5techdict_pi1[id]=127250,يكون البطلان مطلقا في العقود  إذا انتفى أحد أركان صحتها، كأن يكون المحل أو السبب غير مشروع أو مخالف للقانون مثلا.,True,True
127251,absolute obligation,التزام مُطْلَق,obligation absolue,http://www.arabterm.org/index.php?id=40&L=1&tx_3m5techdict_pi1[id]=127251,,True,True
127252,absolute presumption,قرينة قاطعة,présomption absolue,http://www.arabterm.org/index.php?id=40&L=1&tx_3m5techdict_pi1[id]=127252,حجة عليها القانون ولا تقبل التفنيد لكونها من النظام العام، ومثالها أن سن الصغير غير المميز تُعدّ قرينةً على بطلان عقد البيع.,True,True
127253,absolute responsibility; absolute liability,مسؤولية مُطْلَقة,responsabilité absolue,http://www.arabterm.org/index.php?id=40&L=1&tx_3m5techdict_pi1[id]=127253,,True,True
127254,abstention,تَنَحٍّ,déport,http://www.arabterm.org/index.php?id=40&L=1&tx_3m5techdict_pi1[id]=127254,تخلي القاضي عن الحكم في قضية بوجود أحد أسباب الرد في الدعوى المعروضة على نظره، كأن تكون له علاقة  خاصة مع أحد أطرافها قد تدفعه إلى الميل وعدم الإنصاف.,True,True
127255,abstentionist,ممتنِع,abstentionniste,http://www.arabterm.org/index.php?id=40&L=1&tx_3m5techdict_pi1[id]=127255,,True,True
127256,abstract,خُلاصة، مُخْتَصَر,extrait; résumé,http://www.arabterm.org/index.php?id=40&L=1&tx_3m5techdict_pi1[id]=127256,,True,True
127257,abstract of account,كشْف حساب,relevé de compte,http://www.arabterm.org/index.php?id=40&L=1&tx_3m5techdict_pi1[id]=127257,بيان يقوم المصرف أو البنك بإرساله لفاتح الحساب كل شهر أو كل ثلاثة أشهر يبين فيه دائنية ومديونية الحساب المفتوح لديه.,True,True
127258,abuse,تَعسُّف,abus,http://www.arabterm.org/index.php?id=40&L=1&tx_3m5techdict_pi1[id]=127258,في الاصطلاح اللغوي، عسف فلان فلانا عسفا وتعسفه ظلمه ويرادفه الشطط وهو مجاوزة القدر في الأمور والجور والظلم والبعد عن الحق.,True,True
127259,abuse of authority; abuse of power,تَعسُّف في استعمال السلطة,abus d'autorité; abus de pouvoir,http://www.arabterm.org/index.php?id=40&L=1&tx_3m5techdict_pi1[id]=127259,هو انحراف  من قبل مسؤولي الدولة  على اختلاف مراتبهم ومهامهم، في ممارسة الصلاحيات التي حددها لهم القانون، والذي نص على جزاءات تخص كل تجاوز في  تصرفاتهم، كما تكون  القرارات التعسفية  معرضة للإلغاء من طرف القضاء الإداري .,True,True
127260,abuse of company's assets,إساءة استعمال أموال الشركة,abus de biens sociaux,http://www.arabterm.org/index.php?id=40&L=1&tx_3m5techdict_pi1[id]=127260,جريمة منصوص عليها بقوانين الشركات، تتمثل عناصرها في استعمال أموال الشركة وائتماناتها من طرف الجهاز المسير لها وذلك لأغراض شخصية وليس لمصلحة الشركة.,True,True
127261,abuse of confidence; breach of trust,خيانة الأمانة,abus de confiance,http://www.arabterm.org/index.php?id=40&L=1&tx_3m5techdict_pi1[id]=127261,جريمة تقوم على اختلاس أو تبديد أمتعة أو نقود أو بضائع أو سندات أو وصولات أو أوراق من أي نوع تتضمن أو تنشئ التزاما أو إبراء بسوء نية، اضرارا بالمالك أو واضع اليد أو الحائز، كانت سلمت إلى مرتكب هذه الجريمة على أن يردها، أو سلمت إليه لاستعمالها أو استخدامها.,True,True
127262,abuse of right,تَعسُّف في استعمال الحق,abus de droit,http://www.arabterm.org/index.php?id=40&L=1&tx_3m5techdict_pi1[id]=127262,انحراف بالحق عن الغاية التي أقر من أجلها مثل حالة الطلاق في مرض الموت قصد حرمان الزوجة من الميراث.,True,True
127263,abusive dismissal,فَصْل تعسُّفيّ، عَزْل تعسُّفيّ,congédiement abusif; licenciement abusif,http://www.arabterm.org/index.php?id=40&L=1&tx_3m5techdict_pi1[id]=127263,قيام المشغِّل بإنهاء عقد عمل غير محدد المدة، خارج الأسباب التي حددها القانون، ويترتب على هذا التجاوز وجوب دفع تعويضات للأجير من طرف المشغِّل المتعسِّف.,True,True
127264,abusive rescission,فَسْخ تعسُّفيّ,rupture abusive,http://www.arabterm.org/index.php?id=40&L=1&tx_3m5techdict_pi1[id]=127264,فسخ انفرادي من طرف واحد، ويلزم مرتكبه بتعويض الطرف الثاني عما لحقه من ضرر بسب ذلك.,True,True
127265,abusus,استنفاد الحق,abusus,http://www.arabterm.org/index.php?id=40&L=1&tx_3m5techdict_pi1[id]=127265,,True,True
127266,acceptable,مقبول,acceptable,http://www.arabterm.org/index.php?id=40&L=1&tx_3m5techdict_pi1[id]=127266,,True,True
127267,acceptable solution,حلٌّ مقبول,solution acceptable,http://www.arabterm.org/index.php?id=40&L=1&tx_3m5techdict_pi1[id]=127267,,True,True
127268,acceptable suggestion,اقتراح مقبول,suggestion acceptable,http://www.arabterm.org/index.php?id=40&L=1&tx_3m5techdict_pi1[id]=127268,,True,True
127269,acceptable to all parties,مقبول من جميع الأطراف,acceptable par toutes les parties,http://www.arabterm.org/index.php?id=40&L=1&tx_3m5techdict_pi1[id]=127269,,True,True
127270,acceptance,قَبُول,acceptation,http://www.arabterm.org/index.php?id=40&L=1&tx_3m5techdict_pi1[id]=127270,موافقة من وجه إليه عرض أو جواب من شخص معين، وبتمام القبول تلتقي إرادة طرفي العقد ويتكون العقد.,True,True
127271,acceptance credit,اعتماد بقبول (كمبيالات),crédit par acceptation,http://www.arabterm.org/index.php?id=40&L=1&tx_3m5techdict_pi1[id]=127271,نوع من الكفالة تنشأ عن الضمان الاحتياطي الذي يلزم الطرف الضامن بدفع قيمة السند في ميعاد الاستحقاق  في حالة عجز المضمون عن الوفاء. ويحل الكفيل محل الدائن ويكون له حق الرجوع على المدين لاستيفاء ما أداه عنه من مبالغ.,True,True
127272,acceptor,قابل (ال..),accepteur,http://www.arabterm.org/index.php?id=40&L=1&tx_3m5techdict_pi1[id]=127272,الذي يقبل عرضا موجها إليه أو المتعاقد الذي ينتظر الوفاء بالتزام، سواء تعلق الأمر بانجاز خدمة أو استيفاء أجرة أو دين.,True,True
127273,accession,التصاق,accession,http://www.arabterm.org/index.php?id=40&L=1&tx_3m5techdict_pi1[id]=127273,سبب من أسباب اكتساب الملكية، ويقصد به الالتصاق الذي ينشأ في حال الاندماج المادي لشيئين يصعب فصلهما من دون تلف أو ضرر،  وذلك إما بفعل الطبيعة، كحق امتلاك ما جرفه السيل من طمي وأضافه إلى أرض أخرى، أو بفعل الإنسان.,True,True
127274,accessory,تابِع، ملحق,accessoire,http://www.arabterm.org/index.php?id=40&L=1&tx_3m5techdict_pi1[id]=127274,الملحقات أو التوابع هي كل ما يضاف إلى الشيء ممّا هو لازم لحسن استعماله بما تقتضيه طبيعته، فملحقات العقار مثلا هي كل ما هو ضروري للانتفاع به.,True,True
127276,accessory commercial acts,أعمال (ال..) التجارية التبعية,actes commerciaux accessoires,http://www.arabterm.org/index.php?id=40&L=1&tx_3m5techdict_pi1[id]=127276,الأعمال التي لا تكتسب الصفة التجارية إلا إذا صدرت من تاجر يقوم بها لأمور تتعلق بأعمال تجارته، كاكتراء (استئجار) محل من أجل ممارسة التجارة، أما إذا كان الاكتراء من أجل السكن الشخصي أو العائلي فهو يعد مدنيا من جانبه.,True,True
127275,accessory follows principal (the ..),فرع (ال..) يتبع الأصل,accessoire (l'..) suit le principal,http://www.arabterm.org/index.php?id=40&L=1&tx_3m5techdict_pi1[id]=127275,الفرع يتبع الأصل وإذا سقط الأصل سقط الفرع، مثل حق الرهن الذي ينقضي وقت الوفاء بالدين، وكذلك الأعمال التجارية بالتبعية هي أعمال مدنية بطبيعتها، ولكنها تكتسب الصفة التجارية بسبب صدورها عن تاجر.,True,True
127277,accessory obligation,التزام تبعيّ,obligation accessoire,http://www.arabterm.org/index.php?id=40&L=1&tx_3m5techdict_pi1[id]=127277,التزام يكون تابعا للالتزام الأصلي، كالتزام الكفيل مثلا.,True,True
127278,accessory penalty,عقوبة تبعية، عقوبة إضافية,peine accessoire,http://www.arabterm.org/index.php?id=40&L=1&tx_3m5techdict_pi1[id]=127278,عقوبة تلحق بالعقوبة الأصلية في حالات معينة إما بقوة القانون أو بحكم القاضي، كحرمان المحكوم عليه من ممارسة بعض الحقوق لمدة معينة أو مصادرة أملاكه أو المنع من مزاولة المهنة، ومثالها أيضا  الحرمان من الإرث لقاتل مورثه عمدا.,True,True
127279,accessory real rights,حقوق عينية تبعية,droits réels accessoires,http://www.arabterm.org/index.php?id=40&L=1&tx_3m5techdict_pi1[id]=127279,الحقوق لا تقوم مستقلة بذاتها، وإنما تستند في وجودها إلى حق شخصي آخر كالرهن الذي يتبع الدين ويضمن الوفاء به والامتيازات.,True,True
127280,accident,حادث، إصابة,accident; sinistre,http://www.arabterm.org/index.php?id=40&L=1&tx_3m5techdict_pi1[id]=127280,طارئة تصيب الإنسان وتتسبب له في ضرر جسدي أو مادي أو معنوي يستوجب التعويض بناء على ما قرره القانون بالنسبة لحوادث  السير أو الشغل أو ما شابه ذلك.,True,True
127281,accident insurance,تأمين الحوادث,assurance des accidents,http://www.arabterm.org/index.php?id=40&L=1&tx_3m5techdict_pi1[id]=127281,تأمين يبرمه المشغل مع إحدى شركات التأمين من أجل تغطية المخاطر والحوادث  التي يمكن أن يتعرض لها الأجراء، بحيث تحل شركة التأمين محل المشغل في أداء التعويضات المستحقة للأجير عند إصابته بحادثة مثلا.,True,True
127282,accident of passage,حادثة طريق,accident de trajet,http://www.arabterm.org/index.php?id=40&L=1&tx_3m5techdict_pi1[id]=127282,الحادثة التي تصيب الأجير  أثناء تنقله بين محل الشغل ومحل الإقامة أو بين محل الشغل والمحل الذي تناول فيه طعامه أو بين المحل الاعتيادي لتناول الطعام ومحل الإقامة. ويعامل المشرع حادثة الطريق على أنها حادثة شغل تمنح للأجير كافة التعويضات المستحقة.,True,True
127283,accidental,عارِض، طارِئ,accidentel; fortuit,http://www.arabterm.org/index.php?id=40&L=1&tx_3m5techdict_pi1[id]=127283,,True,True
127284,accidental case,حادث عارِض، حادث فجائيّ,cas fortuit,http://www.arabterm.org/index.php?id=40&L=1&tx_3m5techdict_pi1[id]=127284,حادث لا يكون فيه يد للمدين أو للذي وقع منه الضرر، فهو حادث غير متوقع الحدوث وغير ممكن الدفع، يجعل تنفيذ الالتزام مستحيلا.,True,True
127285,accomplice; partner (in crime),متواطئ، شريك (في جريمة),complice,http://www.arabterm.org/index.php?id=40&L=1&tx_3m5techdict_pi1[id]=127285,يعتبر مشاركا في الجناية أو الجنحة من لم يساهم مباشرة في تنفيذها ولكنه  أمر بارتكاب الفعل أو حرض على ارتكابه، وقدم أسلحة أو أدوات أو أية وسيلة أخرى استعملت في ارتكاب الفعل، مع علمه بأنها ستستعمل لذلك.,True,True
127286,according to law,طبقا للقانون، وَفْقا للقانون,conformément à la loi; d'après la loi; selon la loi,http://www.arabterm.org/index.php?id=40&L=1&tx_3m5techdict_pi1[id]=127286,,True,True
127287,account,حساب,compte,http://www.arabterm.org/index.php?id=40&L=1&tx_3m5techdict_pi1[id]=127287,,True,True
127288,account book,دفتر محاسبة، سِجلّ حسابات,registre de comptabilité; registre des comptes,http://www.arabterm.org/index.php?id=40&L=1&tx_3m5techdict_pi1[id]=127288,مسك دفاتر أو سجلات الحسابات  من واجبات التاجر بحكم القانون، سواء كان شخصا طبيعيا أو معنويا  كالشركة وكذلك أصحاب المهن الحرة، وذلك لتكون أداة إثبات في المنازعات وأساسا لاحتساب الوعاء الضريبي.,True,True
127289,account holder,صاحب الحساب,titulaire d'un compte,http://www.arabterm.org/index.php?id=40&L=1&tx_3m5techdict_pi1[id]=127289,الشخص الذي يقوم بفتح حساب في مؤسسة بنكية معينة.,True,True
127290,account number,رقم حساب,numéro de compte,http://www.arabterm.org/index.php?id=40&L=1&tx_3m5techdict_pi1[id]=127290,,True,True
127291,accountancy expertise,خبرة محاسبية,expertise comptable,http://www.arabterm.org/index.php?id=40&L=1&tx_3m5techdict_pi1[id]=127291,خبرة تأمر بها المحكمة في بعض القضايا وتعهد بالقيام بها إلى خبير محاسبي من أجل التأكد من بعض المعطيات المحاسبية أو إجراء محاسبة بين طرفي الدعوى أو غير ذلك من الأمور المحاسبية.,True,True
127292,accountant,محاسِب,comptable,http://www.arabterm.org/index.php?id=40&L=1&tx_3m5techdict_pi1[id]=127292,الشخص الذي يتولى أمور المحاسبة.,True,True
127293,accounting,محاسَبة,comptabilité,http://www.arabterm.org/index.php?id=40&L=1&tx_3m5techdict_pi1[id]=127293,مجموعة من القواعد العلمية تتناول طرق تسجيل وتبويب وتحليل وتلخيص المعاملات المالية سواء أكانت لمؤسسات إدارية أم تجارية خاصة، وذلك بتوفير بيانات دقيقة عن ميزانها المالي بهدف ترشيد قرارات المسؤولين عنها.,True,True
127294,accounting department,قسم الحسابات,département de comptabilité,http://www.arabterm.org/index.php?id=40&L=1&tx_3m5techdict_pi1[id]=127294,قسم خاص بالمحاسبة يكون في شركة  أو إدارة معينة، ويضم مجموعة من المحاسبين ومعاونيهم ويتكفل بوضع المحاسبة وبكافة الإجراءات المتعلقة بها.,True,True
127295,accreditation,اعتماد,accréditation,http://www.arabterm.org/index.php?id=40&L=1&tx_3m5techdict_pi1[id]=127295,,True,True
127296,accumulation,تراكُم,accumulation,http://www.arabterm.org/index.php?id=40&L=1&tx_3m5techdict_pi1[id]=127296,,True,True
127297,accumulation of debt,تراكُم الديون,accumulation des dettes,http://www.arabterm.org/index.php?id=40&L=1&tx_3m5techdict_pi1[id]=127297,,True,True
127298,accusation; indictment,اتِّهام,accusation; inculpation,http://www.arabterm.org/index.php?id=40&L=1&tx_3m5techdict_pi1[id]=127298,قرار يوجه للمتهم  في القضايا الجنائية بعد تحريك الدعوى العمومية من قبل النيابة العامة بناء على ما يبلغها من حالات التلبس بالجنايات والجنح أو شكاوى المتضررين من جرائها.,True,True
127299,accusational system,نظام اتهاميّ,système accusatif,http://www.arabterm.org/index.php?id=40&L=1&tx_3m5techdict_pi1[id]=127299,نظام يتميز بوجود شخص يتقدم بالاتهام ويتصدى للمتهم خلال جميع إجراءات المحاكمة، ومن خصائصه الشفوية والعلنية وتجري أمام قضاة الشعب باعتبار أن المتهم مسؤول أمام كل أفراد الجماعة التي ينتمي إليها.,True,True
127300,accused,متَّهَم,accusé; inculpé,http://www.arabterm.org/index.php?id=40&L=1&tx_3m5techdict_pi1[id]=127300,الشخص الذي يوجه إليه اتهام رسمي من النيابة العامة بارتكاب جريمة معينة، ويعتبر بريئا حتى تثبُت إدانته بمقتضى مقرر قضائي حائز لقوة الشيء المقضي به.,True,True
127301,achievement,إنجاز، إتمام,réalisation,http://www.arabterm.org/index.php?id=40&L=1&tx_3m5techdict_pi1[id]=127301,,True,True
127302,acknowledgement,إقرار، تأييد، إعلام,reconnaissance,http://www.arabterm.org/index.php?id=40&L=1&tx_3m5techdict_pi1[id]=127302,,True,True
127303,acknowledgement of debt; recognition of debt,إقرار بدَيْن,reconnaissance de dette,http://www.arabterm.org/index.php?id=40&L=1&tx_3m5techdict_pi1[id]=127303,إقرار يحرره المدين يقر من خلاله بكونه مدين بمبلغ معين أو بالتزام معين في مواجهة شخص ما.,True,True
